"UniProtID","tokens"
"Q8BRH4","MSS EE DR SA EQ QQPP PAPP EE PGA PA PSP AA AD KR PRGR PR KDG A SP FQ RAR KK PRSR GK STV EDED SMD GL ET TET EN IV ET EI KEQ SVEE DA ET EV DSS KQ PV SAL QR SV SEE SA N SLV SV GV EA KI SEQL CA FC Y CG EK SSLG QG DL KQ FRV TPGL TL PW KD QP SN KDI DD N SSG TC EK IQ NYA PR KQ RG QR KER PP QQ SAV SCV SVST QTA CED QAG KL WD EL SLV GL PD AI DV QAL FD STG TC WA HHR CV EW SLG IC QM EE PLLV NV DK AVV SGST ER CA FC KHL GA TI KC CEE KC TQ MY HY PC AAG AG TFQ DF SH FF LLC PEH ID QA PER SK EDA NC AV CD SP GD LL DQ FF CTT CG QH Y HG MCL DI AV TPL KR AG W QC PE CKV C QN CKQ SG ED SK MLV CD TCD KG YH TF CL QPV MK SVPT NG W KC KN CR ICI ECG TR SS TQ W HH N CLI CD TC YQQ QD NL CPF CG KC Y HP ELQ KD ML HC NM CKR WV HL EC DK PT DQ ELD SQL KED Y IC M YC KHL GA EID PLH PG NEV EM PEL PTD YA SGM EI EG TED EVV FLEQ TV NK DV SD HQ CR PG IV PDV QV YT EE PQ KSN PL ESP D TV GL IT SESS DN KM NP DL AN EI AH EV DT EK TE ML SK GR HV C EED QN ED RM EV T ENI EVL PH QT IV PQ ED LLL SED SEV A SKEL SP PK SA PET AA PEA LL SPH SER SL SC KE PLL TER VQ EEM EQ KEN SEF STG CV DF EM TL AVD SCD KD SSC QG DK YV EL PAEE EST FSS AT DL NKA DV SSSS TLC SDL PSC D ML HGY PPA FN SAAG SIM PT TYI SV TP KIG MG KPA IT KR KF SPGR PR SK QGA WSN HN TV SP P SWA PD T SEG R EI FK PR QL SGSA IW SI KVG RG SG FPG KRR PR GA GL SGR GG RGR SKL KSG IG AV VL PGV SAA DI SSN KD EEEN SM HN TVVL FSS SD KF TL QQ DM CVV CG SFG QGA EGR LLA CSQ CG QC YH PY CV SI KI TKV VL SKG WR CL EC TV CEA CGKA TD PGR LLL CDD CDI SY HTY CLD PPL QTV PK GG W KC KW CV W CRH CG AT SAGL RC EW QN NY TQ CA PCA SL SSC PV CCR NYR EEDL ILQ CR QC DR WM HAV CQ NL NT EEEV EN VA DIG FD CSM CR PY MPV SNV PSS DC CD SSL VA QIV TKV KEL D PP KTY TQ DGV CL TE SGM SQL QSL TV TA PRR KR TKP KLKL KII NQ N SVA VL QT PP DI QSE HSR DG EM DD SREG EL MD CDG KSE SS PER EAG DD ET KGI EG TDA I KKR KR KP YR PGI GG F MVR QR SR TG QG KA KR SV VR KD SSG SI SEQL PSR D DG WR EQL PD TL VD EPV SVA EN TD KI KKR YR KR KN KLEE TF PA YL QEA FFG KDLL DT SR QN KL SVD NL SED AAQL SF KTG FL DP SS DP LL SSSS TSA KPG TQG TA DD PLA DI SE VLN TD DD ILG II SD DL AK SV DH SD IG PT TA DA SSL PQ PGV SQ SSR PL TEE QL DG IL SPEL DK MV T DGA ILG KLY KI PEL GG KDV EDL FTA VL SPA TT QPA PL PQ PPPP PQ LL PM H NQ DV FSR MPL MN GL IG PSP HL PH NSL PPG SGLG TF PA IA QSP YT DV RD KSP AF NA IA SD PN SS WA PT TP SM EG END TL SNA QR STL KW EKEE ALG EMA TV AP VL YT NI NFP NL KEE FPD WTT RV KQ IA KL WR KA SSQ ER AP YV QKA RD NRA ALR IN KV QM SND SM KR QQQQ D SI DP SSR ID SDL FKD PL KQR ESE HEQ EW KFR QQ MR QK SK QQA KI EA TQKL EQV KN EQ QQQQQQQQ QQQQ QQL A SQ HLL VA PG SD TPSS GA Q SPL TPQ AG NG NV SP AQ TF HK DL FSK HL PG TPA ST PSD GV FV KPQ PPPP PST PSR I PV QE SLSQ SQ NSQ PPSP QM F SPG SSH SR PPSP VD PY AK MV GT PRPP PGG HSF PRR NSV TPV EN CV PL SSV PR PI H MN ETSA TR PSP AR DL CA SSM TN SD PY AK PP DT PR PM M TD QF SK PF SL PRSP VI SEQ ST KG PL TTG TSD HFT KPSP RT DA FQR QRL PD PY AG PSL TPA PLG NG PF KT PLH PP PSQ DP YG SVSQ TSR RL SVD PY ER PAL TPR PVD NF SH SQ SND PY SH PPL TP HPA M TE SF THA SR AF PQ PG TI SRSA SQD PY SQPP GT PRPL ID SY SQ TSG TAR SN PD PY SQPP GT PR PN TID PY SQ QPP TPR PSP QTD M FV SSVA NQR HTD PY TH HLG PPR PGI SV PY SQPP AV PRPR T SEG FTR PSS AR PAL M PN QD PFL QAA QN RV PGL PGPL IR PPD TC SQ TPR PPG PGR ID TF THA SS SAV RD PY DQ PP VT PR PH SE SF GT SQ VV H DLV DR PVPG SEG NF STSS NL PVSS QG QQ F SSV SQL PG PV PT SGG TD TQ NTV NM SQ AD T EKLR QR QKL R EI IL QQQQ QKK IA SR Q EKG PQ DT AVV PH PVPL PH WQ PE SI NQA FTR PPPP YPG STR SP VI PPLG PR YAV FP KD QRG PY PPEV AG MG MR PHG FR FG FPG AG HG PM PSQ DR FHV PQQ I QG SGI PP HI RR PM SM EM PR PSN N PPL NN PV GL PQ HF PP QGL PV QQ HN ILG QA FI EL RH RA PDG R SRL PF AA SPSS VI ESP SH PR HG NFL PR PD FPG PR HTD PIR QPSQ CL SN QL PV HP NL EQV PP SQQ EQG HPA HQ SS IV MR PL NH PL SG EF SEA PL STST PA ET SPD NL EI AG Q SSA GLEE KLD SD DP SV KEL DV KDL EGV EV KDL DD EDL ENL NL DT EDG KGD DLD TLD NL ET ND PNL DD LLR SG EF DI IA YTD PEL DL GD KK SM FN EEL DL NV PI DD KLD NQ CA SV EP KT RD QGD KT MVL ED KDL PQR K SSV SS EI KT EAL SPY SKEE IQ SEI KN H DD SRG DAD TA CSQ AA SAQ TN HSD RG KTA LL TTD QD ML EK RC NQ EN AG PVV SAI QG STPL PAR DV MN SC DI TG ST PVL SSLL SN EK CDD SD IR PSG SSPP SL PI SPST HG SSL PPTL IV PPSP LL DN TV N SNV TVV PR IN HA FSQ GV PV NPG FI QGQ SSV NH NLG TG KPT NQ TVPL TN QSS TM SG PQ QL MI PQ TLA QQ NR ER PLLL EE QP LLL QDLL DQ ER QEQ QQ QR QM QAM IR QR SE PF FP NI DF DAI TD PI MKA KMV AL KG IN KV MA QN SLG MPP MV MSR FPF MG PSV AG TQ NN DG Q TLV PQ AV AQ DG SI TH QI SR PN PP NFG PG FV ND SQR KQ YEE WL QET QQ LL QM QQ KYL EEQ IGA HR KSKK ALSA KQR TA KK AGR EF PEE DA EQL KHV TEQ Q SMV QK QLEQ IR KQQ KE HA ELI ED YR IK QQQQQQ QC ALA PP IL MPG VQ PQ PPLV PG AT SL TM SQ PN FP MV PQ QL QH QQ HT AVI SG HT SP AR M PSL PG WQ SN SASA HL PL N PPR IQ PP IA QLSL KT CT PAPG TV SSA NPQ NG PP PRV EF DD NN PF SE SF QER ER KE RLR EQ QER QRV QL MQ EV DR QRAL QQ RM EM EQ HCL MGA ELA NR TPV SQM PF YG SDR PCD FLQ PPR PL QQ SP QH QQQ IG PVL QQQ NV QQG SV NSP PN QTF MQ TN EQR QVG PP SFV PD SPSA SGG SP NFH SV KPG HG NL PG SSF QQ SPLR PP FTP IL PG TSP VA NSN VP CG QD PAV TQG QN YSG SSQ SLI QLY SD II PEE KGKK KR TR KKKK DD DA ESG KA PST PH SD CAA PL TPGL SET TST PAV SSP SEL P QQR QQ EPV EPV PV PT PNV SA GQ PCI ESEN KL PN SE FI KET SN QQ THV NA EAD KP SV ET PN KT EEI KL EKA ET QPSQ ED TKV EE KTG NKI KD IV AG PVSS IQ CP SH PV GT PT T KGD TG N ELL KH LL KN KKA SSLL TQ KP EG TL SSD ESS TK DG KLI EKQ SPA EGL QTL GA QM QGG FGG GN SQL PKT DGA SEN KK QR SK RT QR TGEK AA PR SKK R KKD EEEK QA MY SSSD SF THL KQQ NNL SN PP T PPA SLPP TPP PMA C QK MA NG FA TT EEL AG KAG VLV SH EV AR AL GP KP FQL PFR PQ DD LLA RA IA QG PK TV DV PASL PT PPH NN H EEL RI QD HYG DR DT PD SFV PSS SP ESV VGV EV NKY PDL SL VK EE PP EPV PSP II PIL PSI SG KN SESR RN DI KT EPG TL FF TSP FG SS PNG PR SGL I SV AI TLH PTAA EN ISS VV AA FSD LL HV RI PN SY EV SN AP DV PPM GLV SSH RV NPSL EYR QH LLL RG PPPG SA NPP RL AT SY RL KQ PNV PF PP TSN GL SGY KD SS HG PA EGA SLR PQ W CC HC KVV ILG SG VR KSC KDL TFV NKG SR EN TKR M EKD IV FC SN NC FIL YSS AAQA KN SD NKE SL PSL PQ SPM KE P SKA FH QY SN NI STL DV HCL PQ FQ EKV SP PASP PI SF PP AF EAA KV ESK PD EL KVTV KL KP RLR TV PV GL ED CR PL NKK WRG MK WKK W SIH IV IP KG TF KPP CED EID EFL KKL GT CL KPD PV PKD CR KC C FC HEE GD GL TDG PAR LLNL DLDL WV HL NC ALW ST EVY ET QAG ALI NV EL ALRR GL QM KCV FC HK TG AT SGC HR FR CT NI YH FT CA TKA QC M FF KD KT ML C PM H KP KG IH EQQL SY FAV F RRV YV QRD EV RQ IA SI VQ RG ER DH TF RVG SLI FH TI GQ LL PQQ M QA FH SP KAL F PVG YEA SRL YW STR YA NRR CR YL CSI EE KDG R PV FV IR IV EQG H EDL VL SDSS PK DV W DK IL EPV A CVR KK SE ML QL FPA YL KG EDL FGL TV SAV AR IA ESL PGV EAC EN YT FR YG RN PL MEL PL AV NP TG CAR SE PKM SA HV KR F VLR PH TL NST ST SK SF Q STV TG EL NA PY SK QFV HSK SS QY RR MKT EW K SNV YL AR SR IQ GL GLY AAR DI EK HT MVI EY IG TI IR N EVA NR KEKL Y ESQ N RGV YM FR MD ND HVI DA TL TGG PA RY INH SCA PN CVA EVV TF ERG HKI II SSN RR IQ KG EEL C YD YK FD F EDD QH KI PC HCG AV NCR KW MN"
"Q8C6K9-2","MLL VL CL TM IC FHV CV NQD SG PE YA DVV FL VD SSD HL GL KSF PLV KT FIH KMI SSL PI EA NKY RV AL AQ YSD AL HN EF QLG TF KNR NP ML NHL KK NFG FI GGSL KI GN ALQ EA HR TY FSA PT NG RD KK QF PP ILV VLA SA ESED DV EEAA K ALR ED GV KII SV GV QKA SEE NL KA MA TSQ FH F NLR TAR DL SV FA PN MT EI IK DV TQ YR EG MAD DI IV EA CQG PSV A DV VF LLD MAI NG SQ EDLD HL KA FLG ESI SAL DI KEN CM RV GLV TY SN ET RVI SSL STG NN KT EVL QR IQ DL SP QVG QA Y TGA ALR KT RK EI FSA QRG SR KN QGV PQ IA VLV TH RA SED NV TK AAV NL RR EGV TI FT MGI EG AN PD ELEK IA SH PA EQ FT SKL G NF SELA TH NQ TFL KKLR NQI TH TVSV F SER TE TL KSA CV DT EEA DI YLL I DG SGST Q PTD FH EM KT FL SEV VG MF NIA PH KV RVG AV QYA DT WDL EF EI SKY SN KP DLG KAI EN IR QM GG NTN TGA AL NF TL KLLQ RA KK ERG SKV PC HLV VL TNG M SRD SVLG PAH KLR EE NI RV HA IG VK EA NQ T QLR EI AG EE KRV Y YV H EFD ALR NI RN QV VQ EI CA EEA CR DM KA DI MFL VD SSG SI GP EN FSK MKM FM KNL V SK SQ IG AD RV QIG VV QF SH EN KEE FQL NTF MSQ SD IA NAI DRM TH IG ET TLTG SAL TFV SQ YF SPD KG AR PNV RK FLIL IT DG EA QD IV RD PAI AL RK EGV II YSV GV FG SN VT QL EEI SG KPE MV FYV EN FD IL QHI EDDL VLG IC SPR EEC KRI EVL DVV FV ID SSG SI DY QEY NI MKD FM I GLV KKA DVG KN QVR FG AL KYA DD PE VLF YL DEL GT KL EVV SVL QND H PM GG NTY TA EAL AF SD HM FT EA RG SRL H KGV PQ VL IV IT DG ESH DA EKL NT TA KAL RD KG IL VLAV GI AG AN SW ELL AM AG SSD KY YFV ET FG GLKG IF SDV SASV CN SSKV DC EI EKV DLV FL MDG SN SIH PDD FQ KM KG FLV SVV QD FDV SLN RVR IG VA QF SD SYR SEF LLG TF TGER EI ST QI EGI QQI FG Y TH IGD ALR KV KYY FQ PD MG SR IN AG TP QV LLVL T DGR SQD EV AQ AA EEL RH KGV DIY SVG IG DV DD QEL V QI TG TA EKKL TV HN FD EL KKV KKR IVR NI CT SGG ESS"
"P20693-3","MD TH HTG YW EPP R KR CC CA RR GT QL ML VG LLST AM WAG LLA LLLL WH WET EK NL KQL GD TA IQ NV SHV TKDL QK FQ SN QL AQ KSQ VV QM SQ NL QEL QA EQ KQ MKA QD SRL SQ NL TGL QE DLR NA QSQ N SKL SQ NL NRL QD DLV NI KSL GL N EKR TA SD SL EKL QEE VA KL WI EIL I SKG TA CNI CP KN WL HF QQ KC YY FG KG SKQ WI QAR FA C SDL QG RLV SI HSQ KEQ D FLM QH IN KKD SWI GL QDL NM EG EFV W SDG SPVG YSN WN PG EPN NGG QG ED CV MM RG SGQ WN DA FCR SYL DA WV C EQLA TC EI SA PLA SV TPT R PT PK SE P"
"Q148R9","MAR EE CKA LLD ALN KT TAC YH HL VLTV GG SAD TQ DLR EEL QKT RQ KAR EL AVA TGA RL TV ALR DR SL AT EE RA EF ERL WVA FSG CL DLL EA DM QR ALAL GA TF PL HA PRR PL VR TG VT GG SSAV AAR AL SAR SL RH EA ESD F DVA DL PQL ER EVL QVG EMI DD MEM KV NV PR WTV QA RQ AAGA ELL SGA SAGA SSA GGI SV EER AG PC DP SK ALAA TVF SAV LLV AV ALAL CVA KL S"
"Q91YJ2","M EQA PP DP EK LLQ PGPL EPL GG PGA VL EAA VG EEN EG TR EDG SG VD TM TG NN FWL KKI EI SV SEA EKR TG RN AV NM QET YTA YLI ETR SV EHA DG Q SVL TD SLW RRY SEF ELLR NY LLV YY PH VVV PPL PEK RA EFV WH KL SA DN MD PD FV ERR RV GL EN FLL RVA SH PVL CRD KI FY SFL TQ EG NW KE TV N ETG FQL KAD SRL KAL NA TF RV KN PD KR FT ELR HY SD ELQ SVI SH LLRV RA RV AD RL YG VY KV HG NYG RV FSE W SAI EK EMG D GLQ SAG HH MDV YA SSI DD IL EDEE H YAD QL KE YL FYA EALR AV CR KH ELM QY DLET AA QDL AA KK QQ C EELA TG TVR TF SLKG MTT KL FG QET P EQR EAR IK VLEE QI NEG EQQL KSK NL EGR EFV KNA WA DI ER FK EQ KNR DL KE ALI SY AVM QI SM CKK GI QV WT NA KE CF SKM"
"Q76KF0-2","MG FLLL W FC VLF LLV SRLR AV SF PED D EPL NTV DY HY SR QY PV FRG RP SGN ESQ HRL DF QL ML KI RD TL YI AG RD QV YTV NL NEI PQ TEV IP SKKL TWR SR QQ DR EN CA MKG KH KD EC HN FI KV FV PR ND EMV FV CG TNA FN PM CR YY RLR TL EY DG EEI SGL AR CPF DAR QT NV AL FA DG KLY SATV AD FLA SD AVI YR SMG DG SALR TI KYD SK WI KE PH FL HAI EYG NYV Y FF FR EI AV EH NNL GK AVY SRV AR IC KN DM GG SQR VL EKH WT SFL KARL NC SV PGD SF FY FD VLQ SI TDI IQI NG IP TVVG VF TT QL NSI PG SAV CA F SMD DI EK VF KGR FK EQ KT PD SV WT AV PED KV PK PR PGC CA KH GLA EAY KT SI DF PDD TLA FI KSH PL MD SAV PP IAD EP W FT KT RV RY RL TAI EV DR SAG PY QN Y TVI FVG SEA GV VL K VLA KT SP FSL ND SVLL EEI EA YN PA KC SA ESEE DR KVV SL QLD KD HH AL YV AF SSC VV RI PL SR CER YG SC KK SC IA SRD PY CG WL SQ GV C ERV TLG M LLL TED FFA FH NH SP GGY EQD TE YG NTA HL GD CHG VR WEV QSG ESN QMV H MN VL IT CV FAA FVL GA FI AGV AV YC YR DM FVR KNR KIH KDA ESA QSC TD SSG SFA KL NGL FD SPV KEY QQ NID SP KLY SN LL TSR KEL PP NTD TK SM AV DH RG QPP ELA AL PT PE ST PVL H QK TL QA MK SH SEK AH SH GA SR KEH PQ FF PSS PP PH SPL SHG H IP SAI VL PNA TH DY NT SF SN SN AH KA EK KLQ SM DH PL TK SS SKR EH RR SVD SR NTL ND LL KHL ND PN SN PKA ILG EIH MA HQ TL MLD PV GP MA EV PP KV PNR EA SLY SP PSTL PR NSP TK RV DV PT T PGV PM TSL ER QRG YH KN SS QR HSI SAV PK NL NSP NGV LLSR QP SM NR GG YM PT P TGA KV DYI QG TPV SV HL QP SLSR QSS YT SNG TLPR TGL KR TP SL KP DV PP KP SFV PQ TT SVR PL NKY TY"
"Q8C8U0-3","MM SDA SD ML AAAL EQ MDG II AG SK AL EY SN GI FD CQ SP TSP FMG SLR AL HLV EDL RG LL EM M ETD EK EGL RC QI PD STA EVL I EWL QNQ MT NG HL PG NG DVY QE RLA RL END KE SLVL QV SVL TD QV EA QG EK IR DL EF CL EE HR EKL NA TEE ML QQ ELL SR TSL ET QKL EL MA EI SNL KLKL TAV EKD RL DY EDR FRD TEGL IQ EI NDL RL KV NEM DG ERL QY EKKL KST KD ELA SL KE QLEE KE CEV KRL QE RL VC KA KG EGI EVL DRD ENI KKKL KEK NI EV QKM KK AV ESL MAA NEE KER KI EDL RQ CL SR YR KM QD PA VLA QG QD SEC EGL FH SSSI STLL DA QG F SDL ER ST SST PG MG SPSR DLL HT SA PEE FH TSVL QA SI PSLL PP SV DVD TC EK PKL PT KP ET SF EEG DG RA ILG AAA EV SLSD GV ST SSL QK SS SLG NL KK EA SDG TD KA PTD SR TFG TLPP KV PG HEA SV DD NP FG TR KAR SS FG RG FF KI KSG KR TASA P NLA ETEK ETA EHL NL AG TSR SKG SQ GT SP FPM SP PSP D SRKK SRG IM RL FG KLRR SQST TF NPD DM SE PE FKR GG TRA TAG P RLG WSR DL GQ SN SDL DM PFA KW TK EQ VC SWL A EQ GLG SYL SSG KH WII SG QT LLQA SQ QDL EKEL GI KH SL HR KKL QL ALQ ALG SEE ET NYG KLD FN WV TR WLD DI GL PQY KT QFD EG RV DGR ML HY MTV DD LLSL KVV SVL HHL SI KRA IQ VLR IN NF EPN CL RR RP SD EN SI TP SEV QQ WTN HRV M EWL R SV DLA EY AP NL RG SGV HG GL MVL EPR FNV ET MA QLL NI PP NKT LLRR HLA TH FN LL IGA EA QH QKR DA MEL PD YV LLTA TA KV KP KKL TF SN FG NLR KK KH EDG EE YV C PM ELG QASG SSQ KG FR PGL DM RLY EED DLD RLEQ MED SEG TV RQ IG AF SEG IN NL TH ML KED DM FKD F AAR SPSA SI TDED SNV"
"Q9R0H0","M NP DL RK ER AAA TF NP ELI TH IL DG SP EN TRR RR EI ENL IL ND PD FQ HED YN FL TR SQ RY EV AV KK SA TMV KK MR EFG IA DP EE IM W FK KLH MV NFV EPV GL NY SM FI PT LLN QG TTA QQ EK WM HP SQEL QI IG TY AQ TE MG HG T HLR GL ET TA TY DP KT QEF ILN SP TV TSI KW WPG GLG KT SN HAI VLA QL IT RG EC YGL HA FVV PIR EIG TH KPL PGI TVG DIG PK FG YEE MD NG YL KM DN YRI PR EN MLM KYA QV KP DG TYV KPL SN KL TYG TMV FVR SFL VG SAA QSL SK AC TIA IR Y SAV RR Q SEI KR SE PE PQ ILD FQ TQQ YKL FP LLA TA YA FH FL GR Y IK ETY MR IN ESI G QG DL SEL PEL HAL TA GL KAF TT WTA N AGI EE CR MA CGG HG YSH SSG IP NI YV TF TPA C TF EG EN TVM ML Q TAR FL MKI YD QV QSG KLV GG MV SYL NDL PSQ R IQ P QQV AV W P TLV DI N SLD SL TEA Y KLR AA RLV EI AA KNL QA QV SH RK SK EVA WNL TSV DLV RA SEA HC HYV TV KV FAD KL PKI QDR AV QA VLR NL CLL YSL YGI SQ KGG D FL EG NII TG AQ MSQ VN SR IL ELL TV TR PN AV ALV DA FD FK DV TLG SVL GR YDG NVY ENL F EWA KK SPL NKT EVH ESY YK HL KPL Q SKL"
"Q7TNV7","MKI SC FLLL ILSL YF FQ IN QA IG PD TKK CV QR KN AC H YF EC PWL YY SVG TC YKG KG KC CQ KRY"
"Q60778","MAG VA CL GK TA DAD EW CD SGLG SLG PD AAA PG GP GLGA EL GP EL SWA PLV FG YV TED GD TAL HL AV IH QH EP FL DF LLG F SAG TE YL DL QN DLG QT ALHL AA ILG EA STV EKL Y AAG AG VLVA ER GG HT ALHL AC RV RA HT CA CV LLQ PR PSH PR DA SD TYL TQ SQ DC TPD TSH APAA VD SQ PN PEN EE EPR DED WRL QLEA ENY DG HT PL HV AV IH KDA EMV R LLRD AGA DL NK PEPT CG RT PLHL AV EA QAA SVL ELLL KAG AD PTA RM YGG RT PLG SA LLR PN PIL AR LLRA HGA PE PED EDD KLSP CSS SG SDSD SD NRD EGD EY DD IV VH SGR SQ NR QPP SPA SKPL PDD PN PA"
"Q8K4P8-4","MLL HL CSV KNL YQ NR FLGL AA MA SPSR NSQ SRRR CKE PL RY SY NPD QFH NI DIR NG AH DAI TI PR ST SD TDL VT SD SR STL MV SS SYY SIG HSQ DLV IH WDI KEE VD AG DW IG MYL IG EV SS EN FL DY KN RGV NG SH RG QII WKI DA SSY FV ESET KI CF KYY HGV SG ALRA TT PSV TV KN SAA PI FKG IG SEE TAQ SQG SR RLI SF SLSD FQA MGL KKG M FF NPD PYL KI SI QPG KH SI FP AL PH HG QE RR STI IG NTV NPI WQA EH F SFV SL PTD VL EI EV KD KFA KSR PII KR FLG KL SM PV QRLL ER HA IG"
"O55070","M SLH PASP RLA SLLL FIL AL HD TLAL RLC SF NVR SF GA SKK EN H EAM DI IV KII KR CDL ILL MEI KD SSN NI CP MLM EKL NG N SRR ST TY NYV ISS RL GR NTY KEQ YA FV YK EKLV SV KT KY HY H DY QDG DT DV FSR EP FVV W FH SP FT AV KD FV IV PLH TT PET SV KEI D ELV DV YT DVR SQ WKT EN FI F MGD FN AG CSY VP KKA WQ NI RLR TD PK FV WL IG DQ ED TTV KK ST SC AY DRI VL CG QEI VN SVV PR SSGV FD FQ KA YDL SEE EAL DV SD HF PV EF KL QSS RA FTN NR KSV SL KKR KKG NR S"
"Q9D7Y9-3","MA SKK FAV KCG NFA VLV DL HVL PQG SN RD SS WF SEQ KK EV MA FR SQL I SSR EGY TF TV SR TPR ILN FV YFL KDL WC VLV SL HLV MI FG QTR MKN RQ KK PSM ECL II FL SV QRV HR LL VQ SSRG TL"
"Q14AT5-2","ML RG QAR EED SVVL ID MA SP EAG NG C SYG STA QA SEA GK QQ VA PSR VG SS AK PP ID F VLV WEE DLR NQ EN PT KD KTD TH EV WR ETFL ENL CLA GL KID QH DV QD EAA AVH YI LLRA PWA VL CY YA EDL RL KL PL QEL PN QA SN WSA TLL EWL G IP NI LL EHV PD TPP EY YSC QF KA SKL QW FLG SD NQD TF FT ST KR HQ IL F EIL A KT PYG HEK KGL FG ID Q LLA EG VF SAA F PLH DG PF SAV PE SSQ VL GLI QR QVL FQ HW AR WG KW NKY QPL D HV RRY FG EKV ALY FA WLG FY TG WLL PAA VVG TVV FL VG CFL VF SDI PT QEL CH SSD SF DM CPL CSD CSF WLL SSA CTL AQ AG RL FD HGG TV FF SL FM ALW AV LLL EY WKR KNA TLA YR W DC SDY EDI EER PR PQ FAA TA PM TAL NPI TG ED EPY FP EKN RV RR ML AG SVV LLM MV AVV IM CLV SV IL YR AV MAI IV SR SD NA FL SA WA SR IA SLTG SVV NL VF IL IL SKV YV LLAQ VL TR WEM HR TQ TEF ED AF TL KV FI FQ FV NF YA SP VY IA FF KGR FVG YPG NY HTL FG IR NEE CPA GG CL SEL AQ ELL VI MVG KQ II NNV QE VL VP KLKG C WQ KF SRG KK AG TG TH PA PW EA DY ELL PC EGL FH EYL EM VLQ FGFV TI FV AAC PLA PL FA LL NN WV EI RL DA RK FV C EY RR PVA ER AQ DI GI W FH IL TGL THL AVI SN AF LLA F SSD FL PRV YY SW TH AP DL HG FL NF TLA RA PP TF TSA HNR TCR YRA FR DD DG HY SP TY WT LL AI RLA FV IV FEH VV FSI GR VLD LLV PDI PE SV EI KV KR EY YLA KQ ALA EN EVTV GV TGG"
"Q8BP71-2","MA EGG QA QQ QPP QLG PG AGA DG PE PGL SKR PR TEE AAD GGM QN EPL TPG Y HG F PAR DG QG NQ EPT TT PDA MV QPF TTI PF PPPP QNG I PT E YGV PH TQ DY AG QT SEH NLTL YG ST QP HG EQ SSN SP SN QNG SL TQ TE GG AQ TDG QQ SQ TQ SS EN SESK ST PK RL HV SN IP FR FR DP DL RQ MFG QFG KIL DV EII FN ERG SKG FGFV TF EN SA DAD RAR EKL HG TVV EGR KI EV NNA TA RVM TN KK MV TP YA NG WKL SP VVG AV YG PEL YAA SSF QA DV SLG N EAAV PL SGR GG IN TYI PL II PG FPY PTAA TT AAA F RGA HL RG RGR TV YG AVR AV PP TAI PA YPG VV YQ DG F YGA DLY GGY AA YR YA QPA TA TAA TAA AAAA AAY SDG YG RVY TAD PY HAL APAA SYG VG AVA SL YR GGY SR FA PY"
"Q9DA16-3","MKA CD HKT CH SF KA EVLD CL YC KK TM PK CV KK KY CF ED GQ FR MTL KFQ DD NK PR NM VLVG DLV TV GLA ILT FLV IL IA QNR KLLL K"
"Q3UZA1","MEE RP SET NSN VD SS AQ PSV A QL AGR FR EH AAV AR ET PA SK PT RR KPP CSL PL FPP KV EL GQ NG EE KSP SGA SH PP KI KV KSS PLI EKL QA NLA FD PAA LL PGA SP KSP GL KA IV SP FH SP PST PSS PG IR SH PSEA EEV PV SF DQ PPEG THL PSY NKV RT RG SI KRR PPSR RF RR SQ SD CGD FRD YR AV EP SQ ENG AR EE NGD DV FA SK SKD PGSP QL NQ EA MA DGV EG TP WSA EK PRR RN TC NST EK PEEL VR TP EEA NAG EK VG QN PD TA SQG HP EV QA PSQ TG SP EA ENG CG SPR EE TT PG EH TD TG KA TEG TA SEE RV AD ED RLG QK SP DA NM PEE EG VVR EKA PQ T SSG KA EG TT IA EPD TKQ KEEA PL EP SC SPGA DH AAG EI T SEI QN EKAV SMD DI PI ED TRM"
"P28571","MI GGD TR AASA HPG MA SAQG PVA TPSP EQ PF PG TT SVSL AR PVL RV W HG AH SSG LL PNL IA QH SPA MA QNG AV PSEA TKK DQ NL TRG N WG NQI EF VLT SVG YAV GLG NV WR FP YL CYR NGG GA FM FPY FI ML IF CGI PL FF MEL SF GQ FA SQG CL GV WRI SP MF KG VG YG MM VV STY IG IY Y NVV IC IA FY Y FF SSM TH VL PWA YC NN PW NT PD CAG VLDA SNL TNG SR PAAL SGNL SHL FN YTL QR TSP SEE YW RL YVL KLSD DI GN FG EV RL PLLG CL GV SW VVV FL CLI RG VK SSG KVV YF TA TF PYV VL TIL FV RGV TLEG AF TG IM YYL TPQ W DK ILEA KVW GD AA SQI FY SLG CA WG GL IT MA SY NKF H NN C YRD SV II SI TN CA TSV YAG FV IF SIL GF MA NHL GV DV SR VAD HG PGL A FV AY PEAL TLL PI SPL W SLL FF FML ILL GLG TQ FC LL ETL V TA IVD EV GN EW IL QKK TYV TL GV AVAG F LLG IPL TSQ AG IY WLLL MD NY AA SF SL VVI SC IM CV SIM YI YG HR NY FQ DI QM ML GF PPPL FFQ IC WR FV SPA II FF IL IF TV IQ YR PI TY NH Y QY PG W AVA IG FL MAL SSV ICI PLY AL FQL CR TDG DT LLQ RL KN AT KP SRD WG PALL EHR TGR YA PT TT PSP ED GF EV QPL HPD KA QI P IVG SNG SSR FQD SRI"
"Q9CX98-3","M SSL GD QR PAAG EQ PGA RL HV RA T GGA LLL CLL AV LLG WV WL RR QRA CGI PPG PK PRPL VG NFG H LLV PR FLR PQ F WLG SG SQ TD TV GQ HV YL AR MA RV YG NI FSF FIG HRL VV VLSD FH SVR EALV QQA EVF SDR PRM PLI SIM TK EKG IV FA HYG PI WK QQ RR FSH STLR HF GLG KL SL EPR II EE FA YV KEA M QK HG EA PF SP F PII SN AV SN II CSL CFG QR FD YTN KE FKK ELR QI ER DI SC FL KNI IR EH QE SL DA SN PQD FI DM YLL HM EEEQ GA SRR SS FD ED YL FYI IG DL FI AG TD TT TN SLL W CLL YM SL NP DV QKK VH EEI ERV IG CD RA PSL TD KA QM PY TEA TI MEV QRL SM VV PL AI PH MT SEK TA"
"Q3U095","MRR ML SP RI LL SSL PNA SAR KL FLI VL II FV FW VV FM T SKD HT EF MV HL N NRI ILRR WSI FKE FLH SEEL KN TPA SV EAEL AV TA IL EKL N QQI PP RP FQ TH SSTT SA KQ STA TIH NP QR TY CV GD QL NV LLVA KDY FG NR KEY GGD FL RAR IF SPA MK AG TSG KV TD FN NG T YLV SF TL FW EG PV SLSI LLM HP SEG V SAL WRA RN RG YG KI IF TG QFL NG TSP VL TEC GL TL NT SA EL CQ YL DA RD HEA FY CL KL PGV PC EAL TH MT SKN SNI SYL SLEE KLL FRR FNI GV EV VK NL SI VV SLC NN KT N KKKK KC QIG MET PSP GG YTL KGR WI TA HC EQ NEF RAI KD IN NCL TR KLI YL MGD STL RQ W IY YL PKV VK TL KY FDR HG AG PF KT HI LL DT ER HI FV QW KK HSH PFV TN KL FSM KDD NYI PR EID QV AG DSG TA IVI SFG QH FR PF PI NV FI RR AI NV KN AI ERL FLR SP ET KV II KT EN IR EI N EHV EI FSD FHG SI Q NLI IR DI FR DL NVG II DA W DM TVA YR SED VH PP ESV I ESQ IG MFL NY IC"
"Q8VBT6","MD FL RLRL PGL HQ ALRG ALD SF SA FV SYL VGD TV PTV ER QTQ AA EELG EV TEG KV VG EE AQ EVL EGLR SGQ SEG V EA PEE TRR CQ EG SLAG EQ TWG WRA DSS AR PQA ER QD TG SW KAA EDA RG QEP SVPL KP EA EPG THR DR SSN TA QEI W EHG EEEA SSG EPL R TC EQ KEE EEEV VR AA ESG MA EGV ESQ PT WH SEPG GN AG TEG QHV TED SK EI DW VA KD MVA EI EW FGA KG ID KEE ER MV PMR DG ERA RA QG TQ C PGA ESED QA ML SR EA WTV SDR EG AD SLGV QG TE YG SD PGD NF PG TTG RV WVL EE AD KGD QQD EVD EKR EAEV RF PI QTL EAER TG EM TEG HIA EEEA MG EQ ET EG SF EDEE RQ DLA IRD NGV SLEE EV RA EE SSR EK RN SW AT EP TL VL DT EA KD EPD WED SPEV ST EEL FVG ER SEAA QM TPE VLRV KV TEG QD PEL VR HSQ AL TK QLEE GQ KG QEE TSG AP DL SP ER VLSL KEY PG PV GF AG PEL EA WG NW SR GVD RR NSQ EV KA DA EA GK EQ TA TEQ AV EI RA EGG QEA QQ PEV FG SGG EEAL TSV AL NP ELEG SQ GA EA GT EE SVEE SK PT EN EAA EEEA VV PW EA DG TCR KRRL EEV TLSL QD SED TET SYL A EEI IVG IR AV DT EEG PK WEA GL AP ET ELG KA WC SEG RG EAG RG TEL EE TT EKQ SGQ EV GLVG SA EKV SGY DI QEI DG T EEG EQA EM ET SV MA EDI RG T DGV TLG SQA ERA EG SI TPM ET EG LLRD QM LL EEEA GG GQ SR EQ KV HN SEG EI QTL DD SS DQ EG QQ TH QI PTV AV PGPL ESA EA T AGA PG DV HSN WN EALL PG SRL DV SV PR SRV LLSR SSSR RRSR PSF HRI SV PE PQ CD PPSP QP QA ER PV PEQ SSL QLEE TPEL SA TKP EG TPV PA RR KML G RG FG FA HPG M MQ ELQA RL SQ PK PQ"
"Q63934","MM MM SLN SK QA FSM PH AG SL HV EP KY SAL HSA SPG SS APAA PSA SS PSS SS NA GGGG GGGG GGGG GGR SSSS SSSG SGG SG GGGG SEA M RRA CL PTPP SNI FG GLD ESLL A RA EAL AAVD IV SQ SK SH HH HPP HH SP FK PDA TY H TM NTI PC TSAA SS SSV PI SH PSAL AG TH HHHH HHHH HH HQ PH QAL EG ELL EHL SPGL ALGA MAG PDG TVV STPA HA PH MA TM NPM HQA AL SMA HA HGL PSH MG CM SDV DAD PR DLEA FA ER FKQ RRI KL GV TQA DVG SALA NL KI PG VG SLSQ STI CR F ESL TL SH NN MI AL KP ILQA WL EEA EK SHR EKL TKP ELF NGA EK KRKR TSI AA P EKR SL EAY FA IQ PR PSS EKI AA IA EKL DLKK NVV RV W FC NQR QKQ KRM KY SA GI"
"Q6PIP5","M EAA NC SL RV KR P LLD PR F EGY KL SL EPL PC YQL ELD AAVA EV KLR DD QY TL EH M HA FGM YN YL HC DA WY QD SV YY ID NL GR IM NLTV ML DT AL GK PR EV FRL PT DV TA YD NRL CA SIH FT SP SWV TL SDG TG RL YV IG TGD RG NSP EK W EIM FN EELG NP FI II HSI SLL KAEE HSV AI LLL RI EK EEL DL KG SGF YV SL EW VV VT KK KED SKK YEI TKH HVL RG KSV PH Y AAI EP NG NGL MIV SY KSF KVI SG DQ DL EEN MD ED RP EKI KV EPL YY WQQ SED DL TVTV RL PE SS TK ED IQ IQ FL PD NI NI KLKD IQ VLEG KL YSS ID HEG ST WTI KEN DSL EI SLI KK N EGL MW PEL VV GD KQG ELL RD PA QC AA IA ERL MHL TSD ELN PN PD KEK PA CNA QEL EE CDI FF EE SSSL CR FDG N TLQ TT HVV NLG SN QYL FSV IV DP KEM PC FCL RH DV DALL WQ PH CSK QDD MW EH IA TF N ALG YV QA SK RD KK FFA CA PNY SYA ALC ECL RRV FI YR QPT PM ST VLY NR KEG R HVG QV AK QQ VA SLET ND PIL GF QA TN ERL FVL TT KNL FLI RV NT EN"
"Q9JL70","MPG SPA RG AAM GGG PR GLR KT W TE LLAG RV KK QKY DP ER EQ KLKD SAL KLLR YH QN M HD LLL EVEE PQ CK RLRL SEL I DRD SA DA SS DR SA SF IR SA FRD QA SRL GV PVG VLSA KV FAR SV QQV CV EP SH PV LLSP EQ SKKL SS LLM IA RH LLA QN MF SRL TF CQ ELW KA QN SLLL EA MW RLH TH SVV SL QE LLQ SH PD SEA MA M WL FR NLR SLC EQ IGA SC PSP D TT EA ML SGL VQ LLI SR GF QG SSD PR RLV EPE RL P QVA TD VL QR ML AF SLD TL EAD PQ TTL D CQ AV SG WI PI YSG H TC CG VV TEN SL KSF FSH TL TQ IL TH KP VLKV SDA IQ MQ KE W SFA KT HH LL TDL H CR VLA TL GP EE SVG RL QE VL EM QEV NW QH VL SCV STL VV C FP EA QQL V KG WVA SL MA RA F ESY HLD SMV TA FL IVR QA TLEG PYV FP SY AD WF KE SFG SS HG YH SC SKK TLV FL FK FL SDL VP WEA PR YM QV HI FH PPL VP SK YH SLL TD YI SLA KT RLA DL KV SL ENV GLY EDL SSPG DIA ER ESQ AV QDV KK AI MV FEQ TG KI PM PVL EA SI FRR PY YV SH FL PT LLA PR VL PEV PD PRV ALI ETL KRA D KI PSS IY DA YR KA CA SA EK QQ PEN AT SA QR TEA D CA KE PLG LLTA AL EELR ALM TD PT QY SVI SA QV AVV SEKL NA VLG HR ND GG SLQ RA KI QL SVL PSTL QKQ DQ AV VD LLL TA FC QNL MAA SS FV PP ER QSP WA VL FVR TL CG HV LLPA VL TRL RQ LLR HQG QSL ST SH VL GLA ALAV HLG ECR SML PEV D PD VL AP SAG SL CV PD FL NSLL TCR TRD SLL FC MN FC T AAV SY CLC KF SAL RN CL SP GLI KK FQ FV VLRL FP EA RA PCA PE HAA CV PWR PL YL PSA D WQ RAAL SLW RRD SF QELL KD KE FYL T YRD WV QLEL EI QP EAD VLSD MER HD FH Q WA IY ER YL PAPT ALGG CGG DL EEA CT VLV SEI MD FH Q SSR SY NH SED SDL VL GGR TG NKD IL SRL QEI ALDL ELD QG SA VP HG CST PQ SH FL FRV FRR RL QAL AR PD SMA TSL RR QQ ELL TC KR LLL CL PP SVLV GG PQ AG QPI SP NCG EF FSL VN SEL RN FC CHG SVL T SDI TI HFF RG LLRV CLR SQ DP ALVA NQ TL TEC QT KC PV IL TSA LL WW SSL EP VL CGR W MR C YQ SPL PR ELR RLQ EAR EFA SN FA SASA SPAP SPA WI AAA ALH FA WRG VR K EDV TA HL QRL DC QR EE LLI AL FF FSL MG LLSS YL TQR D TA EHL KAV DI CA EVL TCL ERR KV SWL VLF QL TEK DA KLG HLL HLA PD QH TR LL PLA FY SLL SC F SEG AA VR EAA FL HV AV DM YL KLL QL FV DG ET RL QGH SE SQG SPV QL IT KA RV FLL QLI PQ CP KQ CF SNM TE LLAG RGD CD PEV SN ALR QR QQ AD PSF DL YQ EP QLF"
"Q9CWB7","ML WF QG K SLQ IA KSS FG LLR NL SA SNR AL PVL TL FT KA PC PL CD EA KE VLQ PY KD RF IL QEV DI TL PEN ST WY ERY KF DI PV FHL NG QFL MM HRV NT SKL EK QLR KLEQ Q VLA TN"
