"UniProtID","tokens"
"Q2YFS1","MA LL ISL PG ET PA MA QI LLLL SSA CL HAG N SAR SN GG ND FGV NQ PER CSG VQ GG SI DI PF SFY FP W KLA KD PQM SIA WR WKD FFG H FI YN SS MP FIH EH FKG RL ILN WT QG QT SG VLR IL NF KE SD QT WY FC RV FL QTT EGI KF WQ SLPG TQL TL TQ ALN TT MR SP FIV TSE FT TA GL EH TRD KR NP SLM NL GA MV TM LLA KV VVI ILV YG W MI FLR WK QR PD PA"
"Q8R0T2","MER EA SSW GL ESR DV HSP N AVG SPEG SLKD PAG NT SEN EEG EI SQR EG NG DY EV EEI PF GL EPQ SP EF EPQ SP EF ESQ SP RF EPE SP GF ESR SPG FV PPSP EFA PRSP ESD PQSP EF ESQ SP KY EPR SPG CH PR SPG C EPG SP RY EP K SPG YG SKSP EF ESQ SPG Y ESQ SPG Y EPQ NSG DGV QN SE FKT HSP EF ET QSS KFQ EGA EM PLSP EE KN PL SI SLGV H PLD SF TQG FG EQ PTG ALPP FD M PSG A LLAA PQ F EML QN PLNL TGTL RG PG RR GG RAR GG QG PR PNI CGI CGKSF G RG STL IQ HQRIH TGEKPYKC EV CSK AF SQSS DLI KH QR TH TGER PYKC PR CGKAFA DSS Y LLR HQR TH SGQ KPYKC PH CGKA FG DSS Y LLR HQR TH SH ER PY SC PE CG KC YSQ N SSLR SH QRV HTG QR PF SC GI CGKSF SQR SAL I PH AR SH AR EK PFKC PE CG KR FG QSS VLA IH AR THL PGR TY SC PD CGKT FNR SSTL IQ HQR SH TGER PYR CAV CGKG FCR SS TLL QH HRV HSG ER PYKC DD CGKAF SQSS DL IR HQR TH AAG RR"
"P40240","MPV KGG SK CI KY LL FG FN FI FWL AG IA VL AI GL WLR FD SQ TK SI FEQ EN NH SS FY TG VY IL IG AG ALM ML VG FLG CCG AV QE SQ CML GL FFG FLL VI FAI EI AAAV WG Y TH KD EV IK ELQ EF YKD TY QKL R SKD EP QR ETL KA IH MAL DC CGI AG PL EQ FI SD TC PKK QLL ESF QV KP CP EAI SEV FN NKF HI IG AVG IGI AVV MI FGM IF SM ILC CAI RRSR EMV"
"Q9Z0H4-8","MR C PK SA VT MR NEE LLL SNG TA NKM NG AL DH SD QPD PD AI KM FVG QI PR SW SEK EL KEL FEP YG AVY QI N VLR DR SQ NPP Q SKG CC FV TFY TR KA ALEA QN ALH NI KTL PGM HH PI QM K PAD SEK SN AV EDR KL FIG MV SKK CN EN DI RV MF SP FG QI EE CR IL RG PD GL SRG CA FV TF ST RA MA Q NAI KAM HQ SQ TM EG CSS PIV VK FAD TQ KD KEQ R RLQQ QLA QQ MQ QL NTA TWG NL T GLG GL TPQ YLA LLQQ AT SS SNL GA FSG I QQ MAG MN AL QLQ NLA TL AAAA AAAQ TSA TST NA NPL SS TSS ALG ALT SPV AAST PN ST AGAA MN SLT SLG TL QGL AGA TV GL NNI NAL AG TI N SMA AL NG GLGA TGL TNG TAG TMD AL TQA Y SGI QQY AAA AL PTL YSQ SLL QQQ SAAG SQ KEG PEG A NL FIY HL PQ EFG D QD IL QM FM PFG NVI SA KV FID KQ TNL SK CFG FV SY DN PVSA QAA I QA MNG FQ IG MK RL KV QL KR SK ND SK PY"
"O70281","MVG KL KQ N LLLA CL VI SSV TV FYL GQ HA M EC H HRI EER SQ PA RL EN PKA TV RA GL DI KA NKT FTY H KDM PLI FI GGV PR SG TTL MRA ML DA HPD IR CG EE TRV I PR ILAL KQ MW SRSS KEK I RLD EA GV TD EVLD SAM QA FLL EV IV KHG EPA PYL CN KD PF AL KSL T YLA RL FP NA KF LL MVR DG RA SVH SMI SR KV TI AG FDL NSY RD CL TK WN RAI ET MY NQ CM EVG YKK C MLV HY EQL VL HP ER W MR TLL KFL H IP W NH SVL HH EEM IG KA GGV SL SKV ER STD QV IK PV NVG ALSK WVG KI PPD VL QD MAV IA P MLA KLG YD PY AN PP NYG KPD PK ILEN TRR VY KG EF QL PD FL KEK PQ T EQV E"
"Q80TI0-3","MA SSTA SN SNR STPA CSP ILR KR SRSP TPQ NQ DG DT MV EKG SD HSS DK SPST PEQ GV QR SC SSQ SGR SGG KN SKK SQ SW YN VLSP TY KQR NED FR KL FK QL PD TE RL IV DY SC ALQR DI LLQG RL YL SEN W IC FY SNI FR WET LLTV RL KD IC SM TK EK TA RL IP NAI QV CTD SEK HFF T SFG AR DR TY MM MF RL WQ NA LLEK PLC PK EL WH FV HQ C YG NEL GL T SDD ED YV PP DDD FN TMG YC EEI PI EEN EV ND SSSK SSI ET K PDA SP QL PKK SI TN STL T STG SSEA PV SFD GLPL EEEV MEG DG SLEK ELA ID NI IG EKI EI MA PV TSP SL DF ND N EDI PT ELSD SSD THD EG EV QA FY EDL SG RQ YV NEV FN FSV DKL YD LLF TN SPFL RD FM EQRR FSD II FH PW KKEE NG NQ SRV ILY TI TL TN PLA PK TA TVR ET QT MY KA SQ ESE C YVI DA EVL TH DV PY H DY FY TI NR YTL TRV AR NK SRL RV ST ELR YR KQ PWG FV KT FI EK NF W SGL EDY FR HL ET EL TKT EST YLA EI HR QSP KEK A SK SSAV RRR KR PHA HL RV PHL EE VM SPV TT PTD ED VG HR IK HV AG ST QTR H IP ED TP DG FHL QSV SK LLL VI SCV IC F SLV LLV VL NM ML FY KLW ML EY TT QTL TA WQ GL RL QE RL PQ SQ TE WAQ LL ESQ QKY H DT EL QK WR EI IK SSV LLLD QM KD SLI NL QNG IR SR DY TA ESD EKR NR YH"
"Q3ULW6-5","MG RQ KT KV PEE PQG RL DT SQD PY PAA N YLA PC NK ETI TVTL YG AT NL PA GK DG SE PW PY VVV KTT SEK AN KH SPQA MT SV TSE PT RA PV WGD TV NV EI QA ED TGR EG EAGG WA PV CG RC KWL EP HL PW KA KAV SL STA GG QL NT SLG SD KSI"
"Q08460-2","MEL EH PK SP PY PSS SSSS SS SSV H EP KMD AL II PV TM EV PCD SRG QR MW WA FLA SS MV TF FG GL FI ILL WR TL KYL WTV CC HC GG KT KEA QKI NNG SSQA DG TL KPV D EKEE VV AA EVG W MT SV KD W AGV MI SA QTL TGR VLV VL VF AL SIG ALV IY FI DSS NPI ESC QN FY KD F TLQ ID MA FNV FF LL YF GLR FI AA ND KL WF WL EV NSV VD FF TV PPV FV SV YL NR SWL GLR FLR ALRL IQ FSE ILQ FL NIL KT SN SI KL VN LLSI FI ST WL T AAG FI HLV EN SG DP WEN FQ NNQ AL TY W ECV YLL MV TM STVG YG DV YA KT TLG RL FMV FF ILG GL AM FA SY VP EII EL IG NR KKY GG SY SAV SGR KH IVV CG HI TL ESV SNFL KD FLH KD RD DV NV EIV FLH NI SP NLEL EAL FKR HFT QV EFY QG SVL NPH DLA RV KI ESA DA CL IL AN KY CAD PDA EDA SN IM RVI SI KNY HP KIR II TQ ML QY HN KA HLL NI PSW N WK EGD DAI CLA EL KLG FI AQ SCL AQ GL ST MLA NL F SMR SFI KI EE DT WQ KY YL EGV SN EM Y TE YL SSA FV GLSF PTV C ELC FV KL KLL M IAI EY KSA NR ESR IL IN PG NHL KI QEG TL GF FIA SD AK EV KRA FF YC KAC HD DV TD PKR IKK CG CR RL IY FED EQ PP TLSP KK KQR NGG MR NSP NT SPKL MR H DP LLI PG ND QID NMD SNV KK YD STG M FH W CA PK EI EKV IL TR SEAA MT VL SGH VVV CI FG DV SS ALI GLR NL VM PL RA SN FH YH EL KH IV FVG SI EYL KR EW ETL HN FP KV SIL PG TPL SRA DLR AV NI NL CD M CV ILSA NQ NNI DD TSL QD KEC ILA SL NI KSM QF DD SIG VLQA N SQG FT PPG MDR SSPD N SPV HG MLR QP SIT TGV NI PI IT ELV ND TNV QFL DQ DD DDD PD TEL YL TQ PFA CG TA FAV SVL DSL MSA TY FND NIL TL IR TL VT GGA TPEL EAL IA EEN ALR GGY ST PQ TLA NR DRC RVA QLA LLDG PFA DL GD GGC YG DL FC KAL KT YN ML CFG IY RLR DA HL ST PSQ CT KR YVI TN PPY EF ELV PT DL IF CL MQ FD HN AG Q SRA SLSH SSH SSQ SS SKK SSSV HSI PSTA NR PNR PK SR ESR D KQ NA TR MTR MG QA EK KW FTD EPD NA YPR NI QI KP MST HMA NQI NQ YK ST SSLI PP IR EV ED EC"
"P28322-2","M TK SS NH NC LL RP EN KP GL WG PG AQ AASL RP SPA TL VV SSPG HA EH PPAA PA QT PG PQV SASA RG PG PVA GGSG RM ERR MK GG YL DQ RV PY TF CSK SPG NG SLG EAL MV PQG KL MD PG SLPP SD SEDL FQ DL SH FQ ET WLA EA QV PD SD EQ FV PD FH SE NLA FH SPTT RI KK EPQ SPR TD PAL SC SR K PPL PY HHG EQ CL YSR QIA IK SPA PGA PGQ SPL QPF SRA EQ QQ SLL RA SSSS QSH PG HG YLG EH SS VF QQ PV DM CH SF TSP QGG GR EPL PA PY QH QL SE PC PP YP QQ NF KQ EY HD PLY EQAG QPA SSQ GGV SG HR YPG AG VVI KQ ER TD FA YD SDV PG CA SM YL HP EG FSG PSPG DGV MG YG YEK SLR PF PD DV CIV PEK FEG DI KQ EG IGA FR EG PP YQ RRG ALQL WQ FL VA LL DD PT NA H FIA WTG RGM EF KLI EP EEVA RL WG IQ KNR PA MN YD KLSR SLR YY Y EKG IM QKV AG ER YV YK FV C EPE AL FSL AF PD NQR PAL KA EF DR PV SEED TVPL SHL D E SPA YL PEL TG PAPP FG HR GGY SY"
"F8VPQ2","MK AAD EPA YL TV GT DV SA KY RGA FC EA KI KTV KRL V KV KVLL KQ DN TT QL VQ DD QV KG PL RV GA IV ET RT SDG SI QEA II SKL TDA SW Y TVV FD DGD ER TLRR TSL CL KG ERH FA ESE TLD QLPL TN PEH FG TPV IA KK TN RG RR SSL PI TED EKEE ESS EEED ED KRRL ND ELLG KVV SVA STA E STG W YP ALVV SP SC ND DV TVKK DQ CL VR SF ID SK FY SI AR KD IK ELD ILTL PE SEL CAR PGL RRA SV FL KGR IV PD NW KM DI SEIL ESS SSDD EE CPA EEH EEEK EKEA KKEE EEL PEE EL DP EE RD NFL QQL Y KF MED RG TPI NK PP VLG YK DL NL FKL FRL VY HQ GG CG NI DSG AV WKQ IY M DLG IP ILN SAA SY NV KTA YR KYL YG FEE Y CR SA NI QFR TI HH H EP KV KEE KK DF ED SMD EAL KEA PEM PLL DV KSE PEE NTD SN SE SDR ED TEL KSP RG RR KIV R DA NC IKK EI EE EKI ED KFL RD DLEN KD AG DDDD DG DP AA KR EH ELL FG RK ST PKN KEK KI KK PED SER DSD EEEE KSQ EREE TE SR CD SEG EDEE DD TEP CL TG TKV KV KYG RG KT QKI YEA SI KST EMD DG EIL YLV HY YG W NVR YD EWV KA DR II WPL DK GG PKK KQ KK KV KN KED SEK D EK RD EER QK SK RGR PPL KST FSP NM PY SLSK TSN SEG KSD SC SSD SEA DD QLEK SSGG EDL SP DV KEEL EKN EN AH DD KLD EEN PK IV HI SKEN DR TQA QP SD TLTV EA GD SD QIV HI FGD KVD QV EE FKK QV EK SP KGKG RR SK TK DLSL ELI KI SP FG QEE AG SEA HG DV HSL EF SSL EC KN F SST ED DID PY EKEK KLKR K ILG QQ SP EKKL RLD NG MEM T TGV SQ ER SD DG AGA EGM KGA HV EQ HF ET EG EGM PSL TA EPD QGL QEL T SEK SD SPA EE EPV HT PL KEE ED AM PL IG PETL VC HEV DLD DLD EKD KT SI ED VVV EG SE SN SLA SVPP ALPP VA QH NF SVA SPL TL SQD ESR SI KSE SDI TI EVD SIA EE SQ EGL CER ESA NG FEA SVA SG AC SI IA HER ESR EK GQ KR PSD GN SGL IA KK QKR TP KR T SAAA KT EK NG AG Q SSD SEDL PA MD SSSN CT PV KRL TL PK SQ KL PRSP AR TSP HI KDA EKEK HR EKH PN SSPR TY KW SF QLN ELD NM NST ERI SFL QEKL Q EIR KY YM SL K SEV A TID RR RK RLKK KDR EV SH AGA SM SSA SSD TG MSP SSSS PP QN VLAV ECR"
"Q3TD49-2","M AAA RL AAA LLLL AA QV AC EFG VL RVV SQ TSR TR SR DY CIL YN PQ WA HL PH DL SKV SLL KLR DL ST TQL C SYL DV PA ED FTN QI ALVA RG NC TFY EKV RLA QG SGA HG LL IV SK EKLV PPGG NKT QY EEI SI PVA LL SHR DLQ DI FRR FGR EV MV AL YA PSE PV MD YN MV II FV M AVG TV AI GG YW AG SH DV KK YM KH KRD DG PEK QED EAV DV TPV MI CV FV VM CC F MLV LL YY FYD RLV YVI IG IF CLA SST GLY SCL AP FVR KL PF CTC RV PD NNL PY FH KR PQA RM LLL ALF CV TV SVV WG I FR NED Q WA WVL QD TLG IA FCL YML KTI RL PT FKA CT LLLL VL FIY DI FFV FI TP FL TK SGN SI MV EVA TG PSN SS TH EKL PM VLKV PRL NT SPL SLC DR PF SLLG FGD ILV PG LLVA YC HR FDI QV Q SSR IY FV AC TI AY GLG LL VT FV ALVL MQ RG QPA LL YLV PC TLL TSC TV AL WRR EL GA FW TG SGF AV NT SLL"
"P27600","MSG VVR TL SR CLL PA EAG AR ERR AG AAR DA EREA RRR SR DI DA LLAR ERR AVR RLV KI LLLG AG ESG KST FL KQ MR II HGR EF DQ KALL E FRD TI FD NIL KG SR VLV DA RD KLG IP W QH SEN EK HG MFL MA FEN KA GLPV EPA TF QL YV PAL SAL WRD SG IR EAF SRR SEF QLG ESV KY FLD NL DR IG QL NY FP SK QDI LLAR KA TKG IV EHD FVI KKI PF KMV DV GG QR SQR QK WFQ CF DG IT SIL FMV SS SE YD QVL MED RR TN RLV ESM NI FET IV NN KL FF NV SI ILFL NKM D LLV EK VK SVSI KK HF PD F KGD PH RL EDV QR YL VQ CF DR KRR NR SKPL FH HFT TA ID TEN IR FV FH AV KD TIL QE NL KDI ML Q"
"Q9QXY6","MF SWL GN DD RRKK DP EV FQ TV SD GL KKL YKT KLL PL EEY YR FH EF HSP ALED AD FD NKP MV LLVG QY STG KT TFI RY LLEQ DF PG MR IG PEPT TD SFI AVM QG DV EG II PG NAL VV DP KK PFR KL NA FG NA FL NR FV CA QL PNA VL ESI SV ID TPG IL SGEK QRI SRG YD FAA VL EW FA ERV DR II LLF DA HKL DI SD EF SEV IK AL KN HED KM RV VLN KAD QI ET QQL MRV YG AL MW SLG KIV NTP EVI RVY IG SFW SH PLL I PD NR KL FEA EE QDL FR DI QSL PR NA ALR KL NDL IK RA RLA KV HA YII SSL KK EM PSV FG KD TKK KEL VN NLA EI YG RI ER EH QI SP GD FP NL KRM QD QL QA QD FSK FQ PL KSK LL EVV DD ML AH DIA QL MVL VR QEE TQR PV QMV KGG AF EG TL QG PFG HG YG EG AG EG ID DA EW VV ARD KPM YD EI FY TL SPV DG KI TGA NA KK EMV R SKL PN SVLG KI W KLA DI DK DG ML DD EEF ALA NHL I KV KL EG HEL P SEL PA HLL PP SKR KV SE"
"Q99MB1","MKG CSS YL MY SFGG LLSL WI LLV SS TN QC TV RY NV AD C SHL KL THI PD DL PSN IT VLNL TH N QLR RLPP TN FTR Y SQLA ILD AG FN SI SKL EP EL CQ IL PLL KVL NL QH NEL SQI SD QT FV FC TNL TEL DLM SN SIH KI KSN PF KN QK NLI KL DL SH NGL SST KLG TGV QL ENL QE LLLA KN KIL ALR SEEL EFL GN SSLR KL DLSS NPL KE F SPG C FQ TIG KL FA LLL NNA QL NP HL T EKL CW EL SN TSI QNL SLA NNQ LL AT SEST F SGL KW TNL TQL DL SY NNL H DVG NG SF SYL P SLR YL SL EY NNI QRL SPR SF YGL SNL R YL SL KRA FT KQ SV SLA SH PNI DD FSF QWL KYL EYL NM DD NNI PST KSN TF T GLV SL KYL SLSK TF TSL QTL TN ET FV SLA HSP LLTL NL TKN HI SK IA NG TF SWL G QLR IL DLGL NEI EQ KL SG QE WR GLR NI FEI YL SY NK YL QL STSS FAL VP SLQ RL ML RRV AL KNV DI SPSP FR PLR NL TIL DLSN N NIA NI NED LL EGL ENL EIL D FQ HN NLA RL WK RA N PGG PV NFL KGL SHL HIL NL ESN GLD EI PV GV FK NL FEL KSI NL GL NNL NKL EP FI FDD QT SLR SL NL QK NL IT SV EK DV FG PP FQ NL N SLD MR FN PF DC TC ESI SW FV N WI NQ TH TNI SEL ST HYL CN TP HH Y YG FPL KL FD TSS CKD SA PF ELL FII ST SM LL VF IL VV LL IHI EG WRI SF YW NV SV HR ILG FK EI DT QA EQ FEY TA YII HA HKD RD WV W EH FSP MEE QD QSL KF CL EE RD F EAG VLGL EA IV NSI KRSR KII FVI TH HLL KD PL CRR FKV HH AV QQ AI EQ NLD SI ILI FLQ NI PD YKL NH ALCL RRG M FK SH CIL NW PV QK ERI NA FH HKL QV ALG SR NSA H"
"Q8K4Q0-2","MG SP SI FV YD C SNA GL IV KSF KQ FAL QR EQEL EV AA IN PN HPL AQ M PLPP SM KN CI QL AAC EAH ELL PM IP DL PADL FT SCL TT PI KI ALR W FC M QK CV SLV PGV TL DLI EKI PG RL ND RR T PLG EL NW IF TAI TD TIA WN VL PR DL FQ KL FR QD LLVA SL FR NF LLA ERI MR SY NC TPV SS PRL PP TY M HA MW QA WDL AV DI CL SQL PT II EEG TA FR HSP FFA EQL TA FQV WL T MGV ENR SP PE QL PI VLQV LLSQ VH RLR AL DLL GR FL DL GP WAV SLAL SVG IF PY VL KLLQ SSAR EL RP LLV FI WA KIL AV DSS CQA DLV KD NGH KY FL SVL AD PY MPA EHR TM TA FIL AV IV NSY TTG QEA CL QG NL IAI CL EQL SD PH PLL RQ W VAI CL GR IW QN FD SAR W CGV RD SAH EKL Y SLL SD PI PEV RC AA VF ALGT FV GN SA ER TD HST TI DH NV AM MLA QL IN DG SP MV RK ELVV AL SHL VV QY ESN FC TV ALQ FM EEEK NY PL PSP AA TE GGSL TPV RD SPC TP RLR SVSS YG NIR AV TTA R NL NK SLQ NLSL TEE SGSS VA F SPG NL ST SSSA SS TLG SP ENEE YIL SF ET ID KM RRV SSY SAL NSL IGV SF NSV Y TQ IW RVLL HL AAD PY PDV SDL A MK VLN SI AY KV CI"
"Q8R4E4","MI PK EQ KE PV MAV PG DLA EPV PSL DL GK KL SV PQ DL MI EEL SLR NN RG SLL FQ KR QRR VQ KF TF EL SESL QA ILA SSA RG KV AGR AAQA TV PN GLEE QN HH SET HV FQG SP GD PG IT HLG AAG TG SVR SP SALA PG YA EPL KGV PP EK FN HTA IP KG YR C PW QEF TSY QD Y SSG SR SH TPI PRD YR NFN KT PV PF GG P HVR EAI FH AG TP FV PE SF SGL ELL RLR PN FN RVA QG WVR KL PE SEEL"
"Q9D845-2","M YG HHG NR IA PGL V KM AGR SVRV P RRG SAG TQ SRG QL AAG RD LLAR EQ EY KRL N EEL EA KTA DL VR QA EEV IR EQ QEV RAR PF SAL TT SC KEE GG SSSR DLL SSEG TH PW TET KP KT KN TG PV NKI QN RLH SA DK ER KT N SSA KL KY PD AQ TA NDV AI PD DF SDF SLA KTI SRI EG QLD ED GL PE CA EDD SF CGV SK DI GT EAQ IR FL KAKL HV MQ EELD SV VC EC SKK ED KI QDL KSK VK NL EED CVR QQR TV TSQ Q SQI EK YK NL F EEA NKK CD EL QQQL SSV EREL ESK R RLQ KQ AA SSQ SA TEV RL NR AL EEA EKY KV EL SKL RQ TN KD NQ YL NN DL ERR A SN"
"Q91YY2","ML RRLL ER PC TLA LLVG SQL AV MM YL SLGG FR SL SAL FG RD PG PT FD YSH PH DVY SNL SHL PAA PG AAGA PP AQ AL PY CP ER SPFL VG PVSV SF SP VP SLA EIV ER N PRV ESG GR YR PAG C EPR SR TAI IV PH RAR EH HLR LLL YHL HP FL QR QQL A YGI YV IH QAG NG TF NRA KLL NV GVR EAL RD EE WD CL FLH DV DLL PEN DH NL YV CD PRG PR HV AV AM NK FG YSL PY PQ YF GGV SAL TPD QYL KM NG FPN EY WG WGG EDD DI AT RV RL AG MKI SRPP T SVG HY KMV KH RGD KG NEE NP HR FD LL VR TQ NSW TQ DG MN SL TYR LLAR ELG PL YT NI TA DIG TD PRG PRSP SG PRY PPG SSQA FR QE ML QRR PPAR PGPL PTA NH TA PRG SH"
"P70388-3","MEE QSV EL ST EV QSL NR EI KD AK EQI SPL ET AL EKL QQ EK EELI HR KH TSN KMA QD KI NDI KEK VK NI HG YM KDI ENY IQ DG KD DY KK QK ET EL NGV AV QL NEC EK HR EK IN KD MG TMR Q DID TQ KI QER WL QD NLTL RKRR DEL KEV EE EP KQ HL KE MG QM QVL QM KN EH QKL EE NID TI KR NH SLAL GR QKG YED EIL HF KK ELR EPQ FR DA EE KYR EM MIV MR TT ELV NK DL DI YY KTL D QA IM KF HSM KM EE IN KI IR DL WR STY RG QDI EYI EIR SD AD ENV SASD KRR NY NY RVV ML KG DT AL DM RG RC SAG QK VLA SL II RL ALA ET FCL NCG IL ALD EPT TNL DR ENI ESL AH ALV EI IK SRSQ QR NFQ LL VI THD ED FV ELL GR SE YV EK FY RV KK NMD QC SEI V KC SI SSLG SY VH"
"Q80W14","MM PP PF MPP PGL PP PF PP MGL PPM SQR PP AI PPM PPG IL PP ML PP MGA PPPL TQI PG MV PP MM PG MLM PAV PV TAA TA PG AD TA SSAV AG TG PPR ALW SE HV AP DGR IY YY NA DD KQ SV WEK PSVL K SKA ELLL SQC PW KE YK SD TG KP YY YN NQ SQ ESR WTR PK DLD DL EALV KQ ESA GK QQ TQ QLQ TLQ PQPP QPQ PD PP PI PPG PI PV PMA LL EPE PGR SED CD VL EAA QPL EQG FL QR EEG PSS ST GQ HR QPQ EEEE AK PE PER SGL SW SNR EK AK QAF KELL RD KAV P SNA SW EQ AM KM VV TD PRY SAL PKL SEK KQA FNA YKA QR EKEE KEEA RLRA KEA KQ TL QH FLEQ HER MT ST TRY RRA EQ TFG DL EV WAV VP ERER KEV YDD VLF FLA KKEK EQ AK QL RRR NI QAL K SIL DGM SSV NFQ TT W SQA QQ YL MD NP SFA QD QQL QN MD KED AL IC FEE HIR ALER EEEE ER ERA RLR ERR QQR KNR EA FQ SFL DEL H ETG QLH SM ST WM EL YP AV ST DVR FA NML GQ PGST PLDL FKF YV EEL KAR FHD EK KII KD IL KD RG FCV EV NTA FED FA HVI SFD KRAA ALD AG NI KL TF NSLL EKA EAR ET EREK EEA RRM RRR EAA FR SML RQ AV PAL ELG TA WEE VR ER FV CD SAF EQI TL ESER I RL FR EFL QVL EQ TEC QHL HT KG RK HGR KG KKH HR KR SH SPSG SESD EEEL PP P SLR PP KRR RR NP SESG SE PSS SLD SV ESG GA ALGG PGSP SSH LLLG SDH GLR KTKK PKK KTKK RR HK ST SPD SET DP ED KAG KE SED R EQ EQ DR EPR QAEL PNR SPG FGI KKEK TG WDT SE SEL SEG EL ERR RR T LLQ QL DD HQ"
"Q61735-2","MW PL AAA LLLG SC CCG SA QLL FSN VN SI EF TSC N ETV VI PC IVR NV EAQ ST EEM FV KW KL NK SYI FIY DG NKN ST TTD QN FT SA KI SV SDL I NG IA SL KMD KR DA MVG NY TC EV TEL SREG KTV I EL KNR TA FN TD QG SAC SY EEEK GGC KLV SW FSP NEK IL IV IF PIL AI LLF WG KFG ILTL KY KSS H TN KR II LLL VA GLVL TV IV VV GA ILL IPG EK PV KNA SGL GL IVI STG IL ILL QY NV FM TA FG MT SF TIA ILI TQ VLG YVL ALV GL CL CI MA C EPV HG PLL I SGLG II ALA ELL GL VY MK FVA SN QR TI Q PPR NR"
"Q9Z1X4-2","MAL Y HH H FI TRR RR RP MRI FV ND DR HV MA KH SSV YPT QEEL EAV QN MV SH TER AL KAV SD WID EQEK GN SEL SEA EN MD TPP DD ESK EG AG EQ KA EH MTR TL RG VM RV GLVA KG LLL KG DLDL ELV LLC KEK PT TA LLD KV AD NL AI QL TTV TED KY EIL QSV DD AA IVI KN TKE PPL SL TI HL TSP VVR EEM EK VLAG ETL SV ND PPD VLDR QK CLA ALA SLR HA KW FQA RA NGL K SCV IV IR VLR DL CT RV PT WG PL RG WPL ELL CEK SIG TA NR PMG AG EAL RR VL ECL A SG IV MP DGSG IYD PC EKEA TDA IG HL DR QQR EDI TQ SA QH AL RLAA FG QL HK VLG MD PL PSK MP KK PKN EN PV DY TV QI PPST TY AI TPM KR PM EE DGEE KSP SKK KK KI QKK EE KAD PP QA MN ALM RL NQL KP GL QY KLI SQ TG PV HA PI FT MSV EV DG SN FEA SG PSKK TA KL HV AV KVL QD MGL P TGA EG RD SS KG ED SAEE SD GK PA IVA PP PVV EAV SN PSSV FP SDA TT EQ GP IL TK HG KN PV MEL NEK RR GL KY ELI SET GG SHD KR FV MEV EV DG QKF QG AG SN KK VA KA YA ALA AL EKL FPD TPL ALEA NKK KR TPV PVR GG PKF AA KP HN PG FG MGG PM HN EV PPPP NI RG RGR GG NI RGRG RGRG F GGA NH GGG Y MN AGAG YG SYG YSS NSA TAG YSD FF TD C YG YH D FGA S"
"A7XUX6-2","MGA TGV LL CV VLH FLQ MV TQ SSEK FTV TGL QR P VLA PL GG NV EL SC QLSP PQQ AQ HM EIR WFR NR YR EPV YL YR NG KDL HG ETI SK YV ER TE LLKD DIG KGKV TLR IF KL TA DD DG SY HCV F KVG EF YEE H IT EI KV TAT SSV MY IL MQ PP NI KGV ML EC H SGG WF PQ PH M EW RD NKG NII PA TSK AH SQD EN KL FN M TM TLL I EA SS HR SI TC YL QN LL TH QEE SI SI VLSG EL FSW KRV W IM ILTT IG FM MIA FC M TY CV QQ HLL YG TF SKG KC H WL KST M IF MF SVI AV TGV ML IL HL KQ RV PV SD QH F ELD TL WL EDI SV IL CVL IV FII KLI SF IY FRL EGL TA IT RR SSGV ESA TL SF CH SH CC YL PP SC SRV FT WSP AAGL RR"
"Q80WV7","MSS TV N NGA TG MPA PPD AA NG FPQ PGA SSG SW PRA EE ELR AA EP GL VK RA HR EIL DH ER KRR V EL KC M ELQ EM MEE QG Y SEE EI RQ KV GT FR QML MEK EG VL TR EDR PG AH IVA ET PRR M EGL EP GL EY PP FD ED DG PVD CD CPV SC YRG HRG YR TKH WSS SSA SPPP KKKK KKKG SH RRSR KKR RL ESE C SCG SA SPLR KKKK NV KK HRR DR SD SGSR RKRR YR SRSL KSK RK EK NK ER KR PH TE SPG RR FH HH SSA SSH SP SM SS HY SD SGSP SRL SP KHR D DG RK TG SQR SSG SR SPSP SGG SG WG SP QQ NGG SR QR SG AH GGR PGSA HSP PD KPSS PRA CD KAA AA PT PPA RG KD SQ SPR SA PSS QGR GGR AAGG TA RRRR RRRR RRR SR SSA NA PRR RG RRR TK PAPP RG SSR SLSG AH SSSD SG GGA PGPG PE PC SER G HGG HG KRA KER PP RAR PAST SPSP GT RG RR GG PEG NSS SR SPG PH QG SW SSSR SPSK SH SR SPD KR TR SPSL SPSP KK PLG RD KD SEG RAR HA EA EAA RT RRR SR SYSP IR KRR RD SP SFM EP RR IT SAR KR PI PY YR PSP SSSS SCL ST DY SSR SH SRSP SPG H SHG SY SSR SHG TR SR SC SA SRSR SP SY HSR SS SESG GF"
"P04187","MKI LLLLL TL SLA SR TK AG EII GG HEV KP HSR PY MA LLSI KD QQ PEA IC GG FL IR ED FVL TAA HC EG SII NV TLGA HNI KEQ EK T QQV IP MV KCI PH PDY NP KT FSN DI MLL KL K SKA KR TR AVR PLNL PRR NV NV KPG DV CYV AG WGR MA PMG KY SN TLQ EVEL TV Q KDR EC ESY F KNR YN KT NQ IC AG DP KT KRA SF RGD SGG PL VC KKV AAG IV SYG YK DG SP PRA FT KV SSFL SWI KK TM KSS"
"Q8CGF5-2","MEA ST KAA VG SG AM EA ST KAV IC TV CSS FVV FQ IL FH FV SY WF SA RV SSG YN SL SID KKI EW NSR VV ST CH SLL VG IF GL YL FF FD EA TI TD PLW GD PT YV NI NIA TASG YLI SD LLI IL FN WKV IGD KF FI IH H CA GL TA YY FVL TTG ALA YIA NFR LLA ELSS PFV NQR W FF EAL KY PKF SKA NVI NG ILM TVV FF IVR II SI PPM YFFL YSV YG TE PY IR TC IL KV NF"
"Q80TL4","MG VLM SK RQ TV EQ VQ KV SLAV SA FKD GLR DR PSI RR GG EL PGSR RG TV EG SV QEV QEE KEA EA SAPV VQ EE SSI NR AA W ERLR DG RGV EP EEF DR TSR FT PPA FIR PTR KL DD DK PP DI CL EPR EPV V ND EM CDV CEV WTA ESL FPC RV CT RV FH DG CL RR MG YL QGD SAV EV TE MA H TE TG WSC YY CD NL NLLL TEE EM YSL TET FQR C KVI PD CSL TLED FVR YR HQ AA KRG ESSR AL TD EQEE QAA RQ FA AL DP EQ RG HV EW SD FL SH ESLL LLL QLR PQ N SLLR LLTV KER ERA RA T FLA RGRG STI SEA EC HH AR H SW FC KRL TEA PSC SVSI SH VG PI AD SS PAA SSSK SQ EKA LL PT EQ ESR YV DW PT FLR ENV IY IL AAR PN SG AI HL K PPG"
"Q6PFE7","MGA QA PL RL PAA PPL AV CG YT SV LLL FA FCL PG SRA SN QPA GGGG DC PGG RG KSN C SEL NLR ESD I RV CD ESS CKY GG VC KED GD GL KCA CQ FQ CH TN YI PV CG SN GD TY QN EC FLRR AAC KH Q KDI TV VA RG PC YSD NG SGSG EG EEEG SG AGA HR KH SK CG PC KY KA ECD EDA EN VG CV CNI DC SGY SF NPV CA SDG SSY NN PC FVR EA SCI KQ EQI DIR HLG HC TD TD DV SLLG KK DD GLQ YR PDV KD AGD ER ED VY IG SHM PC PE NL NGY CI HG KC EFI YST QKA SC RC ESG YTG QH CEK TD F SIL YVV PSR QKL TH VLI AAI IG AV Q IAI IVA IVM CI TR KC PKN NRG RR QKQ NLG HFT SD TSS R MV"
"P42866","MD SSAG PG NI SD CSD PLA PA SC SPA PG SWL NL SHV DG NQ SD PCG PNR TGL GG SH SLC PQ TG SP SMV TAI TI MAL YSI VC VV GL FG NFL VM YV IVR YT KM KTA TNI YIF NL ALAD AL AT STL PFQ SV NYL MG TW PFG NIL CK IVI SID YY NM FT SI FTL C TM SV DR YI AV CH PV KAL D FR TPR NA KIV NV CN WIL SS AI GLPV MF MA TT KYR QG SI DC TL TF SH PT W YW ENLL KI CV FI FA FIM PVL II TV CY GLM ILRL K SVR ML SG SKEK DR NL RRI TR MVL VVV AV FIV C WT PI HI YV II KAL ITI PET TFQ TV SW H FCI ALG YTN SCL NP VL YA FLD EN FKR CFR EF CI PT SSTI EQ QN SAR IR QN TR EH PST AN TV DR TN HQL ENL EA ETA PL P"
"O88968","M ELL KA LLLL SGV FG ALA EF CVI PR ID SQLV EKLG QRLL PW MD RL SS EQL NP SV FV GL RL SS MQ AG TKE DL YL HSL KI HY QQ C LLR STSS DD NSS C QP KL SGG SLAL YLL ALRA NC EF FG SR KGD RLI SQL KW FL ED EKKA IG H NH EGH PN TN YY QY GL SIL AL CV H QK RL HD SV VG KLL YAV EH DY FTY QG HV SV DT EA MA GLAL TCL ER FN FN SDLR PR IT MAI ETV R EKIL KSQ AP EGY FG NI YST PL ALQ ML MT SPA SGV GLG TAC IK AG T SLLL SLQ DGA FQ NPL MI SQLL PIL NH KT YL DL IF PD CQA SRV ML VP AV ED PV HI SEV I SVTL KVA SAL SPY EQ TF FV FAG SSL ED VL KLA QD GGG FT YG TQA SLSG PYL T SVLG KD AG DR EY WQ LLRA PD TP LLQG IA DY KPQ DG ETI ELRL VR W"
"P34884","M PM FIV NT NV PRA SV PEG FL SEL TQ QLA QA TG KPA QYI AV HVV PD QLM TF SG TND PC ALC SLH SIG KI GG AQ NR NY SK LL CG LLSD RL HI SPD RVY IN Y YD MN AA NVG WNG ST FA"
"Q8BWS5","MG TV PD PL RV TKA SIV AASG KEE SRG ESQ SV SPQ PA QPD NNA SG IG NV PA EL SLQL SAA AQ ALM QA CV SESS QQD MA SPGV F SEG EPV SP KQ KT PD DF LL HG SK ESAA PGL NA TA QK ELI SA PCL I SVV QH TH HAI QR DA PN TST CAV PEG SL VK SEA N SNG EN PEK PG CPA RV TC CSS KN QE GL CD FP SP EN SQG IL QT PD IA SPSA DR PEG EG QKV IN NI TAV SS EPP VR EGC SEN KQ PSA TAL NT TA ER SEN PP P SHL TSK GA TC SS EAR QALL PA QY PV SR FK EA STM TC QA ESG AK EV SG RA WQ DA EVQ AVA SV ESR SVST SP SIL PA YL KEN PA PEL ENG QEQL RV IC HG KG SG NH LLEL SN SM VD SQ ESR QC PSI VP QV HIQ AATA TPAA FK GG CK PA NQ PA EGL KSPL I HV TSS QN TET EEDL RLSA SKEA TSR QP EG TN PD FQ KA NA IG QI SL PAG SQA EI NQ GL WN SG PR EP EI VV KTA KD HKA ESS C KP SN SGGG AN KDY PP ESL D PTD KK GA KDKK PA SPL IV KD HA PG AT STL DA KT LLL NPK SQ VK EGEG PEV SP APSP GR KSQ QN TL EEL RQ PK TV MSL SL P SDG TG DSS PGSG KR TP SLSV KA SP RRG SRV SEFL KEL SV TAA AA QV GL TPG EKKK QL GAD SKL HL KQ SK RVR DVV WDD QG MT WEV YGA SLD PE SLG VA IQ NHL QR QIR EH EK IV KT QSG QT RR SI SSD SSSS KKL KG RQ HG VLQ SML QN FRR PN C CVR PA PSS VLD"
"Q8R0S1","MGD DR PFV CSA PG CG QR FTN ED HL AVH KH KH EM TL KFG PAR TD SVI IAD QT PT PTR FL KNC EEV GL FN ELA SSF EH EF KKA SDDD EK KG AAG PL DM SL PST PDI KI KEE EPV EV DSS PPD SPA SS PC SPPL KEK EV TT KPV VI ST PTPT IVR PG SLPL HLG YD PL HP TL PSP TSV IT QA PP SN RQ IG SPTG SLPL VM HLA NG QT MP ML PG PPV QM PSV ISL AR PV SM VP NI PGI PG PPV NN SG SISP SGH PM PSEA KM RL KATL TH QV SS IN GG CG M VVG TAST MV TA RP EQ NQ IL IQ HPD APSP AQ PQV SP AQ PT PST GG RRRR TVD ED PD ERR QR FL ER NR AAA SR CR QKR KL WV SSL EKKA EEL TSQ NI QL SN EV TLL RN EVA QL KQ LLL AH KD CPV TAL QKK TQG YL GK"
"Q91WD4","MSA Y SML SDR IV MA KEL IK RA ESL SRSR KGG I EGG A KLC SKL KA EL KFL QKI EAG KV AI KE SHL QST NL THL KA IV ESA ENL EEVV SVL RV FG YTD TLG EK QTL VV DV VA NGG HT WV KA IGR KA EAL HNI WLG RG QYG DK SII EQA EDFL QA SR QQ PV QY SN PH IV FA FY NSV SSP MAD KLKD MGI SV RGD IV AV NSLL NH PEE FQL SE SE SDD EG QELL QV TRV DR DN VLA RV AF PT EI KV DV C KKV NL DI TTL IT YV SAM SY GG CH FV FK EK VLT EQA EQER KER VL PQL EA FM KD KEL FA C E SAV KD FQ SIL D TL GGPG ERER AD VLI KRI SVV PD QP SER ALRL VA SS KI NSR SL TI FG TGD TL KA IT MTA NSG FVR AA NN QGV KF SV FI HQ PR AL TE SKEA FAV PL PK DL TDD SAH"
