"UniProtID","tokens"
"Q9D4D7","MEM MPQ YDL SRL PEN TAL KQQ TL PT QQL NL SA SVVL SI FFI TGG FCL SIG II LLL SA KST KKI EI NY TKT CA NCA QLR EN SSN FD KAC NC SL PF YL PEK MEG DV YM YY KL YG FY QNL Y QY IL SR SN SQL VG KDI WD TT NCD PF QV SH ND TPI IP CGA IA NSI FND TI TL SY NL NSS TQI EV PML K SGL TW WTD KYV KFR NPR SSN FT ST FAG SS KPL H WA KPI YEL DL DD PG NNG FL NED FIV W MR TAA FPT FK KL YR RL KRV HA FA EGL PAG NY SLSI SY NF PV TM FQG EK SI VL STL TW I GGG GL FLGL TY TVTG ALT LLA SFA IL TI HL ML KR SKL NFL"
"Q8BG18","MED SR ET SPSS NN SS EEL SSTL QL SKG MSI FLD ILRR AD KND DGKL SF EEF KAY FA DG VLSG EEL HEL FH TID TH NTN NL DT EEL C EY FSQ HLG EY EN VLA AL EDL NL SIL KA MG KTKK DY QEA SNL EQ FV TR FLL KE TLN QLQ SL QN SL ECA MET TEE QTR QER QG PSK PEVL SI QW PG KR SS RRV QR HN SF SP NSP QF NV SSPA LL EED NQ WM TQ IN RL QKL ID RLEK KDL KL EPL EE EII EE NT KP HI MLV QR QM SV TEE DLEE FQL AL KH YV ESA SA QSG CL RI SI QKL SN ESR YM IY EF WEN SSV WNR HL QTN YSK TF QR SN VD FL ET PEL TST MLV PA SW WIL NN N"
"P06880","MA TD SR TSW LLTV SLL CLL WPQ EA SA FPA MPL SSL F SNA VL RA QHL HQL AAD TY KE FER AY IP EG QR YSI QNA QAA FC F SET IPA PTG KEEA QQR TDM ELL RF SLLL IQ SWL G PV QFL SR IF TN SLM FG TSD RVY EKL KDL EEG IQ AL MQ EL EDG SP RV GQ IL KQ TYD KF DA NMR SD DALL KN YG LL SC FKK DLH KA ET YL RVM KC RR FV ESS CA F"
"O70152","MA ST GA SR SLAA SPR PP QGR SSR QD KY SVLL PT YN ER ENL PL IV WLL VK SF SESA IN YEI II ID DG SPDG TR EVA EQLA EI YG PD RI LLR PR EKKL GLG TA YI HGI KHA TG NYV II MDA DL SHH PK FI PE FIR KQ KEG NFD IV SG TR YKG N GGV YG WDL KR KII SR GA NFI TQI LLR PGA SDL TG SF RL YR KEVL QKL IEK CV SKG YV FQ MEM IV RA RQ M NY TIG EV PI SF VD RV YG ESKL GGN EIV SFL KG LLTL FA TT"
"Q9DBK0","M ESM VA PG EVL M SQA IQ PA HAD SRG EL SA GQ LL KW MD TTA CL AA EKH AGI SCV TA SM DD IL FED TAR IG QII TI RA KV TRA FST SM EI SI KV IV QD KF TG IQ KLL CV AFST FV AK PV GK EKV HL KPV LL QT EQ EQV EH NLA SERR KV RL QH EN TF NNI M KE SS RF SD SI CN EEEG TA TT MG TSV QSI EL VLPP HA NH HG NTF GG QI MA WM ETV A TI SA SRL CHG HP FL KSV DM FKF RG PST VGD RL VF SA IV NN TFQ NSV EV GV RV EA FD C QE WA EG QG RH IN SAFL IY NAV DD QEKL I TF PR IQ PI SK DD FRR Y QGA IA RR RI RL GR KYV I SH KK EV PL SA QW DI SKK G SL SN TNV EAL KNL A SK SG WEI TT TL EKI KI YTL EEQ DAI SV KV EKL VG SP AH IA YH LL SDL TKR PL WD PH YI SC EV ID QV SEDD QI YYI TC SVV NGD KP KD FV VLV SR RK PL KD NN TY TV ALR SVVL PSV PSS PQ YIR SEV IC AG FL IQ AVD SN SC TV TYL NQ MSD SIL PY FAG NI GG WSK SI EE AAA SC IK FI EN AT PD GL KSVL"
"Q9CWH5-2","MGG LL IA SAH FGA YV CG TDI DY NTV H GLG KA SR KN QK WRG PD ENI RA NL RQ YGL EK F YLD VLV SDA SK P SWR KG TY FDA II TD PP YG IR EST RR SG SQ KD IP KGI EK CPE SHV PV SL SY HL SD MF FD LL NF AA ETL VLGG RL VY WL PV YT PE YT EE MV PW HP CL RLI SN CEQ KL SSH TAR RL ITM EKV KE FEN RD KY SH LLSD HFL PY QG HN SFR EK YF SG VT KR IA KEE KC SH E"
"Q9D2G2-2","MT SL SN IQ EM RA RH KDA FLKK HNL KLG FM SA FV KA SAF ALQ EQ PV VN AV ID DA TK EVV YR DYI DI SVAV AT PR GLVV PV IR NV ET MN YA DI ER TI N ELG EK AR KN EL AI ED MD GG TF TI SN GGV FG SL FG TPI IN PP QSA ILG M HA IF DR PVAV GG KV EVR PM M YV AL TY DH RLI DGR EA VT FLR KI K AAV ED PRV LLL DL"
"Q9JJB1","M TE PQ EQLL QLQ KD NR DG RLR KQEL EEL VR GL EA ESE SLTG RL EELR ERER SLQ RRR SQA SR AI RG EAC EAAR ERA ERA RG LL EAA EQ HR QDL EQ HNR KLQ EQ W EEL SSQL FY YGG EQL SQ QRA EQQL GN QLV AL QK HL ELA EA KF SM QA EDLR QGA QR T EEA WA SF QEQ SG VL QEL QG KVM EAAA ALEA TR GG SE PW NSE PR PV QD CAG SL MEE VA RA DC EKRL FGG TGAG SL RLW AL SAL QT LLLL PLG FL VL PLI YV VL AK PD AV GP GLQ SLG SD AV FR RL RY TLSP LLEL RARG LLPA"
"Q8K057","MRL KI SLSK EP KH QEL V SC VG WT TA EEL YSC SDD HQ IV KW NLL T SET SL IV KL PD DIY PI DLH WF PK SLG IKK QT QA ESF VL TSS DG KF HLI SKL G RV EK SV EAH CGA VL AGR W NY EG T ALV TVG EDG QV KI WSK TG MLR STLA QQ GT PVY SVA WG PD SEK VL YT AG KQL II KPL QP NA KVL QW KAH DGI IL KVD WN SV NDL IL SAG EDC KY KV WD SY GR VL YG SQ PH EH PI T SVA WA PDG ELF AVG SF HTL RL CD KTG WSY ALEK PN TG SI F NIA WSI DG TQI AGA CG NG HVV FA HVV EQR W EW KN FQV TL TK RR TM QV RN VL ND AV DLL E FRD RVI KA SLN HA HL VV STSL QC YV FST KN W NT PL IF DL KEG TV SLIL QA ER HF LL VD GG GI YLH SY EGR FI SS PKF PG MR TD IL NA QTV SL SND TI AI KD KAD EK II FL FEA ST GK PLG DG KLL SH KN EI SEI ALD QK GL TN DR KIA FID KNR DLY IT SV KR FG KEE QII KL GT MV H TLA W CD TC NIL CGI QD TR FTV W YY PN TI YV DRD IL PK TLY ER DA SEY SK NPH IV SF VG NQV TI RRA DG SLV HI SI SPY PA ILH EYV SSSK WEE AV RL CR FV KEQ SM WA CL AAM AVA NRD MV TA EI AY AAVG EID KVR YI NA IK DL PSR ESK MA HIL MF SG NI QEA ETV LLQA GL VY QA IQI NI NL YN WER ALEL AV KY KT HV DT VLA YR QK FL DT FG KQ ET NKR YL QYA EGL QID W EKI KA KI EM EI TK ER DR SSSG QSS KSV GL KH"
"Q08EC4","MRG TSI R EG AP KT LLAR AL YD NHA DC SDEL AF SR GD IL TIV EQ NV PE SEG W WR CLL HG RQ GLA PA N RLQ VLR ET PA DR PC PLL PRG PD TDL TSS GA PY QV QDL I SPPP QG PVY EP MR SWV EG PSPA TA QV YEL PE SPSS AR II CEK TL SF PKQ AL SVL PR PT RA SL PTL PSQ VY DV PV QR QG F STL ERL EK QQ FY DI PT SSQ KA LLH SST SQ GR DV TLA PT MA FR Q GGG YN PLSS PQ K SER IH DT PVLL EKA DVR NV SM TSF TKD SGSR AI PG SSAV HTG AV ALSP QL GN TV QR KN SL PEE PT YA FPT SRD PL PSD A GG SY KV PSR FLI PRV EQ QN TM PNI YD TP KAM QGV SH NA PKA M QGV SLAG KEL ER GR EA PEN SP WI SG QT SFL SPD SD RL SVA SSD SRA SVV SS CSS I SM DSS SGSS SED SV KEL WM DVD FA KET AV SL QH KVA SS AAG LLL FV SR TWR FKD SLET NI HRI RR AAD HV EE SVR EFL D FA QGV GG TA CNL TD SYL QAR IRD QLQ TI SSSY QT LLDA KGSL DR CN WSL EVLV TD KV QN SLD DLER FVA TAR IV PED V KR FT SIV IA NG KLL FKQ NC EKG EM DL KC ER CIR PP QR ET ESY QE SS PF DR QPT TEH SF ELAR KN RV NV CW QQ SP NL QEK GK PT MEG KSN RN PD FHG MSP PPL TSP SPSG QN TER KI HL SKH SRL YFG ALF KAI SV FA SSL SN GQ PPEV FI TQ SKL VI TV GQ KL VD TLC SET QEK D ER N EIL CG SSHL CG LL KDL ALA TK SAV IQ Y PSP SAL SLL Q SEV ERL EH HSR K FRD TL E"
"Q8BIZ0","M RGRG NAR SLL VQ AV SLR PA TW HP CLD MG HL HR PSS RT SHR NL PHV FLL FL FVG PF N CLA SY SRA TELL YSL N EGL PAG VL IG SLA EDLR LL PRA SGR QN QQ LL HP ER TA SEG N PPL SF SLA SG GL SGQ YV TLN NR SGEL HT SA QEI DR EAL CLD GGGG AA WAG ST SIA SS PSS D SC LL LLD VLVL PQ EY FR FV KV KIA IR DI NDNA PQ FPI SEI SV WV PEN SPV NT RL AI EH PAV DP DV GI NGV QT YR LL DY HG MF TL DV EEN ENG ER TP YL IV MG ALDR ET QD QYV SII IA ED GGSP PLLG SATL TI GI SDI ND NC PL FID SQI NVTV YG NA TV GT PVA TV QAV DR DL GT NA QI TY SY SQ KV PQ ET KDL F HLD EV TG VI KLSS KI GG SVL QTH KL T ILA NG PGC IP AV IT ALV SII KVV FR PP EIV PRY IA NEV DG VV YL KEL EPV NT PIA FF TI RD PEG KY KI NC FL DG EG PF RLA PY KPY NN EY LLET TKP MD YEV QSF YEI AVVA WN SEG FHV KR II KV QLL DD NDNA PV FL QPL I EL TI EEN NA PNA FL TKL YA TDA DSG EMG RV SY FLG PD AP SY F SLD SV TG ILTV ST QL DREE KEK YR Y TVR AVD CG T PPR ESV A TV AL TVL D KN DN SPR FI NKD FSF FV PEN FPG YG EI GVI SV TDA D AGR NG WV AL SVM NQ SDI FV ID TG KG ML RA KV SL DR EQ QSS YTL WV EA VD GG EP ALSS TT KI TI LLL DI ND N PPL VLF PQ SNM SY LLVL PSTL PGSP VT EVY AVD KD TG MN AV IA YSI IG RRG PR PE SFR ID PK TG NI TL EEA LLQ TD YGL HR LLV KV SD HGY PE PLH STV MV NL FV ND TV SN ESY I ESLL R KE PEI NI EE KE PQI SI EPT HR KV ESM SC MP TLV AL SVI SLG SI TLV TG MG IYI CLR KG KKH HR EDD NL EV QI PL KG KI DLC MR ER KPV DI SNI"
"Q9Z275","M SDG VG TFR MV PEE EQEL RA QL EQL TT KD HG PV FG PC SQL PRH TLQ KA KD EL NEK EE TR EE AVR EL QEL V QA QAA SG EEL AL AVA ERV QA RD SAF LLR FI RAR KF DVG RAY ELL KG YV NF RL QY PEL FD SL SM EAL RC TI EAG YPG VLSS RD KYG RVV ML FNI EN W HC EEV TFD EIL QA YC FIL EKLL ENEE TQI NG FC IV EN FKG FT MQQ AAGL RP SDL KK MVD ML QD SF PA RF KA IH FIH QP W YF TT TY NVV KP FL KN KLLQ RV FV HGD DL DG FFQ EID EN IL PA DF GG TL PKY DG KV VA EQL FG PRA EV EN TAL"
"Q8R1C0","MI SSV CV SSY RG RK SG NK PP SK TCL KEE MA KG EA SEK III NV GG TR HET YR STLR TL PGT RLA WL AD PD GGGR PE SD GGG AG SSG SS GGGG GGGG C EF FF DR H PGV FA YVL NY YR TGKL HC PA DV CG PL FEE EL TF WG ID ET DV EP CC W MT YR QHR DA EEAL DI F ESP D GG GGG AG PGD EAG DD EREL ALQ RLG PH EGG SGPG AG SGG CRG WQ PR MW AL FED PY SSR AA RV VA FA SL FF ILV SI TT FCL ET HEA FNI DR NV TEI H RVG NI TSV RF RR EV ET EP IL TYI EGV CV M WF TL EFL VR IV CC PD TLD FV KN LL NI ID FVA IL PF YL EV GL SGL SS KAA RD VLG FL RV VR FVR ILR IF KL TR HFV GLR VLG HTL RA ST NEF LLL II FL ALG VLI FA TM IY YA ER IG AR PSD PRG ND HTD FK NI PI GF WW AVV TM T TLG YG DM YP KT WSG ML VG ALC ALAG VLTI AM PVPV IV NN FGM YY SLA MA KQ KL P KKR KK HV PRPP QL ESP IY CK SEE TSP RD ST YSD TSP PAR EEG VV ER KRA D SK QNG DA NA VL SDEE GA GL TQ PL ALA PT PEE RR ALRR SG TR DR NKK AAA CF LLSA GD YA CA DG SV RK EG NV EP KA CV PV SH TC AL"
"O88738-2","MV TG CG AA PPG TV TE RL PSV I VLSA GR KM AAAAA EASG PSC SS AAAA AG AGAA GV SE WL VLR DG C MR C DAD GL HSL SY HP AL NA ILAV T SRG TI KVI DG T SGA TL QA SAL SA K PGG QV KC QYI SA VD KVI FV DD Y AVG CR KDL NGI LLL DT AL QT PV SK QD DVV QLEL PV TEA QQ LLSA CI EKI DV SST EGY DL FI TQL KD GL KN TSH ET AA NH KV AK WA TV TF HL PH HVL K SIA SA IV NEL KKI NQ NVA AL PVA SSV MD RL SYLL PSA RP ELG VG PGR SV DR AL MY SEA NRR ET FT SW P HVG YR WAQ PD PMA QAG FY HQ PA SSG DD RAM CF TC SV CL VC W EPT D EP WSE HER HSP NC PFV KG EH TQ NV PL SVTL AT SPA QL PSA DGA DR IA CFG SG SC PQ FL AAA TK RG KI CI WDV SKL MKV HL KF EI NA YD PA IV QQL ILSG DP SS GVD SR RP TLA WL EDSS SCSD IP KL EGD SD DLL EDSD SEE HSR SD SV TG HT SQ KEA MEV SL DI TAL SIL QQ PEKL QW EI VA NVL ED TV KDL EEL GA NPSL TN SK SEK TK EK HQ EQ HNI PF PC LLA GGLL TY KSP AT SP ISS N SHR SLD GLSR TQG ESI SEQ G ST DN ESC TN SEL N SPLV RR TLPV LLL YSI KE SD EK AG KI FSQ MN NI MSK SL HD DG FTV PQ II EM ELD NQ EQ LLL QD PPV TYI QQ FAD AAA SL TSP D SEK WN SV FPK PGAL VQ CL RL PK FA EE ETL CID SI TP CA DG IH LLV GLR TC SV ESL SA IN QV EAL NNL NKL N SAL CN RR KG DL E SNL AVV NGA NI SV IQ H E SPA DV PE HLL IR P EQR NVV SGG YL VLY KM NY TTR IV TLEE EPV KI QHI KD PQD TI TSL ILL PPD ILD NR ED DC EE PA EEM QLA SK NGI EREK K SDI STLG HL VV TT QGG YV KVL DLSN F EIL A KV EPP KK EG TEE QD TFV SV IY CSG TD RL CA C TK GG EL HFL QI GG TCD DID EAD ILV DG SLSK GI EP ALEG SRPL SN PSS PGI SGV ELL VD QPF TL EIL T SLV EL TR F ETL TPR FSA TV PP C WV EV QQ EQ QQ RRH PQ HLH QQH HGD AA QH TR TW KLQ TD SN SWD EHV FEL VL PKA C MVG HV DF KF VLN SN IT SV PQI QV TLL KN KA PGLG KA NAL NI EV EH NG NP SLV DLN EEM HH MDV EE SQ CL RL CP FL ED HK EDIL CG PV WLA SGL DL SGH AG ML TL TSP KLV KG MA GG KYR SFL I HV KAV SD RG AAD EM CSS GLR PVV RL PSL K QQG HKG Y SLA SLLA KV AA GK EK SS NV KN ENA GG TR KSE NL RG CD LLQ EV SVTI RR FKK TSI CK ERV QR CA ML QF SE FH EK LLN TL CRR SD DG QV TEH AQ SL VLD ALC WL AG VH SNG SGSS KEG NEC LLSK TR KCL SD IV RV C FF EAGR SI AH KC AR FL AL CI SNG KC EP CQ PG FG SVLL KA LLD NM CFL PAA AT GG SV YW YFV LLN YV KD EDL AG CST AC AALL TAV SR QL QD RL TPL EA LLQ TR YGL YSS PF DP VLF DL EM SGSS WK TV YSS STAV QSD EI DLSD VLSG NG RV SS CT AA EG SF TSL TG LLEV EPL HFT CV ST SDG TRI ERD DA ST FTV SS FGV PP AVG GL SSG TVG EA ST ALSS AA QV ALQ SL SHA MA SA EQ QLQ VLQ EK QQ QLL KLQQ QKA KL EA KL HQ TT AAAA AAA SAA AAAA AG PV HN AV PSN PV AAPG FFI HP SD VI PP TP KT TPL FM T PPL TPP N EAV SV VI NA ELA QL FPG SV ID PPAV NL AA QN KN SS KSR MN PLG SGL AL AI SHA SH FL QPP PH QSI II ER MH SGA RR FV TLD FGR PI LL TD VLI PT CG DLA SLSI DI W TLG EEV DGR RLVV AT DI ST HSL ILH DLI PPPV CR FM KI TV IGR YG ST NA RA KI PLG FY YG HSY IL PW ESEL KLM HD PL RG EG ESA SQ PEI DQ HL AM MV ALQ ED IQ CR YNL AC HRL EA LLQ SI DL PPL NSA NNA QY FL RK PD KAV EED SR VF SAY QD CI QLQL QL NL AH NAV QRL KVA IGA SR KLL NET SG PEDL IQ TSS TE QL RT IV RY LL DT LL SLL HSS NG HSV PA VLQ ST FHA QA C EEL FK HL CI SG TP KI RLH TG LLLV QL CGG ER W WG QFL SN VL QEL YN SEQ LL IF PQD RV FM LL SC IG QRSL SN SG VL ESLL NLL DN LL SPL QP EL SM HRR TEG VLDI PMI SW VV MLV SR LLD YVA TV ED EAA AA KK PL NG NQ WSF IN NNL HTQ NL NR SS KGG SSLD RLY SR KI RK QLV HH KQ QL NLL KA KQ KAL V EQ MEK EK IQ SN KG SS YK LLV EQA KL KQA TSK H FK DLI RLRR TA EW SR SNL DT EV TT TKE SP EI EPL PF TL AH DR CI SV VQ KL VL FLL SM DF TC HAD LLL FV CK VLAR IA NA TR PTI HL CEI VN EP QLER LLLLL VG TD FN RG DI SW GGA WAQ YSL TC ML QD IL AG ELLA PV AA EA MEE CTV SED VG AT AGD SD DSL QQ SP AQ LLET ID EPL TH EI AG T PPL SSL EK DK EI DL ELL QDL MEV DID PL DI DL EKD PL AA KV FK PI SS TW YD YW GAD YG TY NY NPY IG GLG MPV AK PP SN TEK NG SQ TV SVSV SQAL DA RLEV GL EQ QAEL ML KM M STL EAD SIL QAL TN TSP TF SQ SPTG TDD SLLG NL QPA NQ N SQL MI QL SS VP ML NV C FN KLF SML QV HHV QL ESLL QL WL TLSL NSS SSG NK EN GA DI FLY NA NRI PV ISL NQA SIA SFL T VLA WY PN TLL RT WCL VL HSL TLM TN MQL NSG SSSS IG IQ ET TAH LLV SD PNL IH VL VK FL SG TSP HG TN QH SP QV GP TA TQA M QE FL TRL QV HL SS TC PQ IF SE LLL KL IH IL ST ER GA FQ TG QG PL DA QV KLL EF TLEQ NF EVV SV STI SA VI ESV T FLV HH YI TC SD KV MSR SG SDSS AGA RA CFG GL FA NL IR PG DA KAV CG EM TRD QLM FD LLKL VN ILV QLPL SS NR EY SA RV SV TT N TTD SV SDEE KV SG GK DV NG SSA ST PG SPA CVA DL VL AN QQ IM SQ IL SAL GL CN SSA MA MI IGA SGL HL TKH EN FHG GL DAI SV GD GL FT IL TTL SKK A ST VH M ML QP IL TY MA CG Y MGR QG SLA TC QL SE PLL WF ILR VL DT SD AL KA FH DM GGV QL IC NN MV TST RA IV N TAR SMV ST IM KFL DSG PN KAV D STL KTR ILA SE PD NA EG IH NFA PLG TI TSS SP TA QPA EV LLQA TPP HRR AR SAA W SYI FL P EEA WC DL TI HL PSA V LL KEI HIQ P HLA SLA TC PSSV SV EV SA DG VN ML PLST PV VT SGL TYI KI QLV KA EVA SAV CL RL HR PR DA STL GLSQ IK LLGL TA FG TT SSA TV NN PFL P SED QV SKT SIG WLR LL HH CL THI SDL EGM MA SAA AP TAN LLQ TC AA LLM SPY CG MH SP NI EV VLV KI GLQ ST RI GL KLI DI LLR NC AASG SD PT DL NSP LL FG RL NGL SSD ST ID ILY QLG TT QD PG TKD RI QALL KWV SDSA KMA ALKR SG RM NY MC PSS SAV EYG LLM PSP SHL HCV AA IL WH SY ELLV EY DL PALL DR ELF ELL FN WSM SL PC NV VLKK AVD SLL CSM CH IH PN YF SLL MG WMG II PPPV QC HH RL SM TDD SKK QDL SSSL TDD SK NA QA PL SL TE SHLA TLA SSSQ SP EAI KQ LLD SGL PSLL VR SLA SF CF SHI SY SE SI AQ SV DN SQD KL RRH HV PQ HC NKM PI TA DL VA P ILR FL TEV GN SH IM KD WL GG SEV NPL WTA LL FLL CH SG STA GG HNL GA QQ SS TR SA SH SSA TT TVL TT QQR TAI ENA TV AF FLQ CI SC HPN NQ KL MA QVL CEL FQ TA PQ RG SLPT SG NI SG FVR RL FL QL ML ED EKV TM FL QSP CPL YKG RI NA T SHV IQ H PM FG AG HK FR TL HL PV ST TLSD VLD RV SD TP SI TA KLI SEQ KD DK EK KN HEE KEK V KA ENG FQD NY SV VVA SGL KSQ SK RA MA ST PPR PPSR RGR TI PD KIG SASS SAD AA SK II TV PV FHL FHR LLAG QPL PA EM TL AQ LL TLL YDR KL PQG YR SI DL TV KLG SK VI TD PSL SK TD SF KRL HP EKD HG DL VG SC PED EAL TP SD EC MDG VLD ESLL ET CPI Q SPL QV FAG MG GLAL IA ERL PML YP EVI QQV SAPV IA ST TQ EK PKD SD QF EWV TI EQ SGEL VY EA PET I AA EPP PV K SAV QA TSP IPA HSL AA FGL FL RLPG YA EV LL KER KH AQ CLL RL VLGV TD DG EG SH IL QSP SA NVL PTL PF H VLR SLF SA TPL TTD DGV LLRR MAL EIG ALHL ILV CL SAL SH HA PRV PN SSL SQ TEP QV SN SH NPT SAEE QQL Y WA KG TG FG TG STA SG WDV EQAL TKQ RLEE EHV TC LLQ VLA SY IN PM SGAV NG EAQA SP ESR A QN SSAL PSV LL ELL SQ SCL IPA MSS YLR ND SVL D MAR HV PLY RALL ELL RA IA SC TSM VP LLL PLST ENG EEEE D EQ SEC QT SV GT LLA KM KT CVD TY TN RLR SKR EN VK AG VK PDA PD QE PE GLA LLV PDI QR TA EI VH AATA NLR QA NQ EK KLG EY SKK VV M KP KPL SVL KSL EE KYV AV MK KLQ FD TF EMV SEDD DGKL GF KV NY HY M SQV KN AN DA N SAA RAR RL AQ EAV TL ST SLPL SSSS SV FVR CD EERL DI MK VLI TG PAD TP YA NG CF EF DV YF PQ DY PSS PPLV NL ET TGG H SVR FN PNL YN DG KV CL SIL NT W HG RP EE KW NPQ TSS FLQ VLV SV QSL ILVA EPY FN EPG YER SRG TP SG TQ SSR EY DG NIR QA TV KWA ML EQ IR NP SPC FK EV IH KH FYL KRI EL MA QC EEW IA DI QQ YSS DK RV GR TM SH HAA ALKR HTA QLR EELL KL PC PE GLD PDI EDA SP VC RA T AGA ED TL THD HV NP SSSK DL PSD FQL"
"Q3UMY5-3","MN RV SSD PV AI PDD SI SAA ST SDV QD RL SAL ESR V QQ QED EI TVL KA ALAD VLR RL AI SED HVA SV KK SM P SKG QP SLR EAI SM SC IT NG SGI SR KQ NH T SSV SI AR KETL SSAA KSI KR PP TA EK SH NSW EN SDD SR NKL MK TV ST SKL I SK VI KN AD KH KDV IV NQA KM STR EK NSQ EG EYI KM FM RGR PI TM FI PSD VD NYD DI RT EL PP EKL KL EWV YG YRG KD CRA NV YLL PTG EI VY FIA SVV VL FN YEE RT QRH YLG HTD CVR CL AV HPD KIR IA TG QI AG VD KDG R PL QP HV RV WD SVSL TTL HVI GLG TF ERG VG CL DF SK AD SGV HL CVI DD SN EH ML TV WD WQ KKSK IA EI KT TN EV VLAV EF HPT DA NTI IT CG KSH I FF W TW SG NSL TR KQG I FG KY EK PK FV Q CLA FLG NGD VLTG DSG GV ML IW SK TMV EPP PG KG PKG VY QI NR QI KA HDG SV FTL CQ MR NG MLL T GGG KDR KI IL W DH DL NL ER EI EV PD QYG TIR AVA EG RA EQ FL VG TSR NF IL RG TF NDG FQI EV QG HR DEL W GLA TH PF KD LLL TCA QDR QV CM WN SV EH RL EW TRL VD EPG H CAD FH PSG TV VA IG TH SGR WF VLDA ETR DLV SI HT DG N EQL SV MR YSV DG TLL AVG SH DN FI YL YT VLEN GR KY SR YG KC TG HSS Y IT HL DW SP DN KH IM SN SG DY EIL YW DI ENG CKL IR NR SD CKD ID W TTY TC VL GF QV FGV W PEG SD GT DI NAL VR SH NRR VI AVA DD FC KV HL FQ Y PC SKA KA PSH KY SA HSS HV TNV SF TH ND SHL I STGG KDM SI IQ W KLV EKL PV PQ NEV IT DA SV TKT PASS SE TA RP SN SP PLPP SLPL TG TAEE ESR MG SSP TLV EN SLEQ IA EP SEE QSE WG SE DLG VV ID EE PA SEL SET QG AT EL PEE ERG IT PLC"
"Q9EPQ7","MD P SWA TQ ESEA VA EK VL RY RR DA SG WKK CR EG NGV SI SW RP SEE FPG NLY RG EGIL CG TP EEV W DC IK PVA SGLR EK WDD NV SSF EI VQ SI TD ML CV SR TST PSAA M KLI SP RD FV DL VLV KKY EDG TI SS NA THV EH PL CPP KPG FV RG FN HP CG C FC EPL PGD PN KT NLV TF FQ TDL SG YL PQ SV VD SF FPR SMA EF YP NL QK AVR KF HH"
"Q9JIY2-2","MD HTD NEL QG TN SSG SLG GL DV RR RI PI KLI SK QA SK VK PAPR TQR TV SRM PA KA PQG D EG FD YN EEQR YD CK GG EL FG NQ RR FPG HL FW DF KI N ILG EK DD TPV HF CD KC GL PI KV YGR MI PC KHV FC YD CA ILH EK KGD KM CPG CSD PV QRI EQ CT RG SL FM C SIV QG CKR TYL SQR DL QA HIN HRH MR AG KPV TRA SLEN VH PP IA PPPT DI PDR FIM PPD KH HM SHI PP KQH IM MPP PPL QHV PH EH YNQ PH EDI RA PPA EL SMA PPPP R SVSQ ET FRI STR KH SNL ITV PI QDD SSSG AR E PPPP A PAPA HH H PEY QGQ PVV SH PH H IM PP QQH YA PPPPPPPP I SH PM PH PPQ AAG TP HL VY SQA PPPP MT SAPP PI TPP PG HI IA QM PP YM NH PPPG PPPP QH GG PPV TAPP PH HY NPN SLPQ FT ED QG TLSP PF TQ PGG MSP GI WPA PRG PPPP PRM QG PP SQ TPL PG PH HPD QTR YR PY YQ"
"Q8BK26","M AVG NI NEL PEN ILL EL FI HI PA RQ LLLR CR PV CSL WR DLI DLV TL WKR KCL QEG FI TED W DQ PV AD WKI FY FLR SLQR NLL H NP CA EE GF EF WSL DV NGG D EW KV EDL SKD QR KE FPN D QV KKY FV TSY YT CL KSQ VV DL KA EG YW EEL MD TTR PDI EV KD WF AAR PD CG SK YQL CV QLL SSA HA PL GT FQ PD PV MI QQ KSD AK W SEV SH TF SN YPP GVR YI WFQ HGG VD TH YW AG W YG PRV TN SSI TIG PPL P"
"P29974","MKT NI IN TW H SFV NI PNV IV PAI EKEI RR MEN GA CSS FSD DD NGSL SEE SEN ED SF FR SN SY KRR GP SQR EQ HL PG TM ALF NV NN SSN KD QEP KEK KKKK KEK K SKA DD KN EN KK DP EK KKKK EKEK EKKK KEE KT KEK KEE EK KEV VV ID PSG NTY YN WL FCI TL PVM YN W TMI IA RA CFD ELQ SD YL EY WLI FD YV SD VV YL AD M FVR TR TG YL EQG LLV KD RM KLI EKY KA NL QF KLD VL SVI PT DLL Y IK FG W NY PEI RL NR LL RI SR MF EF FQR T ETR TN YP NI FRI SNL VM YIV II IH WNA CV YY SI SKA IG FG ND TWV YP DV ND PE FG RLAR KYV YSL YW STL TL TT IG ET PP PVL D SE YI FV VVD FL IG VLI FA T IVG NIG SMI SN MN AA RA EFQ SRV DAI KQY MN FR NV SK DM EK RV IK W FD YL WTN KK TVD ER EVLR YL PD KL RA EI AI NV HLD TLKK VRI FA DC EAG LLV EL VLKL QP QV YSP GD Y IC KKG DI GR EM YII KEG KL AV VAD DGI TQ FV VL SDG SY FG EI SIL NI KG SK AG NRR TA NI K SIG Y SDL FCL SKD DLM EAL TEY PDA KT ML EE KG RQ IL MK DGLL DI NI AN MG SD PK DLEE KV TR MEG SVD LLQ TR FAR ILA EY ESM QQ KL KQ RL TKV EK FL KPL I ET EF SAL EE PGG ESEL TE SLQD"
"Q8CDD8","MNV HQG SD GD WSL QP EL SCL GD EAL AA TQ EKEG SSLV SSGL HSV TY PL AAR SEDL ALD YA SQ PASL PH PH IM PL PED NKG SC FQ SG SKR SH EPF IV PER FGN SGL GF GGGA HSQ AP EK VT LLV DG TR FV VN PQ IF TA HPD TML GR MFG PGR EY NF TR PN EKG EYV IA EGI SATV FR TVL D YY KTG II NC PDG ISI PDL RD TCD YL CIN FD FN TIR CQ DL SA LLH EL SN DG AH KQ FD HYL EEL IL PI MVG CA KKG ER EC HIV VL TDED SVD WD ED HPP PMG EEY SQ IL YSS KL YR FF KYI ENR DVA KT VL KER GL KNI R IGI EGY PTC KEK IK RR PG GR SEV IY NYV QR PFI QM SW EKEE GK SR HVD FQ CVR SK SLT NLV AAG ED VLED QEI IM HH PP QVD ELD RL NA PLSQ MA PND FQD"
"Q60736","M IT W SFI DL WR TSH STL FQ MTL AT VL MA PVL GD CG PP PLL PFA SP TN QLY EST TF PSG TVL KY TC HHG FK RV NSS HL SCD ENG SW VY ST FC AR KR CKN PG ELV NG KV EI PSD LLVG SII EF SC SKG YLL IG SA TSR CEV QG KG VD WSD SL PE CV IA TC E PPPP I SNG KH SGR DD DL YT FG SVV IY NCD PT FT LLG NA SI VC TVV NR TV GV WR PH PP AC QK IV CHR PQ IP KG YLA PG FR QF YA YRD AL EI RC KK GF IL RG SSV IH CEA NG EW FP SI PTC EP NG CT NI PDI SYA SW EGY KF PLR NF EV FEI GA KL KY QC KPG YRA SL ND PQ TV TC QE NL TW SST NG CER IC CPT PD MEK IK IV SERR DF TG TCI YA YGD YV FY IC NEG SY PM ST DGR SSC QA DG KW D PA IP SC QAD SGL QN RL ALF TF PNI SET NV TN KT YL FG H EEN ST EH AM KGV CL KP MVI NG NL SV ER VI YA EL ENI TI QCD PG YT IVG SP NI IC SN RT W YP EV PSC QM EVL ED CR IV SR GA QLL HCL SS PED V HR AL KVY KL FL EI ERL EH QK EK WI QL HR KPQ SM KI NR SF RL CN"
"Q8CD78","M SEA DSS SGF AG SV EN GT FL EL FPT SLST SV DSS SG HL SNV YI YV SI FL SLL AF LLLLL II ALQ RL KNI I SSSS SY PE YP SDAG SS FT NL EV CSI SS QR STF SNL SS"
"Q64387","MK IL FC DV LLL SLL SS VF SSC PRD CL TC QEKL HPA PD SF NL KT CIL QC EEKV FPR PLW TV CT KV MA SGSG QLSP AD PEL V SA ALY QP KA SE MQ HL KRM PR VR SLV QVR DA EPG A DA EPG A DA EPG AD DA EEV EQ K QLQ KR FGG FTG AR K SAR KLA NQ KR FSE FMR QYL VL SM Q SSQ RRR TL HQ NG NV"
"Q8K3P1-5","MAA AQ PRL PAG AA MVR RLA RG CW SA FW DY ET PKV IV VR NR RLG FV HR MV QLL ILL YFV WVA SGAG TAL SHR YV FIV QK SY QD SE TG PE SS II TKV KG ITM SEH KV WDV EE YV KPP EGG SVV SII TRI EV TPSQ TLG TC PE SM RV HSS TC HL DDD CV AG QL DM QG NG IR TGR CV PY Y HGD SK TC EV SA WC PV ED GT SEN HFL GK MA PN FT ILI KN SI HY PKF KF SKG NIA SQ KSD YL KH C TFD QD SD PY CPI FRL GF IV EQAG EN FT EL AH K GGV IGV II NW NC DLDL SE SEC NP KY SFR RL DP KYD PA SSG YN FR FA KY YKI NG TT TTR TLI KA YG IRI DV IV HG QAG KF SLI PT II NL AT ALT SIG VG SFL CD WI LL TF MN KN KLY SH KK FD KV RT PRH PSSR W PVTL AL VLG QI PPPP SH YSQ DQ PP SL PSG EG P ALG EGA ELPL AV Q PPR SC SS SAL TEQ VVD TLD QH MG QR PPV PE PSQ QD ST STD PK GLA QL"
"Q3UY96-2","MEE PTV QF SD EDL VD NF PP MDD ERV QL EDL EF EVER PSE GL EDEG SH SSA KK ESK GA EK MR KST TKD QV QA FHL RK SLN LLD KM HEE KDV FI QKT KG EL HI CR QR MD LL NK QQ ESL AA EI AT EKEA NN MAA IG RL QAA SRRL QT EL EN EK DLQ SKI TA ML KD SEN AM W HI EI QKG QF ED VR KH HEA EA EAR QR GL EVH SAR QL QR EREA MEK SEK NR LLRA RK SLH TQ KEL GLR HQ KLV EDA QR N HRI AV KFL KA SLG RVR ER EQ KEE M ESR TH MQ RR MDA VLSL KN NI TA SR ETL KK FQA WG QT RA DLA KQ KAL TEK EV IL SQ GG DA FK YL FH QRR HQ ELEA QK RA FEE EQ KLR KQ EIV NR IL KEEA EEEQ RKRR QH PL SK PI NRR TL RD KT W QYI SD FC EG KSVL TSQ QER ER ELLL Y PK TV CVI KA ISS ESV QV DLG SI ST ED EVLA EPD I SGL WN KE SY QV PK ED MER KPV GG SKM EKD IL AR TM EQLR SG VV QK QVV SGR EF KGR PF NSK PEV IH FKD F DIG KVY KK KI TLI NA TY TI NY CKL VGV EE NL KD FIH ID F E PPG PM SAG M SC EVLV TF KPM IN KDL EG NV SFL AQ TG SF SVPL KC ST KK CSL SL DK EL ID FG TY VVG ET TSR II TLT NVG GL GT KF KFL PD SE FY EMD ESQ PAM KI SSL FTC EE KI IY EK IM TSL SEQ QL EV ND SSLV DL QSL KE SEK QL DD PEV TT AAV SAM TM IP SEE QA EI TLG EV TEG EIG PF SSV KV PI TF TPV IPG EV QT KF KV MF KN PQSP PIY"
"Q8BKS9","MEV KGKK KF TG KSP QT SQG KN KF H KN SE SSSS KT FPR KAV KE GG PKV TSK NF EK GA TK PG KK GV KQ FKN KPQ GG KG PKD KFQ KA NKF SKK RK FQ PDG ESD ESG A KK PK WDD F KKKK KEL KQ SR QLSD KT NYD IVV RA KH IW ESL RR KD CD KEK RV KLM SDL QKL I QG KI KT IA FA HD ST RV IQ CFI QYG NEE QR KQA FQ ELQG DLV EL SKA KY SR NIV KK FLM YG SK P QVA EI IR SF KG HV RK ML RH SEA SA IV EY AY ND KA ILEQ RN ML TEEL YG NTF QL YK SAD HP TL DK VL ELQ PA KL ELI MD EM KQ IL TP MA QK EA VI KH SL VH KV FLD FF TYA PP KPR SEL I EA IR EAVV YL AH TH DGA RV AM HCL W HG TP KDR KV IV KT MKT YV EK VA NG QY SHLV LLAA FD CI DD T KLV KQ III SEI I SSL P SIV ND K YGR KVLL YL MSP RD PA HTV PEL I ELL QKG DG NA H SKK D TAI RRR ELL ESI SPA LL SYL QGH TQ EV VL DK SAC VLV SD MLG SATG DV QPA MDA IA SL AAA EL HPG GK DG EL HVA EH PAG HL VL KW LL EQD KKM KE SG KEG CFA K TLV ER VG MK NL K SWA SI NRG AI ILSS LLQ SC DQ EV VN KV KG GL KPL IP TLEK NK SS SRG IQ TLL EKL TA"
"P51906","MG KPT SSG CD WRR FLR NH WLLL STV AAV VL GI VLG VVV RGH SEL SNL D KFY FA FPG EIL MR ML KLV IL PL IV SS MI TG VA ALD SNV SG KI GLR AVV YY FST TVI AV IL GI VLVV SI K PGV TQ KV NDI NR TG KT PEV STM DA ML DL IR NM FPE NLV QA CF QQY KT KR EE VK PV GD PGG NA TEV SV TTA MTT M SEN KT KE YK IV GLY SDG IN VLGL II FCL VF GLV IG KMG EK GQ IL VD FF NAL SDA TM KIV QII MC YM PIG IL FLI AG KII EV ED WEI FR KL GLY MA TVL SGLA IH SLI VL PLL YF IV VR KN PFR F ALG MA QALL TAL MI SS SSA TLPV TFR CA EE KN QVD KRI TR FVL PV GA TI NM DG TAL Y EAV AAV FIA QL NGL DL SI GQ IV TI SI TA TAA SIG AAGV PQA GL VT MVI VL SAV GLPA EDV TL II AV DW LLDR FR TMV N VLG DA FG TG IV EKL SKK ELEQ MDV SSEV NIV NPF AL EPT TL DN EDSD TKK SY VN GG FAV DK SD TI SF TQ TSQ F"
"Q9WVP1-2","MSA SA VF IL DV KG KPL I SR NY KG DV PM TEI DH FM PLL MQR EEEG VL AP LL SHG RV HFL WI KH SNL YL VA TTL KNA NA SL VY SFL YK TV EV FC EY FK ELEE ESI RD NFV IV YD LLD EL MD FG FPQ TTD SK ILQ EY IT QQ GN KL ETG K SRV PP TV TN AV SWR SEG I KY KK NEV FI DVI ESV N LLV NA NG SVLL SEI VG TI KL KV FL SGM PEL RLGL NDR VLF EL TGL SG SK NK SV EL EDV KF HQ CV RLSR FD NDR TI SFI PP DG DF ELM SY RLST QV KPL I WI ESV IEK FSH SRV EI MV KA KG QF KK Q SVA NGV EI SVPV PSD AD SP RF KT SVG SA KYV PEK NV VI WSI KSF PGG KE YL MRA HF GL PSV ET EEV EGR PP IGV KF EI PY FTV SGI QVR YM KII EK SG YQ AL PW VR YI TQ SG DY QL RT S"
"Q9QZ47-9","MSD EE T EQV EE QY EEEE EAQ EEEE VQ EEEK PR PKL TA PKI PEG EK VD FD DI Q KKR QN KDL MEL QAL ID SH F EAR KKEE EELI AL KER IEK RRA ERA EQ QRI RA EKER EPQ N RLA EEKA RR EEED AK RRA ED DM KKKK ALSS MGA NY SS YLA KAD QK RG KK Q TAR EM KK K ILA ERR KPL NID HL SDD KL RD KA KEL WD TLY QL ETD KF EFG EKL KR QKY DI MTV RA RV EML A KF SKK AGA TA KGKV GGR WK"
