"UniProtID","tokens"
"A2AV25-2","MA HL VN SVSD VL EAL QR ER GL GR PRV KA DLQ RA P SRG AR PRG CA NG SR PRD CL DV LLSG QQD DG VY SI FPT HY PA GF QVY CD MR TD GGG WTV FQ RR EDG SV NFF RG WEA YR EG FG KL TG EH WL GL KR IH AL TT QAA YEL HV DLED FD NG TA YA HYG SF GV GL FSV DP EE DG YPL TV AD YSG TAG D SLL KH SG MR FTT KD RD SDH SEN NC AA FY RGA WW YR NC HT SNL NG QYL RGA HA SYA DGV EW SSW TG W QY SL KF SEM KIR PVR EDR"
"Q9D780","MGA LLW SLL LLL QEA KG FSG DD ED PEE V IG VL QE SI NLSL EI PSN EEI KH ID WL FQ N NIA IV KPG KKG QP AV IM AVD PR YRG RV SI SESS YSL HI SNL TW ED SGL YNA QV NL KT SE SHI TK SY HL RV YR RLSK PHI TV N SNI SEE GV CNI SL TC SI ER AG MDV TYI WL SS QD ST NT SH EG SVL ST SWR PGD KA PSY TC RV SN PV SN ISS RRI SVG SF CAD PG YP EK P SML CLL VK SL FLL LLLA ILTV GL CL FRA QK SY ET PR VR KLKR NRI KLR KK GK SG PTPV"
"Q8K3B1","MAA PGPG AGAA SGGA SGGG AGA GGGA SAG SGSS GV GG RL PSR VLEL VF SYL EL SELR SC AL VC KH WYR CL HGD EN SEV WR SLC AR SLA EE ALR TD IL CNL PSY KA KV RA FQ HA FST ND CSR NV YI KK NG FTL HR NPI AQ ST DG AR TKI GF SEG R HA WEV WW EG PLG TVAV IG IA TK RA PM QC QG YVA LLG SD DQ SWG WNL VD NN LLH NG EV NG SF PQ CN NA PKY QIG ERI RV IL DM ED KTL AF ERG Y EFL G VA FR GL PKA CL YP AV SAV YG NT EV TLV YL GK PL DG"
"P20443","MAA CGKT NK SHV IF KKV SR DK SVTI YLG KRD YVD HV SQV EPV DGV VLVD PEL V KG KKV YV TL TCA FR YG Q EDI DV MGL TF RR DL YF SRV QV YPP VG AM SVL TQL QE SLL KKL GD NTY PFLL TF PD YL PC SV ML QPA PQ DV GK SC GV DF EV KA FA SDI TD PEE D KI PKK SS VR LL IR KV QHA PP EMG PQ PSA EA SW QFF MSD KPL NL SVSL SK EI YF HG EPI PV TVTV TN NTD KVV KKI KV SV EQ IA NV VL YSS DY YV K PVA SEE TQ EK VQ PN STL TK TL VL VP LLA NNR ERR GI AL DG KI KH ED T NLA SSTI IK EGI DR TV MG ILV SY HI KV KL TVSG FLG EL TSS EV AT EV PF RL MH PQ PED PA KE SV QD ENL VF EE FA RQ NL KD TG EN TEG KKD EDAG QD E"
"Q9DBU6","MG RRSS DT EE ESR SKR KK KH RRR SSSS SSSD SR TY SRKK GG RR PR SD SR SW SRDR QLR SH SY ERR RRRR SSSS SS YG SRR KR SRSR SRG RG KPY RV QR SR SK SR TRR SRSR PRPR SH SRSS ER SSH RR TR SRSR DRD RR KV RD KEK R EK EKD KG KD KEV HSI KRG DSG NI KA GL EHL PPA EQA KA RLQL VL EAAA KAD EAL KA KER SEE EA KRR KEE D QA TLV EQ VK RV KEI EAI ESD SFV QQ TFR SS KDV KK AV EP SEV QHV TAA SG PA SAAA EPP ST GK EID PD SI PTA I KY QDD N SLA HP NL FI EKA EAEE KW FK RLI ALR QE RL MG SP VA"
"Q148V7","MAA MA PG GGG SG SGV NP FL SDSD EDDD EV AA TED RRA GL RLG AGV GLD PG SAG SLSP QD PM ALG SSAR PGL AV EM SAA PAAL GGSG ET PA RL SI DAI AA QLL RD QY LL TAL ELH TELL ESG R EL PRL RD YF SN PG NF ER QSG T PPG MGA PGI PGA SIV GGA GGR EP ST TSG GG QL NR AG SI STL D SLD FA RY SD DG NR ETD ER VA VL EF ELR KA KET IQ ALRA NL TK AA EH EV PL QER KN YK SS PEI QE PI KPL EKR ALN FL VN EF LL KN NY KL TSI TF SD EN DD QD FEL WD DV GL NI PK PP DLL QL YRD FG NH QV TG KDL V DVA SG VD EDEL EAL TP ILG NV PPTL DT PL PI EN TLL VQ KLED KI SLL NN EK W SLM EQ IR RL ESE MD ILKA EH FA TP AV GD SV QP SLV W SSQ KD SED NR QSP AV NSS DQ EK TK DV HL EI PD AAD SFI PK EN SSG SF PR KER EEL PP SSV SN KT TLH FD QP NR KL SPA FH QALL SF CR M SAD SRLG SEV SR IAD SEK SV ML ML GR CL PH IV PNV LLA KR EEL IPL IL CTA CL HPE PK ER DQ LLH IL F NLI KR PDD EQ RQ MIL TG CVA FAR HVG PT RV EA ELL PQ CW EQ IN HKY PERR LLVA ESC G AL AP YL PK EIR SSL VL SML QQ ML MED KA DL VR EAV IK SLG II MG YI DD PD KY QQ GF ELLL SAL GD P SER VV SA TH QV FL PA YAA WTT ELG NL Q SHL I PT LLN KI EK LLR EG EH GLD EH KL HM YL SAL QSL IP SLF AL VLQ NA PF SS KAKL HG EV PHI EV TR FPR PM SPL QDV STI IG SR EQL AV LLQL YD YQL EH EG TTG W ESLL WVV NQ LL PQL I EI VG KI NV T STA CV H EF SR FF WRL CR TFG KI FTN TKV KPQ FQ EIL RL SEE NI DSS AG NG VL TKA TV PI YA TG VL TC YIQ EE DR KLL VG FL EDV MT LLSL SHA PL DSL KA SFV EL GA NPA YH ELLL TVL W YG VV HT SAL VR CT AA RM F ELLV KG VN ETL VA QRV VP ALI TLSS DP EI SVR IA TI PA FG TI M ETV I QR ELL ERV KM QLA SFL ED PQY QD QH SL HT EV IR TFG RV GP NA EPR FRD EFV IP HL HKL AL VN NL Q IVD SKKL DI AT HL FEA Y SAL SCC FI SEDL MV NH FL PGL R CLR TDM EHL SP EH EV ILSS MI KE CEQ KV EN KTV QE PPG SM SI AA SLV SED TKT KFL NK MG QL TT SGA MLA NV FQR KK"
"Q3TRM8","MA TI GP SGL HPG ERA SVC PH EGV PR PSG SLEL ECL QQ FKV TR TQL QQI QA SLL CSM EQAL KG QD SPAP SVR ML PT YVR ST PHG TEQ GD FL VLEL GA TGA SLR VL WV TLTG TKE CRV EPR SR EFV I PQ EV ILG AG QQL FD F AAR CL SEFL DA YPV EN QGL KLG FN FSF PC H QT GL DR STL I SW TKG FRC SGV EG QDV VQ LLR DAI QR QG TYR I DV VA MV ND TVG TM MG C ELG TR PC EV GL IVD TG TNA C YM EEAR HVA ALD ED RG RT CV SI EWG SF YD ED AL GP VL TT FD SAL DR ESL T PGA QR FEK MIG GL YLG ELV RL VLV HL TQ HG VLF DG CA SPA LL SQG CI LLD HVA EM ED TA TG TA RV HT IL QDL GLSP RA SDA EL VQ YV CV AVC TR AAQL CAA ALAA VL SRL QH SR EQ QTL QV AV AT GGRV FER HPR FLR IL KE TVT LLA PN CDV SF IP SVD GGG RG VA MV TAV AA RLAA HRR ILEE TLA PF QL TL EQM TVV QA QMR EAM IR GLQG EA SSLR ML PT YV RA TP DG SER GD FL ALDL GG TN FRV LLV RVA EG SVQ II NQV YSI PE CRA QG SG QKL FD HIV DC IVD FQ KR QGL SG QSL PL GF TF SF PC KQL GLD QG ILL N WT KG FNA SGC EG QDV VY LLR EAI RR RQ AV EL NV VA IV ND TVG TM M SCG YDD PR C EM GL IVG TG TNA C YM EELR NVA SV PGD SGL MC IN M EW GA FGD DG SLG TL STR FD TSV D QA SI NPG KQR FEK MI SGM YLG EI VR HI LL HL T NLG VLF RG QKT QCL QAR DI FKT KFL SEI ESD SL ALR QV RA IL EDL GL TLT SDD AL MVL EV CQ AV SRR AAQL CG AGV AAVV EK IR ENR GL QEL TVSV GV DG TLY KLH PH F SKLV SA TVR KLA PQ CTV TFL Q SEDG SG KGA AL VT AV AC RL TQ MA HV"
"P50171-2","MA SQL RLR SAL ALV TGAG SG IG RAI SV RLAA EG AAV AA CDL DG AAA QD TVR LLG SPG SED GA PRG KH AA FQA DV SQ GP AA RRLL EEV QA CF SRPP SVVV SC AGI TRD EF LL HM SEED WD RVI AV NL KG T FLV TQ AAAQ ALV SSGG RG SII NI SSI IG KVG NI GQ TN YA SS KAG VI GL TQ TAA R ELGR HG IR CN SVL PG FIA TPM TQ KM P EKV KD KV TA MI PLG H MG DP ED VA DV VA FLA SED SG YI TGA SV EV SG MR PSW GG GQ EN RT QVV MR K"
"Q3TDN2-2","MAA PEE QDL TQ EQ TEK LLQ FQ DL TGI ESM EQ CRL ALEQ HN W NM EAAV QD RL NEQ EG VP SV FN PP PAR PL QG LLG WG Y YLI ML PFR FTY YT IL DI FR F ALR FIR PD PR SRV TD PV GD IV SF MH SF EE KYG RA HPV FY QG TY SQ ALN DA KREL RF LLV YL HG DD HQD SD EF CR NAL CA PEV ISL IN SR ML F WA CST NKP EGY RV SQ ALR EN TY P FLA MI ML KD RR MTV VG RL EGL IQ PD DL IN QL TFI MDA NQ T YLV SE RLER EER NQ TQ VLR QQ QD EA YLA SLRA DQ EKER KKR EE KER KRR KEE EV QQ QKL A EERR RQ NL QEE KER KL ECL PP EPSP DD PE SV KI IF KL PND SRV ERR FH FSQ SLTV IHD FL FSL KE SPEK FQI EA NFP RR VL PCV PSEE W PN PPTL QEA GL SH TE VL FV QDL TD E"
"Q80YA9-2","MAL IM EPV SK WSP SQ VV DW MK GL DD CL QQ YI KN FER EKI SG DQ LL RI TH QEL EDL GV SR IG HQ EL ILEA VD LLC AL NY GL ET ENL KTL SH KL NA SA KNL QN FI TG RRR SG HY DG RT SR KL PND FL T SVV DL IG AA K SLLA WL DR SP F AAV TD YSV TR N NVI QL CL EL TT IV QQ DC TVY ET EN KIL HV CK TL SGV CD HII SL SSD PLV SQ SA HL EVI QLA NI KP SE GLG MY IK ST YD GL HVI TG TT EN SPA DR CKK IH AGD EVI QV NH QTV PLI PRSP TSS VA TPSS TI ST PT KR DSS ALQ DL YI PPPP A EPY I PRD EKG NL PC EDL RGH MV GK PV HKG SESP N SFL D QE YR KR FN IV EE DT VL YC Y EY EK GR SS SQG RR EST PT YG KLR PI SM PV EY NW VG DY ED PN KM KRD SRR EN SLLR YM SN EK IA QEE YM FQR N SKK D TG KK SKK KG DK SN SPA HY SLL PSL QMD AL RQ DI MG TPV PET TL YH TF QQ SSL QH KSKK KN KG AI SG KSK RRI SC KDL G RG DC EG WL WKK KD AK SY FSQ KW KKY WF VL KDA SL YW YIN EED EKA EG FI SL PE F KID RA SE CR KK YA FKA C HP KI KSF YF AA EHL DDM NR WL NR IN ML TAG YA ER ERI KQ EQ DY W SESD KEE AD TP ST P KQD SPPP PYD TY PRPP SM SCA SP YV EA KH SRL SST ET SQSQ SSH EE FR QEV TG SSAV SP IR KTA SQ RR SW QDL I ETPL TSS GLH YL QTL PL ED SV FSD SAA I SP EH RR Q STL PT QKC HL QD HYG PY PLA ESER MQ VL NG NGG KPR SF TLPR DSG FN HC CL NT PVSA CD PQD DI QPP EV EEEEEEEE EE AAG EN VG EKN ENR EEKL GD SLQ DL YR AL EEA SL SPLG EHR I ST KM EY KL SFI KR C ND PV MN EKL H RLR IL KSTL KAR EG EVA II DK VLD NP DL TSK EF QQ WKQ MYL DL FL DI CQ ST TSN DPL SISS EVD VL TSSL TH TH SYI ET HV"
"Q9QUS6","MG E SPA SAVL NA SAGL FSL KM ETL ESEL TC PI CL EL FED PLLL PCA HSL CF SCA HR ILV SSC SSG ESI EPI TA FQ CPT CR YV ISL NHR GLD GL KR NV TLQ NII DR FQ KA SVSG PN SP SE SRR ER TYR PSS AM SS ER IA CQ FC EQD PP RD AV KT CI TC EV SY CDR CL RA TH PN KK PF TSH RLV EPV SD THL RG IT CL DH EN EKV NM Y CV SDD QL IC ALC KL VGR HR DH QVA SLN DR F EKL KQ TL EM NL T NLV KR N SEL EN QMA KL IQ IC QQV EV NTA MH EA KL MEE CD ELV EII QQR KQ MI AV KI KET KVM KLR KLA QQ VA NCR QCL ER STVL IN QA EH IL KEN D QAR FL QSA KNI A ER VA MA TA SSQ VLI PD IN FN DA FEN FAL DF SR EK KLL EGL D YL TA PN PP SIR EEL CTA SHD TI TVH WI SDD EF SI SSY EL QY TI FTG QA NFI SL YN SVD SW MIV PNI KQ NH Y TVH GLQ SG TRY IF IV KAI NQ AG SR NSE PT RL KT NSQ PF KL DP KM TH KKL KI SND GL QM EKD ESSL KK SH TP ER FSG TGC YG AAG NI FI DSG C HY W EVV MG SS TW YA IG IA YK SA PKN EWIG KNA SS WV FSR CN SN FV VR H NN KE MLV DV PP QL KRL GV LLD YD NN ML SF YD PA NSL HLH TF DV TF IL PV CPT FTI W NK SLM IL SGL PA PD FI DY PER QEC NCR PQ ESP YV SGM KA CH"
"Q8BLV3","M EP SD AAR PGPG RA FR GL SPR LLLL PLL PVLL GR GLR AG AAA SSG AAA ED SSA M EEL AT EK EAEE SHR QD SV SLL TFI LLL TL TIL TI WL FKH RR VR FLH ET GL AM IY GL IV GV ILR YG TPA TSG H DK SL SC TQ ED RA FST LLV NV SG KF FEY TLKG EI SPG KI NNV EQ ND MLR KV TF DP EV FF NI LLPP II FH AG YSL KKR HF FR NLG SILA YA FL GT AV SC FI IG NLM YG VV KL MK IVG QLSD KF YY TD CL F FGA II SA TD PV TVL AI FN EL HA DV DL YA LL FG ESVL ND AV AI VLSS SI VA YQ PAGL N THA FD AAA FF KSV GI FLG IF SG SF TMG AVTG VV TAL VT KF TKL HC FP LLET AL FFL M SW STF LLA EA CG FTG VVA VLF CG IT QA HY TY NNL SV ESR SR SK QLF EVL H FLA EN FI FSY MGL AL FT FQ KHV FSP I FI IGA FV AI FL GR AAH IY PL SF FL NLG RRH KIG WN FQ H MM MF SGL RGA MA F ALA IRD TA SY AR QM MF TT TLL IV FF TV WVI GGG TT PML SWL NI RV GV EEL SEED QN ENR W QY FRV GVD PD QD PP PN ND SF QVL QG DG MD SV GGSR TKQ ESA W IF RLW YI FD HN YL KP IL TH SG PPL TT TLPA W CG LLAR CL TSP QV YD NQ EPL R EDD SD FIL TEG DL TL TYG D STV TA NG SSSS YTA STSL ECG RR TK SS SEE VLER DLG MG DQ KV SSRG TPL VF PLQ ENA"
"Q8R5G7-2","M EPT PSPA PD AQ PP KPV PK PR TV FGL SN PA TA QR PGL SP IF WDP EV SR NSE CT QR SS PLL PSS SEQ PSV PN TM EM MP NA IY FGL DL RG RA QAA QDV TPD SSQA TV PTPA FR PT TG TV HI MD PG CL Y YG VQ PV GI PGA SD RR DG RGV CQ ERA EHR QDL ETR EDAG YA SLEL PGD SIL SLPT QDA ET SD DLI SP YA SF SSTA DR PV PLL SG WLD KLSP QG NYV FQ RR FV QF NGR SL MY FG SD KD PF PKG VI PL TAI EM TR SS KD NKF QVI TG QRV FV FR TE SEA QR DL WC STL Q SCL KEQ R LLG HPR PPH PPR PLR TG TLEL RG HKA KV FA ALI PG EL AL YK SEQ AF SLG IG IC FI ELQG C SVR ET KSR SF DLL TP HR CF SF TA ESGG AR QSW AA ALQ EAV TE TL SDY EVA EKV WSN PA NR H CA DC RA SR PD W AAV NLG VV IC KQ CAG QHR ALG SGI SK VQ SLKL DT SVW SN EIV QL FI VLG ND RA NC FW AG AL PPG EGL HPD SAPG PRG EFI SR KY KL GL FR KP HPR HPD HSQ LLQ ALC AA MAG PN LL KN MA QLL CV ET SEG EE PLSP SAL NG SLL SLL PSD SPGV YN EV VV PA TY RG FLY CG SI SN K AGA PPL RRGR DA PP RL WC VLGA AL EM FA SESS PEPL SLL Q PQD IV CL GV SPPP AD PG DL DR FPF SF EL ILT GGR IQ HFA TDG AD SLEA WI SAVG KW F SPL SC HQ LLG PG LLR MG RL WLR SP SHA GL AP GL WL SG FG LL RGD HL FL CPA PGPG PP AP ED MV HLR RLQ EI SVV SAA DT PD KK EHL VLV ETG R TLYL QG EG RL DF AA WN TAI GGAA GGGG TGL QEQ QM SRG DI PI IV DA CI SFV TQ HGL RL EGV YR K GGA RAR SLR LLA EF RR DAR SV KLR PR EH FV EDV TD TL KR FFR EL DD PV TSA R LL PR WR EAA EL SQ KN QRL EK YK EVI SCL PR VN RR TLA TL IG HL YRV QK CA SL NQ MC TR NLA LL FA PSV FQ TDG RG EH EVR VL QEL I DG YI SVF DID SD QAA QI DL EV SLI TT WK DV QL SQAG DL IM EV YI EQQL PD NCV TL KV SP TL TA EEL TN QVL EM RG AASG TDL WV TF EIL EHG ELER PLH PKEK VLEQ AL QW CQL PE PC SA SLLL R KV SMA HAG CL F TGV RR ESP RVG LLR CR EE PPR LLG NR FQ ER F FLV RG RC LLLL KEK KSS KP ER EW SL EGA KV YLG IR KKL KPP TL WG FTL IL EKM HL CL SC MD EE EM WD WTT SIL KA QH DD QQ SVVL RRR SS SDL AR QK FG TM PLL PI RG DD SG AT LLSA NQ TLR RL HN RR TL SM FF PM KSP QG SVEE QD ELEE PV YEE PV YEE VGA FP EL TKD TT FSS TW EW SA KSD PSL T SQR SF DQ PPL SKA SML G HEE RI PD PP PGPP SKSS SQA RG SL EEQ LLQ EL NNL ILR KG EPA SC PE SSSQ PTSP QA PSP TSL PTPT PSL PT QPP CT SN PP SSQ PL T"
"Q8VEG6","MRL IG M PKEK YD PP DP RR IY TI MSA EEVA NG KK SH WA EL EI SG RVR SLST SLW SL THL TAL HL ND NNL ARI PP DIA KLH NLV YL DL SSN KLR SLPA EL GN MV SLR ELLL ND N YLR VL PY ELG RLF QLQ TL GLTG NPL SQ DIM SLY QD PDG TR KLL NF MLD NL AVH PE QLPP RP WI TL KER DQ IL PSA SF TV MC YN VL CD KYA TR QL YG YC PSW AL NW EYR KKG IM EE IV NW DA DII SLQ EV ET EQ YF TLFL PAL KD RGY DG FF SP K SRA KIM SEQ ER KHV DG CAI FF KT EK FTL VQ KH TV EF N QVA MA N SDG SEA ML NRV MT KD NI GV AV VL EVH KEL FG TG MK PI H AAD KQ LL IVA NA HM H WD PEY SDV KL IQ TM M FV SEV KN IL EKA SSR PGSP TAD PN SIPL VL CA DL NSL PD SG VV EYL SN GG VAD NH KD FK ELR YN ECL M NF SC SG KNG SS EGR IT HG FQL KSA YEN NLM PY TN YTF DF KGV ID YI FY SK TH MN VLG VLG PLD PQ WLV EN NI TG CPH PH IP SD HF SLL TQL ELH PPLL PLV NGV HL PN RR"
"Q9JJ59","MRL WK AVVV TLA FV ST DV GV TTA I YA F SHL DR SLL ED IR HF NI FD SVL DL WAA CL YR SC LLL GA TIG VA KN SALG PR RLRA SWL VI TLV CL FV GI YA MA KLLL F SEV RR PI RD PW FW AL FV WTY ISL AA SFLL WG LLA TVR PDA EAL EPG NEG FHG EGG A PA EQA SGA TL QKLL SY TKP DVA FLV AA SF FL IVA ALG ETFL PY YTG RA ID SIV IQ KSM DQ FTT AVVV VC LLA IG SSL AAG IR GG IF TLV FA RL NI RL RN CL FR SLV SQ ET SF FD ENR TG DLI SRL TSD TT MV SDLV SQ NI NI FL RN TV KV TG VVV FM FSL SW QL SLV TF MG FPI IM MV SNI YG KY YK RLSK EVQ SALA RA ST TAEE TI SA MK TVR SF AN EE EEA EV FLR KLQQ VY KL NR KE AAA YM SYV WG SGL TLL VV QV SIL YY GG HL VI SG QM SSG NL IA FI IY EF VL GD CM ESV G SVY SGL MQG VG AA EK VF EFI DR QPT MV HDG SLA PD HL EG RV DF ENV TF TYR TR PH TQ VLQ NV SF SL SPG KV TAL VG PSG SG KSS CV NIL EN FY PL QGG RV LLDG KPI GA YD HK YLH RVI SLV SQ EP VL FAR SI TD NI SY GL PTV PF EM VV EAA QKA NA HG FIM ELQ DG YST E TGEK GA QL SG GQ KQ RVA MAR ALVR NPP VL ILD EA TSAL DA ESE YLI QQ AI HG NL QR HT VLI IA HRL STV ERA HL IV VLD KG RVV QQG TH QQ LLA QG GL YA KLV QR QML GL EH PL DY TA SH KE PP SN TEH KA"
"Q8BHH9","MAL NN FL FA QCV CY FLA FL FSF VV VV PL SENG H DF RG RC LL FT EGM WL SA NL TM QGR ER FTV QE WG PPAA CR F SLLA SLL SLLL AAA HA WR TL FFL CKG HEG SF FYA FLN LLV SA FVV FLV FIA ST IV SVG FT MW CD TI T EKG ST PH SC EE FQ ET DLEL NV DN SA FY HQ FA IA QF GL WA SWL A WLA IT TLA FL KV YH NYR QED LLD SL VH EK ELLL AR PT SR TSF QG EK SA VI"
"Q8BG07-2","M MRI PL QT AV EV SD W PC ST SHD PH SGLG M VLG MLA VLGL SSV TL ILFL WQG AT SF TSH RM FP EE VP SW SW ETL KG DA EQ QN NSC QL ILV ESI PEDL PF AAG SP TAQ PLA QA WL Q LLD TAR ESV HIA SY YW SL TGL DI GV ND SSSR QG EA LLQ KF QQ LLLR NI SV VVA TH SP TLA KT ST DL QVL AA HG AQ IR QV PM KQL TGG VLH SK FW VV DGR HI YVG SA NMD WR SL TQV KEL GA II Y NC SNL AQ DLEK TFQ TY W VLG TP QA VL PKT WPR NF SS HI NR FH PL RG PF DGV PT TA YF SASP PSL CP HGR TR DL DA VLGV MEG AR QFI YV SVM EY FPT TR FTH HAR YW PVL DN ALR AA ALN KGV HVR LLV SC W FN TD PTM FA YLR SLQA FSN PSA GI SV DV KV FIV PVG NH SNI PF SRV NH SK FMV TD KTA YV GT SN W SED YF SH T AGV GL IV SQ KT PR AQ PG AT TV QE QLR QL FER DW SSH YA MDL DR QV PSQ D CV W"
"Q60902-3","MAA PLV PLSQ QI PG GN PLY ESY YK QVD PA YTG RV GA SEA ALFL KK SGL SDI ILG KI WDL AD PEG KG FL DK QG FYV ALRL VA CA QSG HEV TL SSL SL TM PP PKF H DT SSPL MA TQ SSA ET HW AV RV EEKA KF DG IF ESLL PV NG LL SGD KV KP VL MN SKL PLD VLG RV WDL SD ID KDG HL DRD EF AV AM HLV YR ALEK EPV P SIL PP PLI PP SKR KK TV FAG AV PVL PA SPPP KD SLR ST P SHG SV SSL N STG SLSP KH SV KQ PP VA WVV PV AD KMR FD EI FL KT DLDL DG YV SGQ EV KEI FM H SGL TQ N LLA HI WAL AD TR QTG KLSK EQ F ALA MY FI QQ KV SKG ID PP QVL SPD MV PP SER GT PI PD SS STLA SG EF TG VK ELD DI SQ EIA QL QR EK YSL EQ DIR EK EEA IR QKT SEV QEL QN DL DR ET SSL QEL EAQ KQ DA QD RLD EMD QQ KAKL RD ML SD VR QKC QD ET QTI SSL KT QIQ SQ ESDL KSQ EDDL NRA KSEL NRL QQ EE TQL EQ SI QAG RA QL ET ILR SL KC TQD DI N QAR SKL SQL QE SHL EA HR SLEQ YD QV PDG V SG TSL P DLA TLN EGI LLA ER GG FGA MV KV EG DP FQ N KKG FGD PF SG KD PFA PSS SA KPP KT SSSG FAD FT SF GN EE QQL A WA KR ESEK A EQ ERLA RLRR QEQ EDL EL AI ALSK AD MPA"
"Q8C5W0-3","MAA QE WD WF QR EEL IG QI SDI RV QNL QV ER EN VQ KR TF TR WI NL HL EK CD PPL EV TDL FV DI QDG KIL MA LL EVL SG RN LLH EY KSS SHR IF RL NNI AK AL KFL ED SNV KLV SID AA EIA DG NP SLVL GL IW NI IL FFQ IKEL TG NL SRSS PSS SL SPG SGG TD SD SSY PP TPT TER SV AVAV KD QR KAI KTLL SWV QR KT RK YGV AV QD FAG SWR SGLA FL AVI KA ID PSL VD MKQ ALED ST RD NLEK AF SI AH DSL HI PR LL EP EDI MV DM PD EQ SI VT YV AQ FL ER FP EL EPED FV NPD KEA PI EST FV RI KE SP SEQ G SRV LLL SENG ER AY TV NQ ET SY PP PD KV FV CD QL ESP TGF CLD SA PSH KLSD SST EF MH EI ID QVL QG ST GK TG SIA EPT PE SSIL ST RK DG RR SN SLPV KK TV HF EA DLH KDA SC SKD PFY SSD FR FEG SP KA TK ELSK QDG HV SLA EV SK EKKK SEQ EA RL VL EAA SD KV PE ST VD GLD AV PQ DA QPSQ DSS FC NGTV ESP SSQG EKG PP PSS PGD HT LLA NST EL KV QLL TV EP MD KED YF ECI PL KA SK FNR DL VD FA ST SQA FG ED PSS HEK TRG EEEG SEN HA EK PG KR KSK SP RA ET EAA ESRL EP KKL EPP PKD PEQ ED QG HAL PP ET PAD KK PKV Y EKA KR K STR HH SEE EG EA ESG FSA VC EEEI PSA PPST SVSL ETLR SH SEE GL DF KP SPPL SKI SVI PH DL FY Y PH YEV PL AAVL EA YA EGG EDL K SED TDL EH PED SYL QD SREE EAD EDEE EAQ SSQ SSC SF SLPV DN SY PSV SE HV SHV DG SSEG PT SALG PGSP PSH ED HQ PK ET K ENG PV ESQ QSQ EPP NP EL PT KPL EEKL TEA STSS KK KEK R KH MD HV ESSL FIA PG TVR SSD DLEE NSS EH KV PSR NSH SDSS IYI RR HT NR SLEL SF HLY"
"Q64487-12","MV PV AR PL SLLL TF FL CA CA ET PP RF TR TPV DQ TGV SGG VA SF IC QA TGD PR PK IV WN KKG KKV SN QR F EVI EFD DGSG SVLR IQ PL RT PRD EA IY ECV A SN NVG EI SVST RL T VLR ED QI PR GF PT ID MG PQL KVV ER TR TA TML CAA SGN PD PEI TW FKD FL PV DT SN N NGR IK QLR SE SI GG TPI RG AL QI EQ SEE SD QG KY ECV A TN SAG TR YSA PA NL YVR ELR EV RRV PP RF SI PP TN H EIM PGG SV NI TCV AVG SP MP YV KW ML GA EDL TP ED DM PI GR NVL ELN DV RQ SA NY TCV AM STL GVI EAIA QI TV KAL PK PPGT PVV TE ST AT SI TLTW DSG NPE PV SY YII QH KP KN SEE PY KEI DG IA TT RY SVA GLSP YSD Y EF RVV AV N NIG RG PA SE PVL TQ T SEQ AP SSA PR DV QAR ML SSTT IL VQ WKE PEE PNG QI QG YRV YY TMD PT QHV NN WM KH NV AD SQI TT IG NLV PQ KT YSV K VLA FT SIG DG PLSS DI QVI TQ TGV PG QPL NF KA EPE SET SILL SW T PPR SD TIA SY ELV YR DGD QG EE QRI TI EPG TSY RL QGL KP NSL YY FRL SAR SP QGL GA STA EI SAR TM QSM FA KN FHV KAV MKT SVLL SW EI PEN YN SAM PF KIL YD DG KMV EEV DG RA TQKL IV NL KP EK SY SF VL TN RG N SAG GL QH RV TA KTA PD VLR TK PA FIG KT NL DG MI TV QL PDV PA N ENI KG YY II IV PL KK SR GK FI KP W ESP D EM ELD ELL KEI SR KRR SIR YGR EVEL KP YI AAH FD VLPT EF TLG DD KH YGG FTN K QLQ SG QE YV FF VLAV MD HA ESK M YA TSP YSD PVV SM DLD PQ PI TDEE EGL IW VV GP VL AVV FI IC IV IA ILL YKR KRA ESE SR KSSL PN SK EV PSH H PTD PV ELR RL NFQ TPG MA SH PP IP ILEL AD HI ERL KA ND NL KF SQ EY ESI D PG QQ FT W EH SNL EV NKP KNR YA NV IA YD H SRV LL SAI EGI PG SD YV NA NYI DG YR KQ NA YIA TQG SL PET FG DF WR MI W EQR SATV VM MT KL EER SRV KCD QY W PSR GT ETH GLV QV T LLD TV ELA TY CVR TF AL YK NG SS EKR EV RQ FQ FTA WPD HGV PEH PT P FLA FL RRV KT CN PPD AG PM VV HC SAG VGR TG CF IVI DA ML ERI KH EK TV DI YG HV TLM RA QR NY MV QT ED QYI FIH DA LLEA VT CG NT EV PAR NL YA YIQ KL TQI ETG ENV TG MEL EF K RLA SSKA HT SR FI SA NL PC NKF KN RLV NIM PY EST RV CL QPI RGV EG SD YI NA SFL DG YR QQ KAY IA TQG PLA ET TED FWR ML W EH NST IVV ML T KLR EMG R EK CH QY WPA ER SA RY QY FV VD PMA EY NM PQY ILR EF KV TDA R DG QSR TV RQ FQ FTD W PEQ GV PK SGEG FID FIG QV HKT KEQ FG QDG PI SV HC SAG VGR TGV FI TL SI VLER MR YEG VV DI FQ TV KML RT QR PA MV QT ED QY QFC YRA AL EYL G SF DH YA T"
"Q56A10-2","MSV NV STAG KG VD PN TVD TY DSG DD W EIG VG NL II DL DA DLEK DR QKF EM NN ST NTT TN TT KD CGG PA SNG TC ST SAL AD GL KFA SV QP SA PQG NSH KET SKSK VK RA KT SK DA NK SL PSA AL YG IP EI SSTG KR QEV QGR PG EA TG MN SAL GQ SV SGGG SSN PN SN GT ST GT SAA TAG AG SC GK SKEE KPG KSH SS RGA KRD KD AAR SR KEK HD LL QGH QN GGGG QA P SGG HL YG FG TK SNG SGA SP FH CGG AG SG SVG AAG EV SK TA PD STL MG N SML V KK EEEEEE SH RR IK KL KT EK VD PL FTV PA PPPP IA SSLA PQI PP SY FPP SS SNI AA PV EQLL VR TR SV GV NTC EVG VV TE PE CLG PC EPG TSV NL EG IV WH ET EEG VLVV NV TWR NKT YV GT LL DC TKH D WA PPR FC ESP T SDL EMR GG RGRG K RAR SAA AAPG SEV SF TE SR GLQ SK NR GGA NG KG RRG SL NA SG RR TPP NC AA EDI KA SPSS TN KR KN KPP MEL DL NSS SED SK PG K RVR TN SRST PT TP QG KP ET TFL D QG CSS PVL ID CPH PN CN KKY KH IN GLR YH QA HA HL DP EN KL EF EPD SED KI SD CEE AL SNV AL EC N ESS TSV SS YD QT KA PG SPG AG N PPG TP KG KR EHV SNG PG PI IG SK TG KN SG KKR GL NN EL NNL PVI SN MTA AL DI CSA TD SNL TA EM PKL EA EGL ID KK SLGD KEK G KKA NN C KM DK NL SKL K SAR PIA PAPA PTPP QL IAI PTAA FT ST TTG TI PGL PSL TT TVV QA TP KSP PL KPI QPK PTI MG EPI TV NP ALV SL KDR KK KEK R KLKD KEG KET GG PKM DA KLG KLEE AK AA SK DL SG HFL KD HL GK SEGL AN GL SE SQ ESR MA SI KA EAD KVY TF TD NA PSP SIG SA SRM EC STLV NG QA PMA PLH VL TQ NGA E SAAA KT SSPA Y SDI SD AA DD GG SD SR SEG MR SKA SS PSD TF SN KDG VV KG HP STSA QP SQL KE SH SP YY HGY EPY YSP SY MH PG QV GA PAA GN GGST QG MKI KK ESEE DA EK KD KA EQL ESKK VD HT SAPL QPQ HQ SV IT QR HP AL AQ SLY YG QYA Y GLY MD QK SL MA T SPA YR QQ YEK YY ED Q RLA EQ KMA QSG RG DC ER KA ELPL KEL GK ED NKQ KNM PSA TI SK AP ST PE PN KN H SKL GP SV PN KTEE TG KSQ LL SSH QQQL QAD SF KA KQ MEN HQL IK EAV EM KSV MD SM KQ TG VD PT SR F KQD PE SR TW HH YV YQ PK YLD QQ KP EEL DR EKKL KED SPR KT PN KE SGV SSL PV SL TNI KEE PK EG KR PD SQ SV EEN KL KND DR KT PV NW KD SR GT RV AV SS PM SQ HQ SY IQ YL HA Y PY PQM YD PSH PA YR AV SPVL MH SY PGA YL SPG FH YPV YG KM SGR EEA EKV NT SP SI NTK TA SEA KAL DLL QH HA NQ YR SK SPAV SLL LLVV KR PCL VG EG RQ ET EQ S"
"Q9Z2H5-2","MTT ETG PD SEV KK AQ EE TP QQ PEAA AAV TT PV T PAG HSH PET NSN EK HL TQQ D TR PA EQ SL DM DD KDY SEA DGL SER TT PSK AQ KSP Q KIA KK FK SA IC RV TLL DA SEY EC EVEK HG RG QVL FDL VC EHL NLL EK DY FGL TF C DAD SQ KN WL DP SK EI KK QIR SS PW NFA FTV KFY PPD PA QL TED I TR YYL CL QL RA DII TG RL PC SFV THA LLG SY AV QAEL GD YDA EE HV GN YV SELR FA PN QTR EL EER IM ELH KT YRG MT PG EA EI HFL EN AK KL SM YGV DLH HA KD SEG I DI ML GV CA NG LLI YRD RL RI NR FA W PK IL KI SY KR SN FYI KIR PG EY EQ F EST IG FKL PN HR SA KRL WKV CI EH HTF F RLV SP EPP PKG FLV MG SK FR YSG RT QA QTR QA SAL I DR PA PF FER SSSK RY TM SRSL DGA EF SR PASV SEN HD AG PEG D KR ED DA ESGG RR SEA EEG EV RT PT KI KEL KFL D KP EDV LL KH QA SI NEL KR TL KE PN SKL I HR DR DW DRER RL PSS PA SPSP KG TP EKA SER A GLR EG SEE KV K PPR PRA PE SD MGD ED QD Q ERD AV FL KD NHL AI ER KC SSI TV SST SSL EAEV DF TV IG DY HGG AF ED FSR SL PEL DR DK SD SET EGL V FA QDL KG PSS QED ESG GL ED SPD RG AC ST PEM PQ F ESV KA ET MTV SSLA IR KKI EP EA ML Q SRV SAA D ST QVD GG TP MV KD FM TT PP CI TT ETI ST TM EN SL KSG KG AAA MI PG PQ TV AT EIR SL SPI IG KD VL TST YGA TA ETL STST TT HV TK TV KGG F SET RI EKR III TGD ED VD QD QAL ALA IK EA KL QH PD MLV TK AVV YR ET DP SPEE RD KK PQ E S"
"Q9DCX1","MAA SG EE DM SEL SPAA AP NL DW YEK PEE TH AP EV DL ETV I PP AQ EP SN PA EPF CPR DLV PV VF PG PV SQ EDC CQ FTC ELL KH ILY QR HQL PL PY EQL KH FYR KV PQA ED TAR KKA WL AT EAR NR KC QQ ALA EL ESVL SHL RD F FAR TLV PQ VL ILL GG NAL SP KE FY ELDL SRL AP FG VD QGL NT AA CLR RLF RAI FL AD PF SEL QT PPL MG TIV MV QG HRD CG ED WFQ PKL NY RV P SRG HKL TVTL SC GR PSV PA MA SED YI WF QA PVTL KG FH E"
"Q05512","MSS AR TPL PTL NER DT EQ P TLG HLD SK PSS KSN ML RG RN SA TSA D EQ PH IG NYR LL KT IG KG NFA KV KLAR HIL TG KEV AV KI ID KT QL NSS SLQ KL FR EVR IM KVL NH PN IV KLF EVI ETEK TLYL VM EYA SGG EV FD YL VA HGR MK EKEA RA KFR QIV SAV QY C HQ KF IV HRDL KA EN LLL DA DM NI KI AD FG FSN EF TFG N KLD TF CG SP PY AA PEL FQG KKI DG PEV DV WSL GV ILY TLV SGSL PF DG QNL KEL R ER VLRG KYR I PF YM ST DC EN LLKK FLIL NP SK RG TLEQ IM KDR WM NVG H EDD EL KP YV EPL PD YKD PRR TEL MV SMG Y TR EEI QD SLVG QR YN EV MA TY LLLG YK SSEL EGD TI TL KPR PSA DL TN SS APSP SH KV QR SV SA NP KQ RRSS DQ AV PAI PT SN SY SKK TQ SN NA EN KR PEE ETG R KA SSTA KV PA SPL PGL DR KK TT PA PST N SVL STST NR SR NSP LLD RA SLG QA SI QNG KD SL TM PG SRA STA SA SAAV SAAR PR QH QK SM SA SVH PN KA SGL PP TE SN CEV PR PSTA PQ RV PVA SPSA HNI SSSS GA PDR TN FPR GV SSR ST FH AG QLR QV RD QQ NL PYG VT PASP SGH SQG RR GA SG SI FSK FT SK FV RR NL N EPE SKD RV ETLR PH VVG SGG TD KD KEE FR EA KPR SLR FT WSM KT TSS M EPN EM MR EI RK VLDA NSC Q SEL HER YM LL CV HG TPG HEN FV QW EM EV CKL PRL SL NG VR F KRI SGT SMA FK NIA SK IA NEL KL"
"O88942-3","MK AA EE EH Y SYV SPSV TSTL PL PTA H SAL PAA CH DL QT ST PGI SA VP SA NH PP SY GG AV DSG PSG YFL SSG NTR PNG AP TL ESP RI EI T SYL GLH HG SGQ FF HDV EV ED VL PSC KR SP STA TL HL PSL EA YR DP SCL SPA SSL SSR SC N SEA SSY ESN YSY PYA SP QT SP WQ SP CV SP KT TD PEE GF PR SLGA CH LLG SP RH SPST SP RA SI TEE SWL GA RGSR PTSP CN KR KY SL NGR QP SC SP HH SP TPSP HG SP RV SV TED TWL GN TT QY T SSA IV AA IN AL TTD STL DLG DGV PI KSR KT AL EH AP SVAL KV E PAG EDL G TT PP TSD FPP EE YT FQ HLR KGA FC EQ YL SV PQA SY Q WA KP KSL SP TSY MSP SL PAL DW QL PSH SG PY EL RI EVQ PK SH HRA HY ET EG SRG AV KA SAGG HP IV QL HG YL EN EPL TL QL FIG TAD DR LLR PHA FY QV HRI TG KTV ST TSH EI IL SN TK VL EI PLL PEN NM RA II DC AG ILKL RN SDI ELR KG ET DI GR KN TRV RL VF RV HI PQ PNG R TLSL QVA SN PI EC SQR SA QEL PLV EKQ STD SY PVI GG KK MVL SG HN FL QD SK VI FV EK AP DGH HV WEM EA KT DR DLC KP NSL VV EI PP FR NQR IT SPA QV SF YV CNG KRKR SQY QR FT YL PA NG NSV FL TLSS ESEL R GG FY"
