"UniProtID","tokens"
"Q91VH2","MA TKA RVM YD FAA EPG NN EL TV TEG EII TV TN PNV GGG WL EG KN NKG EQ GLV PTD YV EIL PN DG KD PF SC GN SV AD QA FL DSL TAST AQ TN SSSA NSN NQV GGG ND PW TA WNA PK PGN WD SS DA WG SR TDG TSA QR N SSA NN WD TG FG HP QA YQG PA TG DDD EWD ED WDD PK SSSP YF KD SE PA EAGG IQ RG NSR AGA SSM KL PL NKF PG FA KPG MEQ YLL AK QLA KP KEK IAI IV GD YG PM WV YPT ST FD CVV AD PR KG SK MY GL KSY I EY QL TPT NT NR SV NHR Y KH FD WL YER LL VK FG SAI PI PSL PD KQV TG RF EE EFI KM RM ERL QA WM TRM CRH PVV SE SEV FQQ FLN FRD EK EW KTG KRKA EKD EL VG VM IF STM EP EA PDL DLI EI EQ KCD AVG KF TKA MD DGV KELL TV GQ EH WKR CTG PL PKE YQ KI GK ALQ SLAA VF SS SGY QG ET DL NDA IT EAG KT YEE IA SLVA EQ PKK DL HFL M EC NH EY KG FLG CF PDI IG AH KG AI EKV KE SD KL VA TSK IT PQD KQ TMV K RVG TM SY ALQA EM NH FH SNR IY DY N SVI RL YL EQ QV QFY ET IA EKL RQ ALSR FPV M"
"P47754","MA DLEE QL SDEE KV RI AA K FII HA PPG EF NEV FN DVR LLL NND N LLR EG AA HA FA QY NL DQ FT PV KI EGY ED QVL IT EHG DLG NG KFL DP KNR IC FK FD HL RK EA TD PR PY EAEN AI ESW RT SV ET ALRA YV KE HY PNG VC TV YG KKV DG QQ TI IA CI ESH QF QA KN FW NGR WR SE WKF TV TP ST TQV VG IL KI QV H YY EDG NV QLV SH KDI QD SLTV SN EV QTA KE FI KIV EAA EN EY Q TAI SEN Y QT MSD TT FK ALRR QL PV TR TKI DW NK IL SY KIG KE MQ NA"
"Q32NZ6-2","MQ SDD QVD EI II EV EN VP SGV QN HLV SS QI AL RK SSA NPA FC VLSS SAA D RV DC QI FN PG ND RRH NR LLR FSSL N ESI SQ IY HG SE CLV TD ESC TF H ETV QG QKL IA SLI PM TTR DRI KT IR NQ PR TM Q EKR EL RK IV DK EKN KQ SHG ILEA NC CA Q CLG SLSL TY RR TR NGL SELL NYI TL WQ KR F KVI GG KFG TSVL SY F SFLR WLL KF NI FSF VM NF SF III PQ FTV GA KN TLQ FT GL EF FTG AGY FGD TV MY YG FY TN ST IR HR M GGA SY NM QL AY IF TI GA CL VV C FF SLL F SMA KY FR NN FI NPH IY SRG IA KL IF CW DF TV TH EKAV KL KQ KNL ST EIR ENL SEL RQ EN YRL TF NQ QL TR FSA HV AA WLV ST GV TAA C CV AVY YLA EY NSE FL KT HR NPG AV LLL P FVV SCI NLAV PR FY SM F RLV ERY EI PR QEV YV LL VR NI FL KI SI VG ILC YY WL NIV ALSG EE CW ETL IG QDI YR LLL MD FV FSL AD SLLG EFL R RL IG M KF TSL SLQ EF DI AR NVL ELI YA QTL TWL GI FFC PLL PFI QM I TL FI MF YV KNV SLM MN FQ PP SKA WRA SQ MI TF FI FLL FF PSF TG VLC TL AI TI WRL KP SAD CG PFR GL PSF IQ SIY SW ID TL SRR PG YL WVV W IY QNL IG SVH FF FIL TLI VL II TYL YW QI T EGR KVM IR LLH EQ II NEG KD KM FLI EKL TKL QD MEK RV NP SAL DL ERR EV EPQ IPL HL EELG AA PDL RLRR SA QEE N PIA"
"Q91X86","M ETV V IVA IG VLA TI FLA SFA AL VVV CR QRY CR PR DLL QR YD SK PIV DL IG AM ET QSE P SEL ELD DV VI TN PHI EA ILEN ED WI EDA SGL M SH CIA IL KI CH TLT EKL VA MT MG SGA KM KT SASV SDI IV VA KRI SP RVD DV VK SM Y PPL D PK LLDA RT TA LLL SV SHL VLV TR NA CHL TG GL DW ID QSL SAA EE HL EVLR EA ALA SE PD KSL PN PEG FL QEQ SAI"
"Q3UTS8","MKR SGC WH QR MLL SLV LL TW THV TF SAL IR SH NF SR W PK PP C KM YY PID PD YEA NC PDV KA YV CA TN GL TY KN EC FF CI DR W EFG PH IQ FV KYG KC E"
"P49025","ML KF KYG VR NPP EA SA SE PIA SRA SRL NL FF QG K PPL MT QQ QM SAL SREG MLD AL FAL FEE CSQ PAL MKM KHV SS FV QKY SD TIA ELR EL QP SA RD F EVR SLVG CG HFA EV QV VR EKA TG DV YA MKI MKK KALL AQ EQV SF FEE ER NIL SRST SPW IP QLQ YA FQD KN NL YL VM EY QPG GD FL SLL NR YED QLD ESM IQ F YLA EL ILAV HSV HQ MG YV HRDI KPEN ILI DR TG EI KL VD FG SAA KM NSN KV DA KL PI GT PDY MA PEVL TV MN ED RRG TY GLD CD WW SVG VV AY EMV YG KT PF TEG TSA R TF NNI M NF QR FL KF PD DP KV SS ELLD LLQ SLL CV QKE RL KF EGL CC HPF FAR TD WN NI RN SPPP FV PTL KSD DD TSN FD EP EKN SWV SS SVC QL SPSG FSG EEL PFV GF SY SK ALG YL GR SE SVV SSLD SPA KV SS MEK KLL IK SKEL QD SQD KC H KM EQ EM TRL H RRV SEV EA VLSQ KEV EL KA SET QR SLL EQ DLA TY IT EC SSL KR SLEQ AR MEV SQ ED DK AL QLL H DIR EQ SR KLQ EI KEQ EY QA QV EEM RLM MN QLEE DLV SA RRR SDL Y ESEL R ESRL AA EEF KRKA NEC QH KL MKA KD QG KP EVG EY SKL EKI NA EQQL KI QEL QEKL EKAV KA ST EA TE LLQ NIR QA KER A EREL EKL HNR EDSS EGI KK KLV EAEE RR HSL EN KV KRL ETM ERR EN RL KD DI QTK SEQ I QQ MA DK IL ELEE KHR EA QV SA QHL EV HL KQ KEQ HY EE KI KVL D NQI KK DL AD KE SLEN MM QR HEE EA HEK GK IL SEQ KA MI NA MD SK IR SL EQR IV EL SEA NKL AA NSSL FT QR NM KA QEE MI SELR QQ KF YL ET QAG KL EAQ NR KLEE QL EKI SH QD HSD KSR LLEL ET RLR EV SL EH EE QKL EL KR QL TEL QL SLQ ER ESQL TAL QAA RAAL ESQL R QA KT ELEE TTA EAEE EI QAL TA HRD EI QR KFD AL RN SC TV IT DLEE QL NQL TED NA ELN NQ NF YL SK QLD EA SGA ND EIV QLR SEV D HL RR EI TER EM QL TSQ KQ TM EAL KT TC TML EE QVL DL EAL ND ELL EKER QW EA WR SVL GD EK SQ FEC RVR ELQR ML DT EKQ SRA RAD QR IT ESR QVV EL AV KEH KA EIL AL QQ AL KEQ KLKA ESL SD KL NDL EK KHA ML EM NAR SLQQ KL ET EREL KQR LLEE QA KLQQ QM DLQ KN H IF RL TQ GL QE ALD RA DLL KT ER SDL EY QL EN IQ VLY SH EKV KM EG TI SQ QT KL ID FL QA KM DQ PA KK KKV PL QY NEL KLAL EKEK AR CA ELEE ALQ KT RI ELR SAR EEAA HR KA TD HPH PST PA TAR QQ IA MSA IVR SP EH QP SAM SLLA PPSS RR KE SS TPEE FSR RL KER M HH NI PHR FNV GL NM RA TKC AV CLD TVH FGR QA SK CL EC QV MC HP KC ST CL PA TC GLPA EYA TH FT EAF CRD KM NSP GLQ SK EPG SSL HL EG WM KV PR NN KRG QQG WDR KYI VLEG SK VL IY DN EAR EAG QR PV EE FEL CL PDG DV SI HG AVGA SEL AN TA KA DV PY IL KM ESH PH TT CW PGR TL YLL AP SF PD KQR WV TAL ESV VA GGRV SR EKA EA DA KLLG NSLL KL EG DD RL DM NC TL PF SD QV VLVG TEE GLY ALN VL KN SL THI PG IG AV FQ IY II KDL EKLL MI AG EER AL CLV DV KKV KQ SLAQ SHL PA QP DV SP NI F EAV KG CHL F AAG KI EN SLC IC AA MP SK VV IL RY ND NL SK YC IR KEI ET SE PC SC IH FTN Y SIL IG TN KFY EI DM KQY TLD EFL D KN DH SL AP AV FA SSSN SF PV SIV QA N SAG QR EE YLL C FH E FGV FVD SYG RRSR TD DL KW SRL PLA FA YR EP YL FV TH FN SL EVI EI QAR SSLG SPA RA YL EI PN PR YLG PA ISS GAI YLA SSY QD KL RV IC CKG NLV KE SG TEQ HRV PST SRSS PN KRG PP TY N EHI TK RVA SS PAPP EG PSH PR EP ST PHR YR DR EG RT ELRR DK SPGR PL EREK SPGR ML ST RRER SPG RL FED SSRG RL PAG AV RT PLSQ VN KVW DQ SSV"
"Q8CI51","MSN YSV SLVG PA PWG F RLQ GG KD FN MPL TI SSL KD GG KA SQA HVR IG DV VL SI DGI SAQG MT HL EA QN KI KA CTG SL NM TLQ RA SAA AK SE PVSV QKG EP KEV VK PV PI TSP AV SK VT ST TN MA YN KA PR PFG SVSS PKV TSI PSP SSA FT PA HAA TSS HA SP TPV AAAT PLHL SA SGL HV SA NL SA DQ CSS PP NTG KP AV NV PR QP TV TSV CSE SA QEL A EGQ RRG SQG DI KQQ NG PPR KH IV ER NT EFY HI PT H SDA SKK RLI ED TED WR PR TG TT QSR SFR ILA QI TG TE HL TE SEN D NT KK AN ST QEP SQ QPA SSGA SPL SA SEG PE SPG SS RP SVA GLR SAAA FK PVG STSV KSP SW QR PN QAA PST GRI SN NAR SSG TGA SVG PP QP SD QD TL VQ RA EHI PAG KR TPM CA HC N QVI RG P FLV AL GK SW HP EE FN CA HC KN TMA YIG FV EE KG AL YC EL CY EK FFA PE CG RC QR K ILG EV IN AL KQ TW HV SC FV CVA CG KPI RN NV FHL EDG EPY C ETD YY AL FG TI CRG C EF PI EA GD MFL EALG YT W HD TC FV CSV CC ESL EG QTF F SKK DK PL CKK HA HSV NF"
"Q9ES83","MN ST ESI PL AQ STV AG FT SEL ESL TPV PSN ET TC EN WR EI HHL VF HVA NV CF AVG LLI PT TL HLH MI LLRV ML SLG C TLY VV WA TL YR CAL DV MI WN SV FLG IN IL HL SY LLY KKR PV KI EKEL GGV YH RLF EPL RV PP DL FR RL TG QFC MIQ TL KRG QV YA TED KT SV DD RL SILL KG RM KV SY RGH FLH NI YP CA FID SP EFR ST QM HKG EK FQV T IVA DD NCR FL CW SR ERL TY FL ESE PFL YEI FR YL IG KDI TN KL YSL ND PTL ND KK VK KL EPQ M SLC TQI SML EM RN SI TSS SDG ED GL HH FL RG SSSTA SL PM SS PQQ RA SA KM KPI EE GV EDDD EV FV SPD ALKV HQL P"
"Q8CFE4","M E SML NKL KST VT KV TA DV T SAV MG NPV TR EF DV GR HIA SG GN GLA WKI FNG TKK ST KQ EV AV FV FD KKL ID KY QKF EK DQ II DSL KRG VQ QL TRL RH PR LLTV QH PLEE SRD CLA FC TE PV FA SLA NVL GN W ENL PSS I SP DI KDY KLY DV ET KYG LLQV SEGL SFL HSS VK MV HG NV TP ENV IL NK SGA WKI MG FD FCV SSSN P SEQ EP KF PC KE WDP NL PSL CL PN PE YLA PE YIL SV SC ETA SD MY SLG AV MY AV FN QGR PI FEV NKQ DI YK SF SR QLD QL SRLG SSSL TSI PEE VR EHV KLLL NV TP TVR PD AD QM TKI PF FD DVG AV TL QY FD TL F QRD NL QK SQ FF KGL PK VL PKL PK RV IV QR IL PCL TSE FV NPD MV PF VL PNV LL IA EEC TKEE YI KL IL PEL G PV FK QQ EPI QI LLI FLQ KMD LLL TKT PPD EI KN SVL PMV YR ALEA PSI QIQ EL CL NII PT FA NL ID YP SM KN ALI PRI KNA CL QT SSL AV RV N SLV CL GK IL EYL DK WF VL DD IL PFL QQ IP SK EPA VL MG ILG IY KC TF TH KKL G IT KEQL AG KVL PHL IPL SI EN NL NL NQ FSS FI AVI KE ML SRL ESE HR TKL EQL HV MQ EQQR SL DIG NQ MST SEE TKV AH SG SQ QID KV FN NI GA DLL SG SE SEN R EDG MQG KQ KRG SL TLEE KQ KL AK EQ EQ AQ KL KSQ QPL KP QV HT PIA PI KQ TKDL TD TLM ENM SSL TSL SVST PKI SASS TF TPV PST GLG MM FST PID NT KR NL TN GL NA NMG FQ TSG FSM PV NPN QN FF SGTG T AGV TT MSL GA PP TM SN F SPL TI PPA SV KQ P QQR PT DM SAL NNL FG PQ KP KV SM NQL SQ QKP NQ WL NQ FA PP QG SPV MG SAA MG TQG NV MG QAA FG MQG NPF FN PQ NFA QPP PT TM TSS SSA SN DL KDL FG"
"Q91W39","MN TA PSR PSP TRR D PY SF GD SR DT RR DR SPI RG SP RR EPR DGR NGR DA RD SR DI RD PR DL RD RRD SR DI RD HRD SR SVR EAR DL RD FRD FR DL RD SRD FRD HRD PV YDR YR DI RD SRD PLY RR EG SYDR YL RV DD YC RR KDD SY FDR YRD SF DG RG PPG PE SQ SRA KERL KR EE RRR EEL YRR YF EEIQ RR FDA ER PV DC SV IV VN KQ TKD YA ESV GR KVR DLG MVV DLI FL NT EV SLSQ AL EDV SR GGSP FA IV IT QQH QI HR SC TV NI MFG TPQ EHR NM PQA DAM VLV AR NY ERY KND CR EKER EE IA RQ AA KMA NDA ILQ ER DR GG PEE GGR GGH PPA IQ SL IN LL AD NR YL TAEE TD KI IN YLR ER KER LLR SS AD SLPG PI SR Q PLG AASG SSL KSQ PSS QPL QSG QVL PSA TPT PAA PP TSQ QEL QA KIL SL FN SG AVAA NSS SASP SVA TG SSQ NQ NF STAA NSQ PQQ RP QASG NQ PP NIV GQ AG SA RN MG PRPG AP SQGL FG QP SS RLA PAST MA SQR PV SSTG IN FD NP SV QK ALD TL IQ SG PAL SHLV SQ TAA QV GR PQA PMG SY QR HY"
"Q6Y4S4","MI SMA SW QLL LLL CV AT YG EPL A KVA PL VK PG STG QQ SG PQ ELV NA WEK ESR YA ESK PGSA GL RARR SS PC PPV EG PA GR QR PL CA SR SRL I PAPR GA VLV QR EK DL ST YN WN SF GLR YG RR Q AAR AARG"
"Q9Z1J3","MVG SVAG NM LLR AA W RRA SLAA TSL ALGR SSV PTR GL RLRV VD HG PH SP VH SEA EA VLR PL YM DV QA TT PLD PR VLDA ML P YLV NY YG NPH SR THA YG W ESE AA MER AR QQ VA SL IG AD PR EII FT SGA TE SN NI AI KGV AR FYR SRKK HLV TT QT EH KC VLD SCR SLEA EG FRV TYL PV QK SG II DL KEL EAA IQ PD T SLV SV MTV NN EI GV KQ PIA EIG QI C SSR KVY FH TD AAQ AVG KI PL DV ND MKI DLM SI SG HKL YG PKG VGA IYI RRR PRV RV EAL QSG GG Q ERG MR SG TV PT PL VV GLG AAC ELA QQ EM EY DH KRI SKLA ERL VQ NI MK NL PDV VM NG DP KQ HY PG CI NL SFA YV EG ESLL MAL KDV AL SSG SA CT SASL EP SY VL RA IG TD EDL AH SS IR FG IG RF TT EEEV DY TA EKC IH HV K RLR EM SPL W EMV QDG I DL KSI KW TQ H"
"Q9DAR7","MAD TA PQL KRKR EQ EA EEA ET PST EE K EAG VG NG TSA PV RL PF SGF RV QK VLR ESA RD KII FL HG KV NED SG DT HG ED AVV ILEK TP FQV EHV AQ LLTG SPEL KL QF SN DI YST YNL F PPR HL SDI KT TV VY PA TEK HL QKY MR QDL RL IR ETG DD YR TI TL PYL ESQ SLSI Q WV YN ILD KKA EA DR IV FEN PD PSD GF VL IP DL KW NQQ QLD DL YL IA IC H RRG IR SLR DL TPE HL PLL RN ILR EG QEA IL KRY QV TGD RLRV YL HYL PSY YHL HV HFT AL GF EAPG SGV ER AH LLA QVI ENL EC DP KH Y QQR TL TF ALR TD DP LLQ LLQ KA QQ ER N"
"Q6PFD6","MV MAV ED SVV RV VV RVR PP TP KEL ESQ RR PVI QV VD ER MLV FD PEE CD GG FP GL KW SG SH NG PKK KG KDL TFV FD RV FG EMA TQ EDV FQ HTT HN ILD SFL QG Y NC SV FA YGA TGAG KT HT ML GR EG EPG IM YL TT MEL YR RLEA RQ EE KQ F EVL I SYL EV YN EQ IH DLL EP KG PL TIR ED PD KG VV VP GLSF HQ PASA EQLL EML TRG NC SR TQ HPT DA NA TSS R SH AI FQI FV KQQ D RV PGL TQ AL RVA KM SLI DLAG SER A SS THA KG ERLR EGA NI NR SLL AL IN VLN ALA DA KG RK SH VP YRD SKL TR LLKD SI GG NCR TV MI AAI SP SSL TY ED TY NTL KY AD RA KEI RL TL KSN VI SVD HHI SQ YA TI CQ QL QA EVA FLR EKL QM YEA GA QAL QQ QC SP QPP TL SI PQ SLSS SSL QPG PSS QSS TL EC HA KN ETL QEE SLG SDA QGQ EIV EE SA SEQ EQ C PQD KQ CPT QK PE PNL PG SPSP SV QA KPG TG QH SPQ KQ DA DH SK QL ALQ VL RLA QR QY SLL QAA NLL TPD MI SEF ETL QQL VLEE SV DH RA ESP R SP ALA RGD PL AQ ALC SESK SSG Y CG PV TR TMA KQL NGL TH TLGA PLA PD CT SD KT FQ KPT KEK KRKL TPEE PG SLPA PNL EM KR QR Q SFL PCL RRG SL PKA QPC SE PR TP KR ERA SS PSP SSRV CPA TV IK SRV PL GP SAL QN CST PL AL PTR DL NTT FNV SEE SPSK PSF QE FV DW EKV SPEL NST D QP FL PSA PV FI FT KGR KP SL PAV TA SKK RR TMR PSV SRGR SC IA RL HSS TLKK PNR PF TV PE PPL SPH CL DD QR TP KGL TGV TE SY"
"Q8VI64","MYL RR AV SK TLAL P RRA PPG PA PLG KDA SLRR M SSR KF PG TSG SNM IY YL VV GV TV SAGG YY TY KAL TSK QV RR TE HVA EP KEQ TKA ELQ PLPG EKEE HVA EAEQ VC SEPG DT AV TEA ESV DA EEV PE AAV VL PEE SQA SA PSEV PA EAA VV EA SLSS SE PEL KI TEA SLV ET TE SV PE ST QEV ESAA PD QD DV CN EG AD TSQ EG AD TSQ EG AD TSQ EG AD TT KEE AD NSK EAEG TT TED PR SI SEE SA ELEE SP PLG SE PP AQ PE SQEE ET QV TEE TASP QG"
"Q9WV85","MI CL VLTI FA NL FP SA YSG VN ER TFL AV KP DGV QRRL VG EIV RR FER KG F KLV AL KLV QA SEE LLR EH YV ELR EK PFY SRLV KY M SSG PV VA MV WQ GL DVV HA SR AL IGA TD PG DA MPG TI RGD FC MEV GK NVI HG SD SV ESA HR EI ALW FR EA ELL CW ED SAG H WL Y E"
"Q06831","MV QQ TN NA EN TEA LLAG ESS D SGA GL ELG IA SSPT PG STA STGG KA DD PSW CKT PSG HI KR PM NA FMV W SQI ERR KI MEQ SP DM HNA EI SK RLG KR WK LLKD SD KI PFI QEA ERL RL KH MA DY PD YK YR PR KK VK SGN AGAG SAA TA KPG EK GD KV AG SSG HAG SS HA GGGA GGSS KPA PKK SC GP KV AG SS VG KP HA KLV PAGG SK AAA SF SP EQ AALL PLG EPT AVY KVR TP SAA TPAA SSSP SSAL AT PA KH PAD KK VK RV YL FG SLGA SASP VG GLGA SA DP SD PL GLY ED GGPG CSP DGR SL SGR SSAA SS PAA SRSP AD HRG YA SLR AASP AP SS AP SHA SSSL SSSS SS SSG SSSS DD EF ED DLL DL NP SS NF ESM SLG SF SSSS ALDR DLD FN F EPG SG SH FEF PD YC TP EV SE MI SGD WL ESS I SNL VF TY"
"Q91WP0","MR LLI FLG LLW SLVA TLLG SK W PEPV FG RLV SPG FP EK YAD HQ DR SW TL TA PPG YRL RL YF TH FDL EL SY RC EYD FV KL SSG TK VLA TL CG QE ST DT EQA PG ND TFY SLG PSL KV TF HSD YSN EK PF TG FEA FY AA ED VD EC RV SLGD SV PCD HY C HN YL GG YY C SCR AG YVL H QN KH TC SAL CSG QV F TGR SG YL SS PEY PQ PY PKL SSC TY SI RL ED GF SV ILD FV ESF DV ET HP EA QC PY DSL KI QTD KG EHG PFCG KTL PP RI ETD SH KV TI TFA TD ESG NH TG W KIH YT ST AR PC PD PTA PP NG SI SPV QA IY VL KD RF SV FC KTG F ELL QG SVPL KSF TAV C QK DG SW DR PM PE CSI ID CG PPD DL PNG HV DYI TG PEV TT YK AV IQ YSC EE TFY TM SS NG KYV CEA DG F WT SS KG EKL PP VC EPV CGL ST HTI GGR IVGG QPA KPG D FP WQV LLL GQ TT AAAG AL IH DN WVL TAA H AVY EK RM AA SSL NIR MG IL KRL SPH YT QA W PEE I FI HEG YT HG AG FD NDI ALI KL KN KV TI NG SI MPV CL PR KE AASL MR TD FTG TV AG WGL TQ KG LLAR NLM FV DI PI AD HQ KC TAV Y EKL Y PGV RV SA NML CA GL ET GG KD SC RGD SGG ALV FL DN ET QR WFV GG IV SWG SI NCG AA DQ YGV YT KV IN Y IP WI EN II SN F"
"Q6P069","MA YPG H PGA GGG YY PGG Y GGA PGG PA FPG Q TQD PL YG YF AAV AG QDG QI DA DEL QR CL TQ SG IA GGY KP FNL ET CRL MV SML DR DM SG TMG FN EF KEL WA VL NG WR QH FI SFD SDR SG TVD PQ EL QK AL TT MG FRL SPQ TV N SVA KR YST SG KI TF DD YIA C CV KLR AL TD SF RR RD SG QQG VV NF SY DD FI QCV MTV"
"Q9D415-5","MK GL SGSR SHH HGI TC EAA CD SLSH HSD H KP YLL SP VD HH PA DH PY YT QR NSF QA ECV G PF SD PLA SS TF PRR H YT SQ QEL KD ESAL V PR TL AT KA NRL PT NLL DQ FER QLPL SR DG YH TL QY KR TAV EHR SDSP GR IR HL VH SV QKL FT KSH SLEG P SKG SV NGG KA SPD ESQ TLR YG KR SKSK ERR SESK AR SNA SNA SP TSP SW WSS DD NL DG DM CL YH TP SGV MT MG RC PDR SASQ YF MEA YN TI SEQ AV KA SR SN NDI KC ST CA NL PVTL DA PLL KK SA WSS TLTV SRAR EV YQ KA SV NMD QA MV K SEA CQQ ER SC QYL QV PQD EW SG YT PRG KDD EI PC RR MR SG SYI KA MGD ED SGD SD TSP KPSP KV AA RR ESYL KA TQ PSL TEL TTL KISN EH SP KLQ IR SH SYL R AV SEV SI NR SLD SLD PAG LL TSP KFR SRN ESY MRA M STI SQV SEM EV NG QF ESV C ESV F SEL ESQ AV EAL DLPL PGC FR MR SH SYV RAI EKG CSQ DD ECV SLR SSSP PR TT TTV R TI QSS TG E"
"P99029-2","MA PI KVG DA IP SV EV FEG EPG KKV NLA EL FKG KKG VL FGV PGA FT PG CSK THL PG FV EQAG AL KA KGA QV VA CL SV NDV FVI EE WG RA HQA EG KVR LL AD P TGA FG KA TD LLL DD SLV SL FG NR RL KR F SMV ID NG IV KAL NV EP DG TGL TC SLA PN IL SQL"
"Q8BPM0-3","MA PR KR GG RGI SF IF CC FR NND HP EI TY RLR ND SN FAL QT M EP AL PM PPV EEL DV MF SEL VD ELDL TD KHR EA MF ALPA EK KW QI YC SKK KD QEE NKG AT SW PE FY ID QL NSM AA RK SLL ALEK EEEE ER SK TI ESL KT AL RT KP MR FV TR FI DLD GL SC ILN FL KT MD YET SESR IH TSL IG C IK ALM NN SQG RA HVL AH SE SI NV IA QSL ST ENI KT KVA VL EIL G AV CLV PGG HKK VLQA ML H YQ KYA SER TR FQ TL IN DL DK ST GR YRD EV SL KTA IM SFI NA VL SQG AGV ESL DF RL HL RY EFL MLG IQ PV ID KLR EH EN STL DR HLD FF EML RN EDEL EFA KR FEL VH ID TK SA TQ MF EL TRR RL TH SEA Y PH FM SIL HH CL QM PY KR SGN TV QY WLLL DR II QQ IV IQ ND KG QD PD STPL EN FNI KNV VR ML VN EN EV KQ WK EQA EK MR KE HN ELQQ KLEK KER EC DA KT QEK EEM MQ TLN KM KEKL EK ET TEH KQV KQQ VA DL TA QL HEL NRR AVC AAV PG GP SPGA PGG PF PSS GLG SLL PPPPPP LL SGG AL PPPP PPL PPGG PPPP PG PPPL GG VLPP PGA PV SLTL KK KNI PQ PT NAL KSF NW SKL PEN KL DGTV WT EI DD TKV FK ILDL EDL ER TF SAY QR QQV TT"
"Q69ZN6-2","MG STSA SWA SL SPSS RL SS SERL CL PM PI DVV YT WV NG TDL ELL KEL QQ VR EH MEE EQ RA MR ETLG KN TT EPT KK SEK QL EC LL TH CI KV PML VLD PPL PA NC TL KDL PTL YP SF HAA SD MF NVA KP KN PST NV SVVV FD TT KDV ED AH AG PF KGG SK QMV WRA YL TT DK EA PGL VL MQ GLA FL SGF PP TF KET SQL KT KL PEKL SS KI KLL RLY SEA SVA LLKL NN PKG FQ ELN KQ TKK NM TI DG KEL TI SPA YLL WDL SAI SQ SK QD EDV SASR FED N EEL RY SLR SI ER HA PW VR NI FIV TNG QI P SWL NL DN PR VT IV TH QDI FQ NL SHL PT FSS PAI ESH I HRI EGL SQ KFI YL ND DVM FG KDV W PDD FY SH SK GQ KV YL TW PV PN CA EG CPG SW IK DGY CD KAC NN SA CD WD GG DC SG NT AG NR FVA GGGG TG NIG AG QH W QF GGG IN TI SY CN QG CA N SWL AD KF CD QA CN VL SCG FD AGD CG QD H FH ELY KV TLL PN QTH YVV PKG EYL SY F SFA NIA RR GV EG TY SD NPI IR HA SIA NK W KTI HL IM HSG MNA TT IY FNL TLQ NA ND EEF KI QI AV EVD TR EA PKL NST TQ KAY ESLV SP VT PL PQA DV PF EDV PK EKR FP KI RRH DV NA TGR FQ EEV KI PRV NI SLL PK EA QV RL SNL DL QL ERG DI TLKG YNL SK SA LLR SFL GN SL DT KI KP QAR TD ET KGNL EV PQ EN PSH RR PHG FAG EHR SER WTA PA ETV TV KG RD H ALN PP PVL ET NA RL AQ PTL GV TV SK ENL SPL IV PP ESHL PK EE ESD RA EG NAV PV KEL V PGR RLQQ NY PG FL PW EK KKY FQD LLD EE ESL KT QLA YF TD SKH TGR QL KD TFA D SLR YV NK ILN SK FG FT SR KV PA HM PH MI DR IV MQ EL QDM FP EE FD KT SF HKV RH SED MQ FA FSY FY YL MSA VQ PL NI SQV FH EVD TD QSG VL SDR EIR TLA TR IH DLPL SLQ DL TGL EH ML IN CSK ML PA NI TQL NNI PP TQ EAY YD PNL PPV TK SLV TN CK PV TD KI HKA YKD KN KYR FEI MG EEEI AF KM IR TNV SH VVG QLD DIR KN PR KFV CL ND NI DH NH KD AR TV KA VL RD FY ESM FPI PSQ FEL PR EYR NR FL HM HEL QE WRA YRD KL KF W TH C VLA TL II FTI FSF FA EQ II ALKR KI FP RRR IH KEA SP DRI RV"
"P01669","DI VL TQ SPA SLAV SLG QRA TI SCKA SQ SV DY DGD SY MN WY QQ KPG QPP KVL IF AA SNL ESG IPA RF SGSG SG TD FTL NI HPV EEED AA TY YC QQ SN ED PW TFG SG TKL EI K"
"O35181","M SEG AAGA SP PGAA SAA AA SAEE GT AAAA AAAAA GGG PD GGG EG AA EPP R EL RC SD CIV WNR QQ TWL CVV PL FIG FI GLGL SL MLL KW IV VG SV KE YV PT DL VD SKG MG QD PF FL SK PSS FP KA MET TTTT TST T SPA TP SAGG AA SSR TP NRI ST RL TT IT RA PT RF PG HRV PI RA SPR ST TAR NT AAPP TVL ST TA PF FSS ST PGSR PP MPG AP ST QA MP SW PTAA YA TSS YL HD ST PSW TLSP FQD AAAA SSSS PSS TSS TTTT PET STSP KF HTT TY ST ER SE HF KP CR DK DL AY CL NDG EC FVI ETL TG SH KH CR CK EGY QG VR CD QFL PKT D SIL SD PTD HL GI EF M ESED VY QR QVL SI SC II FG IV IVG M FC AA FY FK SKK QA KQ IQ EHL KE SQ NG KN YSL KA SS TK SESL MK SHV HL QN Y SKA DR HPV TAL EK IM ESS FSA PQ SF PEV TSP D RG SQ PI KH H SPG QR SG ML HR NTF RRA PP SPR SRL GG IVG PA YQ QLEE SRI PD QD TI PC QGI EVR KTI SHL PI QL W CV ER PLDL KYV SN GL RT QQ NA SI NM QL PSR ET NPY FN SLD QK DL VG YL SP RA NSV PI IP SM GLEE TC M QM PGI SD VK SI KW CKN SY SAD IV NA SM PV SD CLL EE QQ EV KI LL ETV QEQ IR IL TDA RR SED F ELA SM ET ED SA SEN TA FL PLSP TA K SER EA QF VL RN EI QRD SVL TK"
"P54726","MAV TI TL KTL QQQ TF KI RM EPD ETV KVL KEK I EAEK GR DA FPV AG QKL IY AG KIL SD DV PI KE YH ID EKN FV VV MV TKA KAG QGI PAPP EA SP TAV PE PST PF PP VLA SGM SH PPPT SR ED KSP SEE ST TT TSP ESI SGSV PSSG SSGR EED AA STLV TG SEY ET ML TEI M SMG Y ERER VVA ALRA SY NN PHR AV EY LL TGI PGSP EPE HG SV QE SQ AP EQ PA TE AAG EN PL EFL RD QPQ FQ NMR QVI QQ NPA LLPA LLQ QL GQ EN PQ LL QQI SR HQ EQ FI QML N E PPG ELA DI SDV EG EV GA IG EEA PQM NYI QV TPQ EK EAI ERL KAL GF PESL VI QA YFA C EKN ENL AA NF LLSQ NF DD E"
"Q8CFA7","M EQD NK EQ AM HQ PP MD NK MLV PV SNV PV SSG NSG FH Q PPA TQ YL PEM MR SY MA SA EEL RC NER EW ESQL IR SL PE HG VR CP SQLA PI PFQ NY CQR SIG RG SH VM PVG SSG TL GV TI SF SENL MP QG GL PSS RGV SV MA H SSA PAM PY PM PP TV PA TTG SL KHG I LLV PG MA SAG TH AVA PF MD QML HSI NPC NPE ML PA RF QQ LL PLD SQD SLV TE SN TQEE P FVR EPP TPA PEG A ESP STSR GA TRR Q SPV SR PYV C TY NSC GK SY TKR SHLV SH QR KH TGV KP FA CD WNG C TW KF FR SD ELGR HKR IH TR YR PH KCD EC DR EF MR SD HLR QH KR THL PK"
"P86044","MQ DD ESS QI FMG PEG D QL PLV EMG SC KP EA SD QW DC VLVA DL QTL KI QKH AQ K QLQ FL ENL E SNG FH FK ML KD QKK VF FGI RAD SDV ID KYR TLL M NP EDSG SRD EQ SF NIA TTR IR IV SF VV NN KL KPG D TF EDL VK DG VF ET MF LLH KG EQ NL KNI WAR WR NM F EPQ PID EIR EY FG EKV ALY FT WLG WY TY ML VP AAVV GL IV FL SG FAL FD SS QI SK EI CSA NDI FM CPL GD H SHR YL RL SEM CT FA KL THL FD NEG TVL FA IF MAL WA TV FL EI WKR KRA HEV QSW KLY EWD EEEE EM ALEL IN SP HY KLKD HRH SYL SSTI IL ILSL FM I CL MIG MA HVL VV YR VLAG ALF SSL VK QQV TT AVVV TG AVV HY II IV IM TKV NK YV AL KLC KF EE SG TF SEQ ER KF TV KF FIL QF FA HF SSL IY IA FIL GRI NG HPG KST RLA GLW KLEE CHL SGC MM DL FI QMA II MGL KQ TL SN CV EYL CP LLA H KW RLM WA SK HG HM SK DP EL KE WQR NY Y MN PI NTF SL FD EF MEM MIQ YG F TTI FV AA FPL AP LL ALF SNLV EI RL DA IK MV RLQR RLV PR KA KD IG TWL QVL ET IG VLAV IA NG MV IA FT SE FI PR VV Y KY HYG PCR TNR TF TDD CL TN YV NH SLSV FY TKH FND HSR MEG Q ENV TV CR YRD YR NEH DY NL SEQ FW FIL AI RL TFV IL FEH FAL CI KLI AA WFV PDV PQ KV KN EVL QEK YDR IR HR MR F SSR ST DV"
"Q91Z49-2","M NR FG TRL VGA TAT PPPP P KAR SN ENL D KI DM SLD DII KL NR KEG KK QN FP RL NR RLQQ SG TR QFR M RVR WG I QQ NSG FG KT SLSR RGR VLPG KRR P YGV IT GL AAR KA TG IR KGI SPM NR PPL SD KNI ERY FP ALKR KT SLLR QN EV QR K QVA VL KR PN QL NR KNG NKL SH QKD TR QA TFL FRR GL KV QT QL NT EQL ID DV VA KR TR QTQ KP RL TR TAV P SFL TKR EQ SDV KK VP KGV PL QF DI N SVG KQ TGM TLN ER FG IL KEQ RA NL TF SK GGSR FV TVG"
"Q9D5P4","ML PKD PPPA Q AVA LL TQ CMA NL GV SL TFL ED QT AGPG SS FSV CA DLD GL VC PAG TG SS KL EA K QQA AL SAL QY IQ KQL ER PEPL VT PR QP LL TSL SI ET IL TH EQ RC AAVV SAGL DRLL SESS PY QA CKG TV AAV IL ER EV QG SIG HSK ETY ELV ALG TG SS SC AG WL EF SGR RLH DC H GLV IA RRA LLR FF FR Q LLLV TQ GG PKG QER SVL TPQ PGPG PP FAL K PGV FL HL YV SN TP KG AAH DIY LLLA SED SVL HSP AF RLQA HV CG QL KPV SY VA PAL RD T HVG CL SASD KLAR WA ILGL GGG LLA HFL PPL YA TSL VL AD PC H DP STL NRV IH SR PRL D SVLG SCL PC PYV RT TL HL FAG PL VA PSD PG PST CH SLSL NW SLGD PDI EVV DVA TG RV KT DSS VG PP SRL CK AAFL SA FR QV AR ALEK PQ LL SLQ TY EAA KAV PYR EA RQ QL SLLL D QQ GLGA W PSK PL VG KFR H"
"Q3TUD9","M SSA Y SVR SF PV SI PAV IM ETD WT EP W LLG LLA FH LLC LLL TC FSS QRY KLQ IG HFL CLV VL VY SA EY IN EV AA VN WRL FSK Y QY FD SRG M FI SL VF SA PLL FNA ML IV IM WVR KTL TV MT DL KTL Q EER KE RRRR RK EE"
"Q99KW3-5","M SM EQ DT RALL PT QG TA WA TASA PVA RLQG PQG D SH QA CSQ EP HSP SSA EA PY CDL PR CPP AL QN PLR TT TCV GQ SV HSL GL GLG QE PQ RV WSP TT ALPA EG PAA AP KN RH QD SEG IP YL EGL AR SSC TDD ND NKD EDED PN SN TSS SQD SN TP H DT SNSS SVD WD TT ER PG VV PSR NRL TEM IP RR PQ EGL RAD SAR KA TR SPA RG DT AG QR KEN SGSG GQ SAG QH WA KLR SESG YF SLER QR SG QT QA SSG TPP SG PRG TT QA SSA QR DV FQ AAPA QEA PQ TSSL PR NT QR DT QR ST PR TSS PSR V SQ RD TPR VM ST QR KN TPL SSPL RA TPE TL KI SA PED GT HV TPSP CV QD SSL NR TSQ RD SSR TP CIQ W DN PRA SS PNR TT QR DN PR TP CT QR DN PRA SS PNR TT QR DN PR TP CT QR DN PRA SS PNR TT QR DN PR TP CA QR DN PR AASP NR ST QRD SPR TP CA QR DN PRA SS PNR TA QR DN PR TP CA QR DN PR TSC TSQ NT PR TP ST QAD KT TA SC SK W EHL R SA CT QR DN PR TF SQG CTQ KD NPG PPSP RR AT QG SN SR NP SP HR TN KD IP WA SF PLR PT QSD SP RT SS PSR TKQ NQV PWA SI SLR PT QG DK PQ TSA PT RL AH ND PP QQ YSP SLA TT SSSS HN PGH SSA SR TSS PLH AA PR GA PQ TSL ESS QPP CTV CIG HR DA PRA SSPP RY FQ YD PF PF FPD PR SS ESE SP HH EPP YM PP AVC IG HR DA PR AT SP PRH TQ FD PF PFL PD TSD AD N ESP QHD PP QF PPPV CIG YR DA PRA SSPP RQ FPE PSF FQ DL PRA ST ESL VP STD SM H EPP HI PTPV CIG HR DA PSF SS PPR QA PE PSL F FQD PPGT SM ESL AP SI DSL HG C PLL PP QV CIG HR DA PRA SSPP RH PP SD IG LL APSP PPG SSG SRG SA PPG ET RH NL EREE YT MLA DL PPPR RL AQ RG PE PQA QG SN EGR TR SPG RA EV ERL FG QE RR"
"Q91W53-2","MR P QQA PVSG KV FI QR DY SSG TR CQ FQ TKF PA EL EN RI DR QQ FEE TVR TLN NL YA EA EKL GG Q SYL EG CLA CL TAY TI FL CM ET HY EKV WL HL CSV KSL NT MK ED KSL HIN SSF KLEK PL YN SD FVI ALTV QST QK WVL SVC EI GQ HV QV CLG"
"Q8CIV2","M SEH AAA PGPG PN GGGG GGAA PV RG PR GP NL NPN PLI NV RD RL FH AL FF KM AV TY SRL F PPA FR RL FEF FV LL KAL FVL FVL AY IH IV FSR SP IN CL EHV R DR WPR EG VLRV EV RH NSS RA PV ILQ FC DG GLG GLEL EPG GL ELEE EEL TV EM FTN SSI KF EL DI EP KV FK PQ SG AD AL ND SQ DF PF PET PA KVW PQD EY IV EY SL EYG FL RL SQA TR QRL SI PV MVV TLD PT RD QC FG DR FSR LLLD EFL G YDD IL MSS VK GLA EN EEN KG FLR NVV SG EH YR FV SM WMA RT SYL AA FVI MV IF TLSV SM LLR Y SHH QI FV F IVD LLQ ML EM NMA IA FP AA PLL TV IL ALVG MEA IM SE FF ND TTTA FYI ILTV WL AD QY DA IC CH TN TSK RH WLR FF YL YH FA FYA YH YR FNG QY SSL AL VT SWL FI QH SM IY FF HH YEL PA ILQQ IR IQ EM LL QT PPLG PG TPT AL PD DL NN NSG SP AT PD PSP PL ALG PSS SPA PT GGA SGPG SLG AGA SVSG SDLG WVA ET AA II SDA SFL SGL SA SLL ERR PTA PST PD SSR PD PGV PL EDA PA PAG S"
