"UniProtID","tokens"
"A2ABV5","MA PV QLD NH QLI PPGG GGG SS GGGG SSSG SASA PA PPPP AAAV AAAAAAAA SPG YRL STL I EF LLH RAY SEL MVL TD LL PR K SDV ER KI EI VQ FA SR TR QL FVR LLAL VK WA ND AG KV EK CA MI SS FLD QQA IL FVD TAD RLA SL ARD ALV HA RL PSF AI PYA ID VL TTG SY PRL PTC IRD KII PPD PI TKI EK QA TL HQL NQ IL RH RLV TT DL PP QLA NL TVA NG RV KF RV EG EF EA TLTV MG DD PEV PWR LLKL EIL V ED KE TG DGR AL VH SM QID FI HQL VQ SRL FAD EK PL QDM YN CL HC FCL SLQL EVL HSQ TL ML IR ER WG DLV QV ER YH AG KSL SLSV WN QQ VLGR KTG TA SVH KV TI KID EN DV SKPL QI FHD PPL PA SD SKLV ER AM KID HL SI EKLL ID SV HA RA HQ RL QEL KA ILR SF NA N ESS SI ET AL PAL IV PIL EP CG NSE CL HI FV DL HSG MF QL ML Y GLD PA TLED MEK SLN DD MKR II PW IQ QL KF WLG QQ RC KQ SI KHL PTI TT ETL QLA NY STH PIG SLSK NKL FI KL TRL PQ YY IVV EML EV PN KPT QL SY NY YF MSV STA DR ED SPV MA LLL QQ FKD NI QDL M SY TK TG KQ TR TG TKH KL SDD PC PID SKK A KR SG EM CA FN KVL AH FV AM CD TN MP FV GL RL EL SNL EI PH QGV QV EG DG FN HA IR LL KI PP C KGI SEE TQ KAL DR SLL DC TF RLQG RN NR TW VA ELV FA NC PL NG TST R EQ GP SR HV YL TY ENLL SEPV GGR KVV EM FL ND WSS IA RLY EC VL EFA R SL PEI PA HL NI F SEV RV YN YR KL ILC YG TT KG SSI SI Q WN SI HQ KF HI ALG TVG PN SGC SN CH NT ILH QLQ EM FN KT PNV VQ LLQ VL FD TQA PL NA IN KL PTV PML GL TQR TN TA YQ CF SIL PQ SS THI RLA FR NM Y CI DIY CR SRG VVA IR DG AY SL FD N SKLV EG FY PA PGL KT FL NM FVD SN QDA RRR SV NED DN PP SPI GG DM MD SLI SQL QPP QQQ PF PKQ PG TSG AY PL TSP PT SY H STV NQ SP SM MH TQ SPG NL HAA SS PSG ALRA PSPA SFV PTPP PSS HGI SIG PGA SFA SP HG TL DP SS PY TMV SP SGR AG NW PGSP QV SG PSP AT RL PGM SPA NP SLH SP VP DV SH SPR AG TSS QT MPT NM PPPR KL PQR SW AA SI PT IL TH SAL NI LLL PSP TPGL VP GLAG SYL C SPL ER FLG SV IM RR HL QR II QQ ETL QL IN SN EPG V IM F KTD AL KC RV ALSP KT NQ TL QL KV TP EN AG Q WK PD EL QVL EK FF ET RV AG PP FKA NTL IA FT KLL GA PT HIL RD CV H IM KL EL FPD QA TQL KW NV QF CL TI PP SAPP IA PPG TP AV VL KSK ML FFL QL TQ KT SVPP QE PV SI IV PI IYD MA SG TT QQA DI PR QQ N SSV AA PM MV SN IL KR FA EM N PPR QG EC TI FAA VR DL MA NLTL PPGG RP"
"P56469","MM GGRG TGG KW PSA FG LLLL WGV AA SAL PL ESG PTG QD SV QEA T EGR SG LLT FLA W WH EWA SQA SSST PV GGG TPGL SK SQ ER PP PQQ PP HLD KK PC KN FF WKT FSS CK"
"Q80TQ2","MSS GLW SQ EK VT SP YW EE RI FY LLL QEC SV TD KQ TQ KLL KV PKG SIG QY IQ DR SVG HSR VP ST KGKK NQI GL KIL EQ PHA VL FVD EK DVV EI NEK FT ELLL AI TN CEE RL SL FR NRL RLSK GL QV DVG SPV KV QLR SG EE KF PG VV RF RG PLLA ER TVSG IF FGV ELL EEG RG QG FT DG VY QG KQL FQ CD ED CGV FV ALD KL ELI EDDD NGL ESD FAG PGD TM QV EPP PL EI N SRV SL KVG EST ESG TV IF CD VLPG KE SLG YFV GVD MD NPI GN WDG RF DGV QLC SFA SV EST ILL HIN DII PD SV TQ ERR PP KLA FM SRG VGD KG SSSH NKP KV TG ST SD PGSR NR SEL FY TL NG SSVD SQ QSK SK NP WY ID EVA ED PA KSL TEM SSD FG HSS PP PQPP SM NSL SS ENR FH SL PF SL TKM PN TNG SMA H SPL SLSV QSV MG EL NST PV QE SPPL PI SSG NA HGL EVG SLA EV KEN PP F YGV IR WIG QPP GLSD VLA GL ELED EC AG CT DG TF RG TR YF TC ALKK AL FV KL K SCR PD SR FA SLQ PV SN QI ER CN SL AF GG YL SEVV EE NT PP KM EK EGL EIM IG KK KGI QG HY NSC YLD STL FCL FA FSS ALD TV LLR PK EKN DI EY Y SET QELL RT EI VN PL RI YG YV CA TKI MKL RK IL EKV EAA SG FT SEE KD PEE FL NIL FHD ILRV EP LL KIR SA GQ KV QD CN FY QI FM EK NEK VGV PTI QQ LL EW SF IN SNL KFA EA P SCL II QM PR FG KD FKL FKK IF PSL EL NI TD LLED TPR Q CRI CG GL AM Y ECR EC YDD PDI SAG KI KQ FC KT CST QV HLH PR RL NH SY HPV SL PK DL PD WD WR HG CI PC QKM EL FA VL CI ET SH YVA FV KYG KDD SA WL FFD SMA DRD GG QNG FNI PQV TP CP EVG EYL KM SL EDL H SLD SR RI QG CA RR LLC DA YM CM YQ SP TM SL YK"
"P19973-2","MNG PA LLRR NA SKR GL EK LLRL TT Q WR EED EE EAAR EQR QR ERER QL QD QD KD K EDD GG HSL EQ PG QQ TL ISL KSS ELD EDEG FG DW SQ KPE PR QQ FWG NEG TA EG TEP SQ SER PEE KQ TEE SSH QA KV HL EE SNL SYR EPD PED AV GGSG EAEE HL IR H QVR TP SPL ALED TV ELSS PPL SPTT KLA DR TE SL NR SI KK SN SV KK SQ PTL PI ST ID ERL QQ YT QA TE SSGR TP KLSR QP SI EL PSM AVA ST KTL W ETG EV QSQ SASK TP SC QD IV AG DM SKK SLW EQ KGG SK ISS TI KST PSG KR YK FVA TG HG KY EK VLVD EG SA P"
"Q80WJ6-3","MVG EG PYL I SDLD RRG HRR SFA ER YD PSL KT MI PVR PRA RLA PN PV DD AG LL SFA TF SWL TPV MIR SY KH TL TVD TL PPL SP YD SS DI NA KR FQ IL WEE EI KRV GP EKA SLG RVV WKF QR TR VLM DV VA NIL CIV MA ALG PT VL IH QIL QH IT SI SSG HIG IGI CL CL ALF TT EF TK VL FW ALA WA IN YR TAI RL KV AL STL IF ENLL SF KTL THI SAG EVL NIL SSD SY SLF EAAL FC PLPA TI PIL MVV CAV YA FF ILG ST AL VGI SV YLI FI PI QM FMA KL NST FRR SAI SV TD KRV QT MN EFL TCI KLI KM YA WEE SF IN TIH DIR KR EK KLL EK AG YV Q SGN SAL AP IV ST IA IV ST FTC HI FL KRKL TA PV AF SV IA MF NV M KF SIA IL PF SV K AVA EA SV SLRR MKK IL IA KSP PSY I TQ PED PD TI LLLA NA TLTW EQ EI NR KSD PP KA QIQ KR HV FKK QR PEL Y SEQ SR SD QG VA SP EW QSG SP KSVL HNI SF VVR KG KVL GI CG NVG SG KSSL ISA LLG QM QLQ KG VV AV NG PLA YV SQ QA W IF HG NVR EN IL FG EKY NH QRY QH TV HV CGL QK DL NSL PYG DL TEI G ER GV NL SGG QR QR ISL AR AV YA NR QL YLL DD PL SAV DA HV GK HV FEE CI KK TLKG KTV VLV TH QLQ FL ESC D EV ILL EDG EIC EKG TH KEL MEE RGR YA KL IH NLR GL QF KD PEH IY NVA MV ETL KE SPA QRD EDA VLA SGD EKD EG KE PET EE FV DT NV EG TSG SQ NV KI WRR K S"
"Q9ES28-5","MN SA EQ TV TWL I TLG VL ESP KK TI SD PEV FL QA SL KDG V VL CR LLER LLPG TI EK VY PEPR N ESE CL SN IR EFL RA CGA SLRL ET FDA NDL YQG QN FN KVL SSLV TLN KV TA DI GLG SD SV CAR PSS HR IK SFD SLG SQ SSH SR TSK LLQ SQ YR SL DM TD NTN SQL VV RA KF NF QQ TN EDEL SF SKG DVI HV TRV EE GG WW EG TH NGR TG W FP SN YVR EI KP SEK PVSP KSG TL KSP PKG FD TTA IN KSY YNV VL QN IL ET EH EY SK ELQ SVL ST YLR PL QT SD KL SSA NT SYL MG NLEE ISS FQQ VL VQ SLEE C TK SP EA QQ RV GG CFL SLM PQ MR TLYL AY CA NH PSA V SVL TEH SE DLG EF MET KGA SSPG IL VL TT GL SK PF M RLD KY PTLL KEL ER HM ED YH PD RQ DI QK SM TA FK NL SAQ CQ EVR KR KEL ELQ IL TE PIR SW EGD DI K TLG SV TY M SQV TI QC AG SEE KN ERY LLL FPN LLL ML SASP RM SG FIY QG KL PT TGM TI TKL ED SEN HR NA FEI SG SMI ER ILV SC TSQ QDL H EWV EHL QKQ TKV TSV SN PTI KP HSV PSH TL PSH PL TPSS KH AD SK PV AL TPA YH TL PH PSH HG TP H TTI SWG PL EPP KT PKP WSL SCL R PA PPL RP SAAL CY KEDL SKSP KT MKK LL PKR KP ER KP SDEE FAV RK STA ALEE DA QIL KVI EA YC TSA KT RQ TL NST WQG TDL MH NH VLA DD DQ SSLD SLG RR SSL SRL EP SDL SED SE YD SI WTA H SYR MG SASR KSC C SYI SH QN"
"Q9CX34","M AAAA AG PA SSQ RL FQ SFSD ALI DG DP QA AL EEL TK ALEQ NPD DA Q YY CQ RA YC HI LLG KYR DG IA DV KK SL ELN PN NC TA LLR KG IC EY H EKD YA SAL ET FA EG QKL D STD TN FD TW I KR CQ EI QNG SE SEV SA SQR TQ SKI KY DW Y QT ESH V II TLM IK SVQ KN DV RV GF SER EL SALV KI PAG ED YSL KLR LLH PI IP EQ ST FK VLST KI EI KM KK PEA VR W EKL EG QGD EPT PKQ FTA DV KN MY PSS SHY TR N WD KL VG EI KEE EKN EKL EG DA ALN KL FQQ IY SDG SD EV KRA M NK SFM ESG GT VLST NW SDVG KR KV EI NPP DDM EW KQY"
"Q01705-2","MPR LL TP LL CL TLL PAL AAR GL RC SQ PSG TCL NGG RC EVA NG TEA CVC SGA FVG QR CQD SN PCL ST PC KN AG TC HVV DH GG TVD YA CSC PL GF SGPL CL TPL D NA CLA NP CR NGG TC DLL TL TEY KCR C PPG WSG KSC QQ AD PCA SN PCA NGG QCL PF ESS YI CR C PPG FHG PT CR QDV NEC SQ NP GL CR HGG TC HN EIG SYR CA CRA TH TG PH CEL PYV PC SPSP C QN GG TCR PTG D TT H ECA CL PG FAG QN CEE NV DD CPG NN CKN GGA CV DG VN TY NCR CPP EW TG QY CT ED VD EC QL MP NA C QN GG TC HN TH GG YN CV CV NG WTG EDC SEN I DD CA SAA CF QGA TC HD RVA SF YC EC P HGR TG LLC HL NDA CI SN PC NEG SN CD TN PV NG KA IC TC PSG YTG PA CSQ DVD EC ALGA NPC EH AG KCL N TLG SF EC QCL QG YTG PR CEI DV NEC I SN PC QN DA TCL DQ IG EFQ C IC M PGY EGV YC EI NTD ECA SS PCL HNG HC MD KI N EFQ CQ CP KG FNG HLC QY DVD ECA ST PC KNG AK CL DG PN TY TCV CT EGY TG TH CEV DID ECD PD PC HYG SC KDG VA TF TCL CQ PGY TG HH CET NI NEC HSQ PCR HGG TC QDR DN SYL CL CL KG TTG PN CEI NL DD CA SN PC DSG TCL D KI DGY ECA C EPG YTG SM CNV NID EC AG SPC HN GG TC ED GI AG FT CR CP EG YH D PT CL SEV NEC NSN PCI HGA CRD GL NGY KCD CA PG WSG TN CDI NN NEC ESN PCV NGG TC KD MT SG YV CT CR EG FSG PN C QT NI N ECA SN PCL NQG TC ID DV AGY KC NC PL PY TGA TC EV VL AP CA TSP CKN SG VC KE SED Y ESF SCV PC HN GG SC TDG IN TA FCD CL PGF QGA FC EE DI N ECA SN PC Q NGA NC TD CVD SY TC TC PV GF NG IH CEN NT PD C TE SSC FN GG TCV DG IN SF TCL C PPG FTG SY C QY DV NEC D SR PCL HGG TC QD SYG TY KC TC PQG YT GL NC QNL VR W CD SA PC KN GG RC WQ TN TQY HC ECR SG WTG VN CD VLSV SC EV AA QK RGI DV TLL CQ HG GL CVD EGD KH YC H CQ AGY TG SY CED EVD EC SP NPC Q NGA TC TD YL GG FSC KCV AGY HG SNC SEE IN ECL SQ PC QN GG TCI DL TN SY KC SC PR GT QGV HC EI NV DD CH PPL D PA SRSP KC FN NG TCV D QV GGY TC TC PPG FVG ER CEG DV N ECL SN PCD PRG TQ NCV QRV ND FH C ECR AG HTG RR C ESV I NG CRG KP CKN GG VC AVA SN TR CL NGG TCI SG PRSP TCL CLG SF TG PE CQ FPA SSP CVG SN PC YN QG TC EPT SEN PF YR CL CPA KF NG LL CH IL DY SF TGG AGR DI PP PQI EEA CEL PEC QVD AG NKV CNL QC NN HA CG WD GG DC SL NF ND PW KN CTQ SL QC W KY F SDG H CD SQ CN SAG CL FDG FD CQL TEG QC NPL YD QY CKD HF SDG H CD QG CN SA EC EWD GLD CA EHV PE RL AAG TL VLVV LL PPD QLR NN SFH FLR EL SH VL HT NV VF KR DA QG QQM IF PY YG HEE ELR KH PI KR STG EV DA DC MDV NV RG PDG FT PLM IA SC SGG GL ETG N SEE EE DA PAV ISD FIY QGA SLH NQ TDR TG ET ALHL AA RY SR SD AA KR LLEA SA DA NI QD NMG RT PLH AAV SA DA QGV FQ ILL RN RA TDL DA RM HDG TTPL ILAA RL AV EG ML EDL IN SHA DV N AVD DL GK SAL HW AAAV N NVD AAVV LL KNG AN KDM QN NK EE TPL FL AAR EG SY ETA KVLL DH FA NR DI TD H MD RL PR DI AQ ERM HH D IVR LLD EY NL VR SP QL HG TAL GG TP TLSP TL CSP NG YLG NL KSA TQG KK AR KP ST K GLA CG SKEA KDL KA RRKK SQ DG KG C LLD SS SML SP VD SL ESP HG YL SD VA SP PLL PSP FQQ SP SM PL SHL PGM PD THL GI SHL NV AA KPE MA ALA GG SRL AF E PPPP RL SHL PVA SSA STVL ST NG TG AM NF TV GA PASL NG QC EWL PRL QNG MV PSQ YN PLR PG VT PG TL ST QAA GL QH SM MG PLH SSL ST NTL SP II YQ GL PN T RLA TQ P HLV QT QQ VQ PQ NL QLQ PQ NL QPP SQ PHL SVSS AA NG HL GR SFL SG EP SQA DV QPL GP SSL PV HT IL PQ ESQ AL PT SL PSS MV PP MTT TQ FL TPP SQH SY SSSP VD NTP SH QLQV PE HP FL TPSP ESP DQ W SSSS PH SNI SD W SEG ISS PP TTM PSQ I TH IP EA FK"
"Q80W68","MTL ESP ST RLM TC QSS LL PEK PR FL SQ KM WA PHL VVA YLI FV TL ALAL PG TQ TR FSQ EPA DQ TVV AG QRA VL PCV LL NY SG IV Q WT KD GL ALG MG QGL KA WPR YRV VG SAD AG QY NL EI TDA ELSD DA SY EC QA TEA ALR SR RA KL TVL I PPEE TR ID GG PVI LLQ AG TP YNL TC RA FNA KP AA TI IW FR DG TQQ EGAV TST ELL KDG KR ET TI SQ LLI EPT DL DIG RV FT CR SM NEA IP NG KET SI EL DV HH PP TVTL SI EPQ TVL EG ERV IF TC QA TA NPE ILG YR WA KGG FLI ED AH ESR YET NV DY SF FT EPV SC EV YN KVG ST NV STLV NV HFA PR IV VY PK PT TT DIG SDV TL TCV WVG N PPL TLTW TKK D SN MVL SN SN QLLL KSV TQA D AG TY TC RA IV PR IG VA ER EV PL YV NG PP II SSEA VQ FAV RGD GG KV EC FIG ST PP PDR IA WA WK EN FL EVG TL ERY TV ER TN SGSG VL STL TI NNV M EAD FQ TH Y NC TA WN SFG PG TA II QL EER EVL PVG II AGA TIG AG IL VV F SFA AL VF FLY RRR KG SR KDV TLR KL DI KV ETV NR EPL TM H SDR EDD TA SI ST AT RV MKA IY SSF KD DV DL KQ DLR CD TID TR EEY EM KD PT NG YY NV RAH EDR PSS RA VL YA DY RA PG PT RF DGR PSS RL SH SSG YA QL NTY SRA PA SD YG TE PT PSG PSA PGG TD TT SQL SY ENY EK FN SH PF PG AAG Y PTY RLG YP QA PP SGL ER TP YEA YD PIG KYA TA TR FSY TSQ HSD YG QR FQQ RM QT HV"
"Q0VBL6-2","MAL GLQ RVR SN TEL RK EK SRD AAR SRR SQ ET EVL YQL AH TL PFA RGV SA HLD KA SI MRL TI SYL RM HRL CAA GG KRG RA TGR LL PEG PGG FR HG TH RRGR HGL PVG KC QQA PG PQ SVDL CSS SL IH NPT PG TN FSL EL IG HSI FD FIH PC DQ EEL QD AL TPR PNL SKK KL EA PT ER HF SLR MK STL TSR GR TL NL KAA TW KVL HC SG HM RA YK PP AQ TSP AG SPR SE PPL QCL VL IC EA IP QL PF H DGA TLGL PQ EK TPI STL FT PLW KALL CLV KR WPV QVL QG KG TE SSL PSW VL WAL NR KN CPG"
"A2AB59","MAA DV EG DVY VLV EH PF EY TG KDG RR IA IQ PN ER YR LLRR ST EH WW HV RR EPG GR PF YL PA Q YVR EL PAL GD PAPA PQ PSV PQQ RP AV PE PLA YD YR FV STPV GA DG SSA E PRG RA SSL CG PAR QR TGG QR N SLA PGG PA CL YV RP AA PVR PA Q SLD DL AR GG TA PPAG LLG SAG HF KA SSV AG SW VC PRPL AP SD SEN VY EA IP DL RC PP RA ESP KQV DD PP EPV YA NV ER QPR AT SPR SAAA PP RL SPV WET HTD TG TGR PY YY NPD TGV TT W ESP FET PEG TT SP AT SRA SVG SG ESL ET EWG QY WD EESR RV FF YN PL TG ETA WED ET EEL EE DH QEQL EM QP SL SPR SPG QQR PP TP ET DY PE LLA SY PEE DY SPVG SFSD PGPA SPL VA PPG WSC QI TPD KQ ML YTN QF TQ EQ WV RL ED QHG KPY FY NP EDSS VQ WEL PQV PI PAPR SV RK SS QD SD TPA QA SP PEE KI KTL DK AG VL HR TK TVD KG K RLR KK HW ST SW TVL EGG VL TF FKD SKT SAAG GLR QP SKL ST PE YTV EL KGA SL SW AP KD KSS KK NVL ELR SR DG SE YL IQ HD SEA II ST WH KA IA EGI SEL SA DLL QG EEG EP SS AD FG SS ERLG SWR EE DVR QN AA SPSL SPG GL ESDL SR VR HKL RK FL QRR PTL QSL RD KG YI KD QV FG C ALA QLC ERER SPV PR FV QQ CIR TV EAR GL DID GL YRI SG NLA TI QKL RY KV DH D ERL DLD DGR W EDV HVI TG ALKL FFR EL PEPL FPF SH FH QFI AAI KL QD PA QR SR CVR DL VR TLPA PN QD TLR LL IQ HLC RVI EHG EQ NR MTV Q NVA IV FG PT LLR PEM EEA SM PM TMV FQ N QVV EL IL HQ CA DI FPP H"
"Q9JKC8","M IH SLFL IN CSG DI FL EKH WK SVV SQ SV CD Y FF EA QEK AA DV ENV PP VI ST PH H YLI SI YRD KL FFV SV IQ TEV PPL FVI EFL HRV AD TFQ DY FG EC SE AAI KD NVV IVY ELL EE MLD NG F PLA TE SN IL KEL IK PP T ILR SV VN SI TG SS NV GD TL PTG QL SN IP WRR AGV KY TN NEA YF DVV EEI DA II DK SG STV FA EI QG VI DA CI KL SG MP DL SLSF MN PR LLD DV SFH PC IR FKR W ESER VL SFI PP DG NF RLI SY RV SSQ NL VAI PV YV KH SI SF KEN SS CG RF DI TI GP KQ NMG KTI EGI TVTV HM PKV VL NM NL TPT QG SY TFD PV TK VLA W DVG KI TPQ KL PSL K GLV NL QSG AP KP EE NP NL NI QF KI QQL AI SGL KV NRL DM YG EKY KP FKG VK YV TK AG KF QV RT"
"O08842-3","M ILA NA FCL FF FLG EE FY EA SPY EPV T SRL SD IF RLA SI FSG TG AD PVV SA KSN H CLD AA KA CNL ND NC KKLR SS YI SIC NR EI SP TER CN RR KC HK AL RQ FFD RV PSE YT YR ML FC SC QD QA CA ERRR QT IL PSC SY ED KEK PN CL DLR SL CR TD HL CR SRL AD FHA NC RA SYR TI TSC PAD NY QA CLG SY AGM IG FD MTP N YVD SN PTG IVV SP WC NC RG SG NM EE EC EK FL KD FT EN P CLR NAI QA FG NG TDV NM SP KG PT FSA TQA PRV EK TP SLPD DLSD STSL GT SVI TT CT SI QEQ GL KA NN SKEL SM C FT EL TT NI SPG SKK VI KLY SG SC RA RLST AL TAL PLL MV TL AQ"
"Q8VHH5-2","M NF QA GG GQ SP QQQQ SRG CGG PSQ QLA GG PP QQ FAL SN SAA I RA EI QR F ESV HP NI YA IY DLI ERI EDL ALQ NQ IR EHV ISI ED SF VN SQ EW TL SR SV PEL KVG IVG NL SSG K SALV HR YL TG TYV QEE SP EGG RF KK EI VV DG QSY LLL IRD EGG PP EL QF AA WVD AVV FV FSL ED EI SF QTV Y NY FL RLC SFR NA SEV PM VLVG TQ DAI SAA NPR VI DD SRAR KL ST DL KR C TY YET CA TY GL NV ERV FQ DV AQ KVV ALR KK QQL A IG PC KSL PN SPSH SAV SAA SI PAV HIN QA TN GGSS AF SD YSS SV PST PSI SQR EL RI ETI AA SST PT PIR KQ SK RR SN IF TI CA TV SN F SST KR PFQ LL PN"
"A0A140LIA7","MV RP KLA FY IL P LLLA FLG SALG WPG SQ SC SV QE VL RH YQ AVI FQ DLQ TA MQ WA GLGV QH TQ PG SRH HR FI QK NL TGA GGG QG QPG TSC DA QKE SS ILL SI ESLG QT LLG SV AGV PH NAL EKAA WTV AV RT EA VM RRH CG TSY RI QQ PR KH AV QL RN SRRR LLLR ALY AVA TC W EKL FAL SA MA TG EF"
"Q9D6Z1","MV LLH VLF EH AVG YA LLAL KEV EEI SLLL PQV EE CVL NLG KF H NVV RL VA FC PF SS SQV AL EN AN AV SEG VV H EDLR LLL ET YL PSKK KKV LLG VG DP KIG AA IQ EELG Y NC QT GGV IA EIL RGV RLH FH NL VK GL TDL SA CKA QL GLG HSY SRA KV KF NV N RVD NM II QSI SLLD QLD KD IN TF SM RVR EW YG YH FP ELVK IV NDNA TY CRL AQ FI GN RREL NEE KL EKL EE ITM DGA KAKA IL DA SRSS MG MDI SAI DLI NI ESF SS RVV SL SE YR QSL HT YLR SK MSQ VA PSL SAL IG EA VGA RL IA HAG SLT NLA KY PAST VQ IL GA EKAL FR AL KT RG NTP KY GLI FH ST FI GR AAA KN KG RI SR YL AN KC SIA SR ID CF SEV PT SV FG EKLR EQV EERL SFY ETG EI PR KNL DV MK EAVV QA EE AAA EI TR KLEK QEK KRL KKEK K RLA AL ALA SS EN SS TPEE CEE VN EK SKK KKKL KPQ ENG MED PPV SL PK SKK KKA PK EELA SDL EE MA T SSA KRKK SS PK EEVA SE PEE AASP TT PKK KR KF SEE PEV AA NFT K SST KKKK KSQ KA QED"
"P37237","MG SPR SAL SC LLL HLL VL CL QA QVR SAA QK RG PGAG N PAD TLG QG HED RP FG QR SRAG KN FTN PA PN YP EEG SK EQ RD SVL PKV TQR HVR EQ SLV TD QL SRRL IR TY QLY SR TSG KHV QVL AN KRI NA MA EDGD PFA KL IV ET DT FG SRV RV RGA ET GLY IC MN KKG KL IA K SNG KG KD CV FT EI VLEN NY TAL QNA KY EG WY MA FTR KGR PR KG SK TR QH QR EVH FM KRL PRG HH TT EQ SL RF EFL NY PP FTR SLRG SQ RT WA PEPR"
"P16951-2","M SDD KP FLC TA PG CG QR FTN ED HL AVH KH KH EM TL KFG PAR ND SV IV AD QT PT PTR FL KNC EEV GL FN ELA SP FEN EF KKA SED DI KK MPL DL SPL AT PI IR SKI EE PSV V ET TH QD SPL PH PE ST TSD EKL VR PV TMV PSV PGI PG PSS PQ PV Q SEA KM RL KAAL TQQ HPP VT NGD TV KG HG SGL VR TQ SEE SR PQ SLQQ PA TST TET PASP AH TT PQ TQ NT SG RRRR AA NED PD EKRR KFL ER NR AAA SR CR QKR KV WV QSL EKKA EDL SSL NG QLQ SEV TLL RN EVA QL KQ LLL AH KD CPV TA MQ KK SG YH TAD KD DSS EDL SV PSS PH TEA IQ H SSV ST SN GV SST SKA EAVA TSVL TQ MA DQ ST EP ALSQ IV MA PP SQ AQ PSG S"
"Q61539","MSS EDR HLG SS CG SFI KT EP SS PSSG ID AL SH HSP SGSS DA SGG FGI ALST HA N GLD SP PM F AGA GLGG NP CR KSY ED CT SG IM ED SAI KC EY ML NAI PK RL CLV CG DIA SG YH YG VA SC EA CKA FF KR TI QG NI EY NC PA TN EC EI TK RR RK SC QA CR FM KCL KVG ML KEG V RLD RVR GG RQ KY KR RLD SEN SP YL NL PI SPPA KK PL TK IV SN LLGV EQD KL YA MPP NDI PEG DI KAL TTL C ELA DR ELV FL IN WA KHI PG FP SLTL GD QM SLL QSA WM EIL ILG IV YR SL PY DD KLA YA ED YI MD EEH SRL VG LL DLY RA IL QLV RR YK KL KV EKEE FM IL KAL ALA NSD SM YI ENL EA VQ KL QD LLH EAL QD YEL SQ RH EE PRR AG KLLL TL PLLR QT AA KAV QH FY SVKL QG KV PM HKL FL EML EA KV"
"P20334","MG NN CY NV VV IV LLL VG CEK VG AV QN SCD NC QPG TF CR KY NPV CK SC PPST FSS I GG QPN CNI CRV C AGY FR FKK FC SS TH NA EC ECI EG FH CLG PQ CTR C EKD CR PG QEL TK QG CKT C SLG TF ND QNG TGV CR PW TN CSL DGR SVL KTG TT EK DVV CG PP VV SF SPST TI SV TPE GG PGG H SLQ VLTL FL AL TSA LLL ALI FI TLL F SVL KW IR KK FPH IF KQ PF KK TTG AA QEE DA CSC RC PQ EE EGG GGG YEL"
"Q5QD17","MA SF EA QQ ET FD CSE YG NG SC PEN ER SL GVR AA MY SL MA CAI FI TI FG NL AM II SI SY FK QL HT PT NLL IL SM AV TD F LLG FTI M PY SM VR SV EN CW YF GL TF CKI HY SF DL ML SI TSI FHL CSV AV DR FYA IC HPL HY CT KM TI PVV RR LLL VC WSV PGA FA FG VV F SEA YA DGI EG YD ILVA CSS SC PVM FN KL WG TTL FV AG FF TP SSM MV GI YG KI FAV SKK HA RV ID NL PEN QN NQ MR KDKK AA K TLG IV MG VF LLC WF PC FF TI LLDP FL NF STPA VL FD AL TW FG Y FN ST CN PLI YG FF Y PW FRR AL KYI LLG KI FSS H FH NT NL FTQ KET E"
"P51855","MA T SWG SIL QD EK QL EEL AK QAI DR ALA EGV LLR SA QH PSS SD VV TYA PF TL FP SP VP SALL EQ AY AV QMD FN IL VD AV SQ NPA FLEQ TLSS TI KK DD YTA RL FDI Y KQ VL KEG IA QTV FLGL NR SD YM FQ CGA DG SK AL KQI EI NTI SA SFG GLA SR TP AV HRH VLN VLN KT KEA SKIL SN NP SK GL ALG IA KA WEL YG SA N AVV LL IA QEK ER NI FD QR AV EN ELL DR KI HVI RG RF EDV SER G SL DQ NR RL FM DD QEV AV VY FR DG YM PSQ YN SQ NW EA RL ML ER SRAA KC PD IAI QL AG T KKV QQ ELSR VG LL EALL PG QP EAVA RLRA TFA GLY SLD MG EE GD QA IA EAL AA PSH FVL KP QR EGG GN NL YG EE MV QAL EQL KD SEE RA SY ILM EKI EPE PFR NC LLR PG SPA QV VQ CI SEL GI FGV YVR QG TTL VM NK HVG H LLR TK AV EH AD GGV AAG VA VL DN PY PV"
"Q9DAC7","M ALR PGR EGG ESSA ALA TA QA RF SRG EFA EAR ELY SA FI GQ CAR HG SK CSP EDLA TAY NN RG QT KY FSV D FY EAM DD YT SAI EIL PSF EV PY YNR GL IR Y RLG Y FD EAL ED FKK ALDL NPG FQ DA VLSL KQ TIL DK EE KQ RR NA EK SY"
"P84309","MSG SK SVSP PGY AA QT AA SPA PR GG PE HR AA WG EAD SRA NGY PHA PGG ST RG ST KR SGG AV TP QQQQ RLA SR WR GG DDD ED PPL SG DD PLA GG FGF SFR SK SA WQ ER GG DD GG RGSR RQ RRG AA GGG ST RA PPA GG SGSS AAAA AAA GG TEV R PR SV ELGL EE RRG KGR AA EEL EPG TG IV EDG DG SED GG SSVA SGSG TGA VLSL GA C CLA LL QI FR SKK FP SD KL ERL Y QRY FF RL NQ SSL TML MA VL VLV CLV MLA FH AAR PPL QIA YLA VL AAAV GV ILI MA VLC NR AA FH QD HM GL AC Y ALI AV VLAV QV VG LLL PQ PR SA SEG IW WTV FFI YTI YT LL PVR MR AAVL SGV LL SAL HL AI SLH TN SQ DQ FLL K QLV SN VL IF SC TN IV GV C TH YPA EV SQR QA FQ ETR ECI QA RLH SQR EN QQ QER LLL SVL PR HV AM EM KA DI NA KQ ED MM FH KIY IQ KHD NV SIL FA DI EG FT SLA SQ CTA QEL VM TL NEL FAR FD KL AA EN H CLR IK IL GD C YY CV SGL PEA RAD HA HC CV EMG MD MI EA ISL VR EV TGV NV NM RVG IH SG RVH CG VLGL RK W QF DV WSN DV TLA NH MEA GG KAG R IH IT KA TLN YL NG DY EV EPG CGG DR NA YL KE HSI ET FLIL SC TQ KR KEE KAM IA KM NR QR TN SIG HN PP HW GA ER PF YN HL GG NQV SK EM KR MG FED PKD KN AQ ESA NP ED EVD EFL G RAI DAR SID RLR SE HVR KF LL TFR EP DLEK KY SK QVD DR FGA YVA CA SLV FL FI CFV QI TIV PH SLF ML SF YL SC FLLL ALVV FV SVI YA CV KL FPT PL QTL SR KIV R SKK N STL VG VF TI TLV FL SA FV NM FM CN SK NL VG CLA EEH NI TV NQV NA CHV M ESA FN YSL GD EQ GF CG SPQ PN C NF PE YF TY SVLL SLL AC SV FL QI SC IG KL VL ML AI EFI YVL IV EV PGV TL FD NAD LLV TA NA ID FSN NG TSQ CPE HA TKV ALKV VT PI II SV FVL AL YL HA QQV E STA RLD FL WKL QA TEE KEE M EEL QA YN RRLL HN IL PK DV AA HFL AR ERR ND EL YY QSC ECV AVM FA SIA NF SE FYV ELEA NN EGV ECL R LLN EI IAD FD EII SED R FR QL EKI KT IG ST YM AA SGL ND ST YD KAG KT HI KA IAD FA MKL MD QM KY IN EH SF NN FQ MKI GL NIG PVV AGV IG AR KPQ YDI WG NTV NVA SR MD ST GV PD RI QV TT DM YQ VLAA NTY QL EC RG VV KV KGKG EM M TY FL NGG PPL S"
"Q9D668","ML FD KV KA FVV EI DG AR TG TE PV FH GG QAV AG RV LLEL AGAA RVG ALRL RARG RARA HW TE SR SAG SSTA Y TQ SY SER V EVV NH RA T LLA PD SG DIA TLPA GR H EF PF SF QL PI SL VT SF EG KHG SV RY SI KATL HR PWV PA RC AR KVF TVI EPV DI NT PALL EPQ AG AR EKV AR SW YC TR GLV SLSA KI DR KG YT PG EVI PI FA EID NG STR AV Q PRA AL VQ TQ TF MA RG AR KQ KR AVVA SVDG EPV G PN RR ALW PGR AL RI PP VG P SIL QCR VLSV DY SLKV FV DI PGSS KLLL EL PLV IG TV PLH PLG SRSA SVG SRA SFL QD W GLC TM MDR PEA PP EY SEV VR ESQL V CA SPG PSS LLH DL GV TT EG PY FA CL QE FR YC PP PLY SEED PN PP SEA VR PR CM TC"
"Q99K28","MAA SPSK TEI QTI FK RL RAI PT NKA CFD CG AK SP SWA SIT YGV FLC ID C SGV HR SLGV HL SF IR ST ELD SN W SWL QL RC MQV GG NA NA TA FFR QHG CMA NDA NT KY TSR AA QM YR EK IR QLG SAAL TR HG TDL WID SM NSA PSH SPEK KD SD FF TEH TQA PA WDT AA TD PSG TQQ PAL PSE SSSL AQ P EQG PN TD LL GT SPQA SLEL KSS I IG KK KP AAA KK GLGA KK GLGA QKV SN QSF TEI ER QA QVA EKLR EQ QAA DA KK QA EE SM VA SM RLA YQ EL QI DR KKEE KKL QNL EG KKR EQA ERLG M GLV SR SSI SH SVL SEM QM I EQ ETPL SA K SSR SQL DL FD DV GT FA SGPP KY KD NPF SLG ET FG SR WD SD AA WG MD RV EE KE PEV TI SS IR PI SER TA SRR EV ETR SSGL ESS EA RQ KF AGA KA ISS DM F FGR EVD SEY EAR SRL QQL SGSS AI SS SDL FG NM DG AH GGG TV SLG NVL PTA DI AQ FK QG VK SVAG KMA VLA NGV MN SLQ DR YG SY"
"Q9R0N8","M SGV WGA GG PR CQA ALA VLA SLC RAR PPPL GL DV ET CR SF ELQ SP EQ SP SAA DSG TSV SLL AVVV IV CGV ALV AV FLFL FW KLC WM PWR KK EA SS PSS AN PA SETL QSP SSRG N MAD KLKD PSAL G FL EAAV KI SH TSP DI PA EV QM SV KE HI MR HT KL QR QTT EPA SS TR HT SF KR HL PR QM HV SSVD YG NEL PP AAA EQ PT SI GRI KP ELY KQ KSV DGD DA KSE AA K SCG KI NF SLR YDY ESE TL IVR IL KAF DLPA KD FCG SS DP YV KI YLL PDR KC KL QT RV HR KTL NPT FD EN FH FPV PY EELA DR KL HL SV FD FDR FSR H DM IG EV ILD NL FEA SDL SR ET SI WKD IQ YA TSE SV DLG EI MF SLC YL PT AG RL TLTV IK CR NL KAM DI TG YSD PYV KV SLL C DGR RL KKKK TTI KK NTL NPI YN EA II FDI PP EN MD QV SLL I SV MD YD RVG HN EI IG VC RV GI NA EGLG RD H WN EML AY PR KPI AH WH SLV EVKK SF KEG TP RL"
"Q3TZA2","MEK Y EKLA KIG EG SYG VV FK CR NK SSG QV VAI KK FV ESED D RV VR KI ALR EIR ML KQL KH P NLV NLI EV FRR KR KM HL VF EY CD HT LLN ELER NP NGV SD GV IK SVL WQ TL QAL NFC H KH NCI HR DV KPEN ILI TK QG MI KI CD FG FAR ILI PG DA YTD YVA TR WY RA PELL VGD TK YG SSV DV W AVG CV FA ELL TG QPL WPG KSD VD QL YLI IR TLG KLI PR HQ SI FR SN QFF RGI SI PE PED M ETL EE KF SN VQ PV AL SF MKG CL KM NPD ERL TCA Q LLD SA YF ESF QED QM KR KAR SEG R SRRR QQ NQ LL PLI PG SHI SP TP DG RK QVV QL KFD HL PNI"
"Q8R149","M AAA PPL TKA EYL KR YL SG TDA GL EGG PEA GR KRR KKR PKPG GA GG KG MR IV DD DVG W AAI STA KP EK EEEE DG DL PV VA EFV D ER PEE V KQ MEA FR SS AK WK LLGG HG EDG H FH H DD QD SSPP RR VR H DT PD TSP PR KA RH DT PD PSP PR KA RH DT PD TSP PR KA RH DT PD PSP PR KA RH DT PD PSP PRR VR HD TP DL SP PRR VR HD TP DL SP PRR VR H DT PD PSP PRR VR HDL DA SP PR KSH RN SSAV SP RRG HHG SL GT SSPR QTH NH SP TAA QH RR TLD SSG TQ HL RRA HH ESP DL ELH KA KSS KAA ER AP SKAA SQ SGL GP SH PSL ST NSK Y EHD SDL SP PR KR QA KA HF EA KK QLD SK GV YQ KA SD SDL SP PR KK KN SGH QD SD SDL SP PR NR PRR Q SSD SDL SP P RRR QR TK SSD SDL SP PRR SPR PG KK TA HM Y SGA KT GL VT DV QR EH QEL KK QD QD TT DL GA QF EF TE TV FR DK SGR KR NL KL ERL EQRR KA EKD SER DEL YA Q WG KGL AQ SR QQQQ NV ED AM KEM QK PL AR YI DD EDL DR MLR EQER EG DP MA NFI KK NKA KEN KN KK VK PR YSG PAPP PNR FNI WPG YR W DGV DR SN GF EQ KR FA RLA SKK AV EELA YK WSV EDM"
"Q9D8U8","M AAV PE LLEQ QEE DR SKLR SVSV DL NV DP SL QI DI PD AL SER D KV KF TV HT KT TL ST FQ SP EF SV TR QH ED FV WL HD TL TET TD YA GL II PPA PT KPD FDG PR EK MQ KLG EGEG SM TKEE FA KM KQ ELEA EYL AV FKK TV ST HEV FL QRL SS HP VL SK DR NF HV FL EY DQ DL SV RR KN TKE MF GG FF KSV VK SAD EVL FSG VK EV DD FF EQEK NFL IN YY NRI KD SCA KAD KM TR SH KNV A DD Y IH TAA CL HSL ALEE PTV IKK YLL KVA ELF EKLR KV EG RV SSD EDL KL TE LLR YY ML NI EAA KD LLY RR TK AL ID YEN SN KAL D KARL KSK DV KLA ET HQQ EC CQ KF EQL SESA KEEL IN FKR KRV AA FR KNL I EM SEL EI KH AR NNV SLL Q SCI DL FKN N"
"Q8R4H4","MQG TQ RG GL VP GL SPL D RR TLL FC NF IL AVA WG QV NF TG DQ VLR VLA KN EK QL SLLR DLET QK PQ KV DF WRG PA RP SLPV DM RV PF SEL PSV KA YL KSH GL AY SI MI KDI QV LLD EER DA MA KSR RLER ST NSF SY SS YH TLD EIY SW ID N FVA EH SNLV SK IH IG KSF ENR SIL VL KF STGG PNR PA IW ID TG IH SR EWI THA TGI WI SQ KIV NA YG KD HVL KR IL NT MDI FI EIV TN PDG FA FTH SM NRL WR KN K SSQ PG IF C IGV DL NR N WK AG FGG NG SN KN PC SET YRG PA PE SE PEV AA IVD FI TG HG NF KA MI SIH SY SQ MV M YP YG HSL EPV PN H EEL F NLA KD AV KAL NKV HG IQ YI FG SI ST TLY SA SGI SVD WA YD SGI KY AF SF EL RD TG QYG FLL PASQ IV PTA EE TW M ALQ TI M KH TL NH PY"
"Q149F5","M YRD SPL MST PVA ND SR SD EG PSG KLSP TCL FP SF TCD FL DG DSS FEC C SID PL TG SHY IC RR SPR LL TNG YYI WT ED SF FCD PDG HI TL NP SQ TSV MY KENL VRI FR KKKR THR SLSS LLD PRA SK SWL HG SI FG EV DSL PSE DL WL DG IR SLG SDL DC SL SDG W ESQ KPV TD TSE SS SSG YIL PQ SLR ESS QSS SLQL QV KASG HF EK NSL VH SRA GL MH KV SF QA ILL AV CL VI SAY TR WFV GG ELA SI FT CA LLI TI AY VV KSL FL NL AR YF KA TSC AR FD ST"
