"UniProtID","tokens"
"Q80WR1","M EGD CL SC MK YL M FV FN FFV FL GG AC LLG VG IW VLVD PTG FR EI VA TN PLL T TGA YI VL AM GG LLF LLG FLG CCG AVR EN RC LLL FF FL FIL II FLV EL SAA ILA FI FR EHL TR EF FT KEL TKH Y QGD ND TDV FSA TW NSV M IT FG C CGV NG PED F KLA SV FR LLTL DT EE VP KA CC RR EPQ TR DGV VL SREE CQL GR NP FI NK QG CY TV ILN TF ET YV YL AGA FA IG VL AI EL FL MV FA MCL FRG IQ"
"Q8C4X7-2","MPA YQ EDR EED TC TIG EREK TI AT QRI KG FGV EN PVL PE SPPA SM SSV MKN NPL YG DI TL EEA M EER KK SP SW TI EE YD KH SV HT NL SG HL KEN PN DL RF WL GD TY TPG FD TLL KKKK KR NKR SKL CH M GLI LLL VA SIL VT IV TL ST IF S"
"Q9CR02-2","MKK TRY SKK DA C ELV ER YL DR FSS EL EQI EL QN SI KDR QG RR HH SR EA VI KQ TL ERER QQ YEG YG FEI PD ILD SN TL QT FR EW DF DL KKL PNI KMR KL CA DD AV P KKR KQ KN IL NI EK DLG ELEL SG P TGA TT DGKL EPA SE SSD TDEE MT PVPV SPH"
"Q569E7","MEQ ED NQG VC EY QT SED RG MD SDL EN SED R EG DP EE RG MG SN PW DT ED RG HL EQ EVD SN PQ DD DL RGD SR ERD RA ST VC SEG RL SEE ERA ILR EEED DQ PG VA DM AL FP GL SESD SI SRSP RG EED EEEE D EEEE SAG EN RLI EEED PLPT PVL PW RR HL SLGG RH RG DK PA HRR FH RL HH PMA M DLG EL DSL MA SI MDA PT IC PD CG ESF SPG AAFL QH QR IH RLA EAA AVA SL EPF GLAG EC GG VVG M MG MG MG VG MG VA GG FG AG PTL AR PPR EK PFR CG ECG KG FSR NT YL TN HL RLH TGER PNL CAD CGKSF SW RA DLL KHR RLH TGEKPY PC PE CG EA FSL SS HLL SH RR AH AAA GGG AG SAG SAA AL RP FA CG ECG KG FV RR SHLA NH QR IHTGEK PHG CG ECG KR F SWR SDLV KH QRV H TGEKPY MC SE CG ET FSV SSHL FTH KR TH SG ER PYV CR ECG KG FG RN SHL VN HL RVH TGEK PFG CG QC EK RF SDF STL TQ HQR TH TGEKPY TCL ECG KSF IQ SSHL IR HRR IHTG NKP H KC AG CGKG FRY KT HL AQ HQ KL HLC"
"Q8BG02","MG ED TD TR KI NH SFL RD HSY VT EA DVI STV EF NH TG ELLA TG DK GG RVV IF QR EPE SK NA PH SQG EY DV YST FQ SH EPE FD YL KSL EI EE KI NKI KWL PQQ NAA H SLL ST ND KTI KLW KI T ERD KR PEG YNL KD EEG KL KDL ST VT SLQV PVL KP MDL MV EV SP RR TFA NGH TY HIN SISV NSD CET YM SAD DL RI NL W HLA IT DR SF NIV DI KPA NM EDL TEV I TA SE FH PH HC NL FV YSS SKG SLRL CD MR AAAL CD KH SKL FEE PED PSN R SF F SEI I SSV SDV KF SH SG RY ML TRD YL TV KV WDL NM EAR PI ETY QV HD YLR SKL CSL Y ESD CI FD KF ECA WNG SD SV IM TG AY NN FFR MF DR NT KR DVTL EA SR ESS K PRA VL KP RRV CV GG KRR RD DI SVD SLD FT KK ILH TA WH PA ENI IAI AA TN NL YI FQD KV NSD MH"
"Q8BGN9","MTV GA RLR SKAA SSL VG RR PL GR SRR AGD EE TDA IV EHL EG EDED PASP DC EREE GG RR AG TP SA RRV HLA AL PER YD SLEE PA PGD KPKK RY RR KLKK YG KN FG KAI SKG CR Y IVI GLQG F AAA YSA PFG VA T SVV SF VR"
"O88447","M YD NM ST MV Y IK EEKL ENV TQD EII SK TK QV IQ GL EAL KN EH N SIL QSLL ETL KCL KK DD E SNLV EE KSS MIR KSL EML ELGL SEA QV MM AL SN HL NAV ESEK QNV RA QVR RL CQ EN QWL RD ELA NT QQ KL QK SEQ SVA QL EEEK KHL EF MN QL KKY DD DI SP SED KD SDSS KE PLD DL FPN DED EPG QG IQ HSD SSAA AAR QG YEI PA RLR TLH NLV IQ YA SQ GR YEV AV PSC KQ AL EDL EK TSG HD HP DV AT ML NIL ALV YRD QN KY KD AA NLL ND ALA IR EK TLG RD HP AVAA TLN NLA VL YG KRG KY KEA EPL CKR AL EIR EK VLG KD HP DV AK QLN NLA LLC QN QG KY EEV EY YY QR ALG IY QT KLG PDR TP NVA KT KN NLA SC YL KQG KF KQA ETL Y KEIL TRA HEA EFG SV DD EN KPI WM HA EER EEC KG KQ KDG SA FG EY GG WY KAC KVD SP TV TT TL KNL G ALY RR QG KF EAA ETL EEAA MR SR KQ GLD NV HKQ RVA EVL ND PE SM EK RRSR ESL NM DVV KY ESG PD GG EEA"
"Q9CPY6","MPV RT EC PPPA GA STT SAA SLI PPPP IN TQQ PG VA TSLL YSG SK FRG H QK SK GN SY DV EV VLQ HVD TG N SYL CG YL KI KGL TEE YP TL TT FF EG EII SKK HP FL TR KW DAD EDV DR KH WG K FLA FY QYA KSF N SDD FD Y EEL KNG D YV FMR WK EQ FLV PD HTI KDI SGA SF AG FY Y IC FQ K SAA SI EG YY Y HR SS EW YQ SL NL THV PE HSA PIY EFR"
"Q91WC1","M SLV STA PY TY TPL NLL KEG TIA NV YG VV KF FK PP YV SKG TD YC SV VT IVD QT NV KL TC ML FSG NY EAL PI IY KV GD IVR FH RL KI QVY KN ELQG IN CSG FA SL TF EG TVG MPV TA RT SSKV FSF T PQD QK MV EAL RV WA SK HI SASS TLV QLC DA QPM Q YY DL TC Q LLG KA QVD ST AF LL KV WDG TQ TVL PSW RV ST QDL TF EG DL SHI ERL QSL VVD ILV YD NHV QV AR SI EVG CFL RL YSL HT KL QPG N SET SS SESL RL EF HL HGG T SYG RG IR VL PD TSP CVD QL KK AL EGA NL PV TET STG IC Q SEN GD SSAL SN SGSG AV SP YEE ER C QQV SA TIL TN HQ HL EK TPL CA IL TQ KA PQQ YRV RA KLR SYL PR RL SQ SV KLL CP KC HSV QEV PHG DSL DK IL QD AA TEA PDI KLKA TSL YY SKV WTT ED Q GGR QV AVH FV KN NG IL PASS ECL ILI EGG RLC EV SKL SS KF HSV M PVR SG PESL ELL TL SA PFL I QG KV HH YG CKQ C SSL KPI QNL NSR FH KG PW TPSS VA EALG VV PLQ YV FV MV F TLD DG TG VLEA YL KD SEH FF KI PA SEVL TDD DL QRSL ETI MD M IC PPG I KV DA YP WL EC LL KSY NV TIG TE RR IC Y QI FD T TVA EN VV"
"E9Q649","MKI FR CC FKY TL QQ KL FI LLL TL WL FSLL KLL NV GR LL FP QR DI YLV EY SLST SP FVR NR FPE SGD AA RD NV NC SG VY EH EPL EI GK SL EI RRR SII DL EDG DV VA MT SD CDV YQ TL RQ YH EKLV SR EEED FPI AY SLVV HKD AI MV ERL I RA IY NQ HNL YC IH YDL K SPD TF KAA MN NLA KC FP NI FIA SKL ETV EYA HI SRL QAD WN CL SDLL KSS VQ WK YVI NL CG QD FPL KSN FEL VT EL KSL QG RN ML ETV R PPSA KT ER FTY HH ELR QV PY DY MKL PV KT NV SK GA PPH NI QV FVG SA YF VL SRA FV KYI FN SSLV ED FFA W SKD TY SPD EH F WA TL IRI PGI PG GI SSSS QDV SDL QSK TRL VK W FY YEG FLY PN CTG SHL R SV CI YG AA ELR W LLN EG HW FA NK FD SK VD PIL MK CLA EKL EE QQR KLI ALSS EK FM TEG TR QSH TL"
"Q9D4V0","MA NYI HV PPG SPEV PKL DV TV QD QEE QR CR DG AL SLLR HLR PH WD PR EVTL QL FT DGI TN KL IA CYV GD TM EDV VL VRI YG NKT ELLV DR DEE VK SFR VLQA HG CA PQL YC TF NN GL CY EFI QG EAL D PQ HV CN PA IF RL IAR QLA KI HAI HA HNG WI PK SNL WL KMG KY FSL IP TG FAD EN IN KR FL SEI PSP Q LLQ EE MT WM KELL SSLG SPV VL CH ND LL CK NI IY NEK QG DV QFI DY EY SG YN YL AY DIG NH FN EF AGV SD VD YSL Y PDR EL QGQ WLR SYL EAY KEY KG FG SD VT EKEV ETL FI QV NQ F ALA SH FF WGL W ALI QA KY STI EFD FLG YAV VR FNQ YF KM KP EV TAL KM PE"
"Q8BWQ6-2","MAV FP WH SR NR NY KA ELA SC RL ETV PL ECG DY HPL KPI TV TE SKT KKV SR KG STSS TSS SSSS SV ID PL SSVL DG TD PL SM FAA TSD PAA TG TV TD SSR KK RD KD EN SF VG PD FEP WA NK RV EIL AR YTT T EKL SI NL FMG SEK GR GG AAA SAM SEK VR TRL EEL DD F EEG SQ KELL NL TQQ D YV NRI EEL NQ SL KDA WA SD QKV KAL KIV IQ CSK LLSD TSV IQ FY PSK F VLI TD IL DT FG KL VY ER ISS M CVD SR SAL PD HF SP ENV ND TA KET CL NW FF KIA SIR ELI PR FYV EA SIL KC NK FL SK TGI SE CL PRL TC MI RG IGD PLV SV YA RA YL CRV GI EV AP HL KE SLN KN FFD FLL TF KQI HGD TV QN QL VA QGV ELL SYL PLY SPA MG WI FQ CV SY HA PE CAL SSL PSLL SELR GL SHL WR CA EAV"
"Q8VFX2","MT SM EN IT EV TEFI LLGL TD DP NL QV PLLL I FL FI YLV TL IG NGG M MV II FSD SHL H TPMYFFL SNL SFV DLG YSS AVA PK MVA ALQ SGN KVI SY NG C AAQ FF F FVG FA TV EC Y LLA SMA YDR H AAV CR PL HY TT TM TTG VC TIL TIG SY TCG FL NA SIH AAD TF KL SF CG SN KI NH FF CDI PPLL ALA CSS THI SKL VV FFV VG FNV FF T LLV III SY FFI YIA IQ NM KSS EGR KK AFST CA SHL TAV SI FYG TI IF MYL QP SSG Q SMD TD KIA SVFY TVV IPML NPLIY SLR NR EV KSAL WK IL NR FY PA SF SVSR K"
"Q9JIX0","MVV SK MN KD AQ MR AAI NQ KLI ETG ER ERL KELL RA KLI ECG WKD QL KA HC KEV IK EK GL EHV TVD DL VA EI TP KGR ALV PD SV KK ELL QR IR TFL AQ HA SL"
"Q5Y5T1","MA PW TL WR C CQ RV VG WV PVL FI TFV VV WSY YA YVV EL CV STI SR TGEK GK TVV YL VA FHL FFV M FV WSY WM TI FT SPA SPSK EF YL SN SEK ERY EK EF SQ ER QQD ILRR AAR DL PI YTT SA SKA IR YC EK CQL IK PD RA HH CSA CDR CVL KMD HH CP WV NN CV GF TN Y KF FML FLL Y SLL YCL FV AA TVL EY FI KF WTL CRR KST EN CP KN EPT VLN FP SA KF HVL FL FFV SA MF FV SVL SLF SY HC WL VG KNR TTI ESF RA PM FSY GI DG NG F SLG CSK N WR QV FGD EK KY WLV PI F SSLG DG CSF PA RL VG MD P EQA SVA NQ SD YVR SIG SN QPF PI KPL SESK NR LLD SE SQ WL EN GA EE GV TK SG TN NHV TV EI EN"
"Q61079","MK EK SK NAA KT RR EK ENG EF YEL AK LLPL PSA IT SQL D KA SII RL TT SYL KMR AV FPE GLG DA WG QP SR TG PLD SV AK ELG SH LLQ TL DG FV FV VA SDG KIM YI SE TASV HL GL SQV EL TG NSI Y EY IH PSD HD EM TA VL TAH PPL HH H LLQ EY EI ER SF FL RM KC VLA KR NA GL TC SGY KV IH CSG YL KI RQ YML DM SL YD SC YQ IV GLV AV GQ SLPP SA IT EI KLH SNM FM FRA SLDL KLI FLD SR VT EL TGY EPQ DLI EK TL YH HV HG CD TF HLR YA HH LLLV KG QV TT KY YR LL SKL GG WV WV Q SYA TV VH NSR SSR PH CIV SV NY VL TDV EY KEL QL SLD QV ST SK SQ ESW RT TL STSQ ET RK SA KP KN TKM KT KLR TN PY PP QQ YSS FQ MD KL EC SQ VG N WR TSP PT N AVA PP EQ QLH SEA SDLL YG PP YSL PF SY HYG HF PLD SH VF SSKK PGL PA KFG QP QG SP CEV AR FFL STL PASS EC QW H CA N SLV PSS SSPA KNL SE PSP VN AA RH GLV PN YEA P SAAA RR FC ED PAPP SF P SCG HYR EE P ALG PA KA PR QA SRD AA RL ALA RA PP EC CA PPA PE PQA PA QL PFV LL NY HR VLA RRG PLG SAA PGA PE AAG SLR PR HPG PV AASA PGA PR PH YL GA SV II T NGR"
"Q3UTA9-2","MN KV E GGG HK EEVV VK EKEV VK EK PSEA TA EG VQ AG EA KDL PG SLKT QRR KA HR EH PP EVL SKL HPL QYR WVL W FF KN DR SRA WQD NL QL VT KF NTV ED FW AVY SHI KLA SKL SSG CD YAL FK EGIL PM WED NR NKQ GGR WLL SI DK QLR HF ELD RL WL ET QG SV RC CR EH PH EEG QD C PVD E"
"P60954-2","MH ERL FQA PSG GLSQ DG VG VD EKL SL RRV AVV ED FF DI IY SM HV ETG PNG EQ IR KH AG QKR TY KAI SE SYA FL PR EAV TR FLM SC SE CQ KRM HL NP DG TD HKD NG KPP TL VT SM ID Y NM PI TMA YM KH MKL QLL NSQ QD ED ESS I ESD EF DM SD ST RM SA VN SDL SSNL EER MQ SPQ TV HG QQ DDD SAA ESS NG N ETLG HSS AASG GA HGR EP EDSS SDG KT GL EQEE QPL NL SDSP SSA QL TSE FRI DD QG SDG KN KY KN LLI SDL KM ER EAR ENG SKSP AH SY SS YD SG KN ESV D RGA EDL SLN RGD EDED EHD EH ED SEK VN ET DGV EA ERL KA FN M FV RL FVD ENL DR MV PI SK QPK EKI QA IID SC RR QF PE YQ ERAR KR IR TYL KSC RR MKR SGF EM SR PI P SHL TSA VA E SILA SAC ESE SR NAA KRM RLD KA QD EAA PAD KQ CK PEAA QA TY STA TV PGSQ EVL YI NG NG TY SY H SYR GLGG LLSL DD TSS SG PT DL SM KR QLA TGSG SSSS STSR PQL SP TEI N AVR QLV AG YR ESAA F LLR SAD EL ENL ILQQ N"
"P22777","M QM SS ALA CL ILGL VLV SG KG FTL PLR ESH TA HQA TD FGV KV FQQ VV QA SK DR NV VF SP YGV SS VLA ML QM TT AGKT RR QIQ DA MG FKV N EKG TAH ALR QL SKEL MG PW NKN EI STA DAI FV QR DL ELV QG FM PH FF KL FQ TMV KQV DF SEV ERAR FII ND WV ER HT KG MI ND LLA KG AVD EL TRL VL VN AL YF SG QW KT PFL EA ST HQ RL FH K SDG STV SV PM MA QSN KF NY TEF TT PD GL EY DVV EL PY QRD TL SM FI AA PF EK DV HL SAL TN IL DA ELIR QW KG NM TRL PR LLIL PKF SLET EV DL RG PL EKLG M PD MF SATL AD FT SLSD QEQL SV AQ ALQ KV RI EV N ESG TVA SSSTA FVI SAR MA PT EMV I DR SFL FV VR HN PT ET IL FMG QVM EP"
"Q3U1J4","M SY NY VV TA QK PT AV NG CV TGH FT SA EDL NLL IA KN TRL EI YVV TA EGLR PV KEV G M YG KI AV MEL FR PKG ESK DLL FIL TA KY NA CIL EY KQ SG ESI DI IT RA HG NV QDR IG RP SE TGI IG IID PE CR MI GL RL YD GL F KVI PL DRD NK EL KAF NI RL EEL HVI DV KFL YG CQA PT IC FVY QD PQG R HV KT YEV SLR EK EF NKG PW KQ ENV EAEA SM VI AV PE PF GGA II IG QE SI TY HNG DK YLA IA PP II KQ ST IVC HN RV DP NG SR YLL GD MEG RL FM LLL EKEE QM DG TVTL KDL RV ELLG ET SIA ECL TYL D NG VV FVG SRL GD SQLV KL NVD SN EQG SY VV AM ET FT NL GP IV DM CVV DLER QG QG QLV TC SGA FK EG SL RI IR NG IG IH EHA SI DL PG IK GLW PLR SD PGR ET DD TL VLSF VG QTR VL ML NG EEV EE TEL MG FV DD QQ TF FCG NVA HQ QL IQ IT SASV RLV SQ EP KAL V SE WKE PQG KNI SVA SC NSS QV VV AV GR ALY YL QI HPQ ELR QI SH TEM EH EVA CL DI TPL GD SN GL SPL CAI GL WT DI SAR ILKL PSF ELL H KE ML GG EII PR SIL MTT F ESS HY LLC ALG DG AL FY FGL NI ETG LL SDR KKV TLG TQ PT VL RT FR SLST TNV FA CSD RP TV IY SS NH KL VF SNV NL KEV NY MC PL N SDG YPD SL ALA NN STL TIG TID EI QKL HIR TV PLY ESP R KI C YQ EV SQ CFG VLSS RI EV QD SSGG TT AL RP SAST QAL SSSV SS SKL FSS STA PH ET SFG EEV EV HN LL IID QH TF EVL HA HQ FL QN EY AL SLV SC KLG KD PN TY F IVG TA MV YP EEA EP K QGR IVV FQ Y SDG KLQ TVA EKEV KG AVY SMV EF NG KLLA SI N STV RLY EW TT EKEL RT EC NH YN NI MAL YL KT KG DF ILVG DL MR SV LLL AY KP MEG NF EE IA RD FN PN WM SAV EIL DD DN FL GA EN AF NL FV CQ KD SAA TT DEE RQ HL QEV GL F HLG EFV NV FC HG SLV MQ NLG EA ST PT QG SVL FG TV NG MI GL VT SL SE SW YN LLL DM QN RL NKV IK SVG KI EH SF WR SF HT ER KT EPA TG FI DG DLI ESFL DI SR PKM QEV VA NL Q YD DG SGM KR EA TAD DLI KVV EEL TR IH"
"Q9EST1","M TM F ENV TR ALAR QLN PRG DL TPL DSL ID FKR FH PF CL VLR KR KSTL FWG AR YV HTD YT LLD VL EPG SS PSD PT DSG NF SF KN ML DA RV EG DV DV PK TV KV KG TA GL SRSS TL EV QTL SVA PT AL ENL HK ER KL SAD HP FL KE MR ERG ENL YVV M EVV ETL QEV TLER AG KA EG CF SL PF FA PL GLQG SV NH K EAV TI PKG CVL AY RVR QL MV NG KD EWG I PH IC ND SM QTF PPG EK PG EG KF ILI QA SDVG EM HED FK TL KEE V QR ET QEV EKL SP VGR SSLL TSL SH LLG KK KEL QDL EQ TLEG ALD KG HEV TL EAL PK DV LLSK DA MDA ILY FLG AL TVL SEA QQ KLL VK SLEK KIL PV QL KLV EST MEK NFL QD KEG VF PLQ PD LL SSLG EEEL IL TE ALV GL SGL EV QR SG PQ YT WD PD TL PHL CAL YA GL SLL QLL SKN S"
"Q9CPV5-2","MA EV SRD SEAA ER GP EG SSP EAV PG DA TI PR VK LLDA IV DT FL QKL VAD RR RP SG IP EK DL CSV MA PY FL KQQ D TL CH QVR KQ EA KN QEL A DA VLAG RR QV EEL QQ QVR AL QQ TW QAL HR EQR ELL SVL RA PE"
"Q9EQR3-2","MF WNG QG DV QP LLSP QV H SEA LLR NH AG PQ RA CC TPSP RR QV AM SSH SH NG SV GQ PLG SGPG FLG W EPV DP EAGR PLQ PT QG PGL Q MVA KG QPV RL SPGG SRG HPQ EQ EEEEEEEE EE DK TGSG KPP TV SH RLG HRR AL FEK RK RL SDY ALI FG MFG IVV MV TET EL SW GV YT KE SLC SF AL KCL ISL ST VI LL GLV IL YH AR EI QL FL VD NGA DD WR IA MT W ERV SL ISL ELVV CA IH PV PGH YR FT WTA RL AF SL VP SAA EA DL DV LLSI PM FL RLY LLA RVM LLH SRI FT DA SSR SIG ALN RV TF NTR FV TK TLM TI CPG TVLL VF SV SSW IV AA WTV RV CER YH D KQ EV TSN FL GA M WLI SI TFL SIG YGD MV PH TY CGKG VC LL TGI MG AG CT ALVV AVV AR KL EL TKA EK HV H NF M MD TQL TK RV KN AAA N VLR ET WL IY KH T RLV KK PD QG RVR KH QR KFL QA IH QA QKL R SV KI EQG KV ND QA N TLA ELA KA QSI AY EVV SEL QA QQ EEL EA RLA AL ESRL D VLGA SLQ AL PGL IA QA IC PLPP PW PGPG HLA TA TH SPQ SH WL PT MG SD CG"
"P01654","DI VL TQ SPA SLAV SLG QRA TI SC RA SESV DN YGI SF MN WF QQ KPG QPP KLL IY AA SN QG SGV PA RF SGSG SG TD FSL NI H PM EEDD TA MY FC QQ SK EV PW TFGG GT KL EI K"
"E9Q4P1","MAA EI HSR PQ SSR PVLL SKI EGH QD AV TAA LLI PK ED GVI TA SED R TI RV WL KR DSG QY W PSI Y HT MA SP CSA MA Y HH D SR RI FVG QD NG AVM EF HV SED FN KM NFI KT YPA H QN RV SA II FSL AA EWV I STG H DK CV SW MC TR SGN ML GR HFF SS WA SCL QY DLD TQ HA FV GD YSG QI TLL KLEQ NTC SV IT TLKG HEG SIA CL W WD PI QR LLF SGA SD NSV IM WDI GGR KG RT LLL QG HH D RV QSL CYL QL TR QLV SC SAD GGI AV W NM DV SR EEA PQ WL ESD SC QKC EQ PF FW NI KQM WD TK TL GLR QH H CR KCG QAV CG KC SS KR SSY PV MG FEF QV RV CD SC YD SI KD ED RT SLA TF HEG KH NI SHM SM DI AR GL MV TCG TD RVV KI W DM TPV VG C SLA TG FSP H"
"Q80Y61-2","MA PE MD QF YR ST MA IY KSI MEQ FN PAL ENL V YLG NN YL RA FH AL SEAA EV YF SA IQ KIG EQ ALQ SST SQ ILG EIL V QM SD TQR HL N SDL EV VV QTF HG DLL QH MEK NT KL DM QFI KD SC QH YEI EYR HR AA NLEK CM SEL WR MER KRD KN AR EM KE SV NRL HA QM QA FV SE SKR AA ELEE KRR YR FLA EKH LLL SN TFL Q FLG RV SRAG ESK PR PPG AVV RLRR TQ EQER SFL PL CFL"
"Q8BFQ2","MA SA EPL TAL SR WYL YAI HGY FC EVM FT AA W EFV VN FN WKF PG VT SV WAL FI YG T SIL IV ERM YL RLRG RC PLL VR CV IY TL WT YL W EF TTG FIL RQ FNA C PW DY SQ FD FD FM GLI TL EY AV PW FCG AL IM EQ FI IR NTL RLR FD KDA EPG EPA SP PALA NG HV KTD"
"Q8VCP8","MKL PNI LLTG TPG VG KT TL GK ELA SR SGL KYV NVG DL AR EG QLY DG YD EE YG CP ILD ED RV VD EL EH QM QE GGV IV DY HG CD FF PER W FH IV F VLR TD NG VL YK RL ET RG YN EKKL QD NI QC EI FQ VLY EEA IA SY KEE IV HQL PSN EPE QLED NI NQI SK WI EQ WV KDH NP"
"Q9D7H2","MA TE HL PA ER AQ SLL SA PRR EE EPQ KP NY ALRL TL AGH SAA I SSV KF SP NG EWL A SS AAD AL II IW GA YDG NC KK TL YG HSL EI SD VA W SSD SS RLV SASD DK TL KV WD MR SG KCL KTL KG HSD FV FC CD FN PP SNL IV SG SFD ESV KI WEV KTG KCL KTL SA HSD PI SA VN FN CNG SL IV SG SYD GL CRI WD AA SGQ CLR TL AD EG N PPV SFV KF SP NG KY IL TATL DN TL KLW DY SRGR CL KT YTG H KN EKY CL FA SF SV TG RK WVV SG SED NMV YI WNL QTK EI VQ RLQG HT DV VI SAA CH PT KNI IA SAAL END KTI KV WSS DC"
"Q9QUI1","MN GLPA TEA PGG AGC ALA GL PPL PR GLSG LL NA SGG SWR ELER VY SQR SR IH DEL SRAA RA PDG PRH AAG SA NSG SAA GP RR PV NLD SALA ALR KE MV GLR QL DM SLL CQL W GLY ESI QD YK HL CQ DLSL CQ DLSS SLH SD SSY PP DA GL SDD EE PP DA SL PPD PPPL TV PQ TH NA RD QWL QDA FQ ISL"
"Q9Z247","MAL GA RG W RRR SLL LLLL WV TG QAA PVL GLAV SSEL QI QQ SFV PD EC PR TVH SGD FVR YH YV GT FL DG QK FD SSY DRD ST FNV FVG KG QLI AG MD QAL VG M CV NER RLV TI PP NLA YG SEG V SG VI PP N SVL HF DV LLV DI WN SED QV HIQ TY FK PP SC PR TI QV SD FV RY HY NG TFL DG TL FD SSH NR MKT YD T YVG IG WLI PG MD KG LLG M CVG EKR II TV PP FLA YG EEG DG KDI PG QA SL VF DVA LL DLH NP KD TI SI EN KV VP EN C ERR SQ SGD FL RY HY NG TLL DG TL FD SSY SR NH TFD TY IG QG YVI PG MD EG LLGV CIG ERRR IVV PP HLG YG EKG RG SI PG SAVL VF DI HV ID FH NP SD SI SI TSH YK PP DC SVL SKK GD YL KY HY NA SLL DG T LLD ST W NLG KTY NI VLG SG QV VLG MD M GLR EM CVG EKR TV II PP HLG YG EA GV DG EV PG SAVL VF DI ELL ELV SGL PEG YM FI WNG EV SP NL F EEI DR DG NG EV LL EEF SE YI HA QVA TG KG KLA PG FNA EM IV KN MF TN QDR NG DG KV TAEE FKL KD QEA KH DEL"
"Q920M7","ML EPL NEG LL SRI SDV LL CG W TC QH CC QR CY ESS C CQ SSED EV EIL G PF PA QT PP WL MA SR SN DK DGD SVH TA SDV PL TPR TN SPDG RR SSSD TSK ST YSL TRR I SSLD SRR PSS PLI DI KPV EFG VLSA KK ESI QP SVL RR TY TPD DY FR KF EP RLY SLD SNL D DV DSL TDEE IM SKY QLG ML HF ST Q YD LL HN HL TV RVI EAR DL PP PI SH DG SR QD MA HSN PYV KI CLL PD QKN SKQ TGV KR KT QK PV FEE RY TF EI PFL EAQ RR TLLL TV VD FD KF SRH CV IG KV AV PL CEV DL VK GG HW WK AL IP SS QN EV ELG ELLL SLN YL P SAG RL NV DII RA KQ LL QT DV SQG SD PFV KI QL VH GL KLV KTKK T SFL RG TID PF YN ESF SF KV PQ EEL ENA SL VF TV FG H NM KSS ND FI GR IV IG QY SSG PSE SN HW RR ML NT HR TAV EQ WH SLR SRA ECD RV SPA SLEV T"
"Q80ZD8-2","M QP QR DLR GLW LLLL SV FLLL FEV AR AGR SVV SC PA NCL CA SN IL SC SK QQL PNV PQ SL PSY TA LLDL SH NNL SRL RA EW TPT RL TNL H SLLL SH NHL NFI SSEA FV PV P NLR YL DL SSN HLH TLD EFL F SDL QAL EV LLL Y NN HIV VV DR NA FED MA QL QKL YL SQ NQI SR FPV EL IK DG NKL PKL MLL DL SSN KL KKL PL TDL QKL PA WV KN GL YLH NN PL EC DC KLY QL FSH WQ YR QL SSV MD FQ EDL YC MH SK KLH NI F SLD FF NC SEY KE SA WEA HL GD TL TIR TLPP TV YT RLA NL RA HGL YN"
"Q9JIA7","MA PP PLL PV AAST PIL HG EFG SY PA NG PR FAL TL TT QAL HIQ RL RP KP EAR PRD GLV SLD EV SG CG TLQ SRSP ED TAA Y FC IY TY PRG RR GG RRRA TR TF RA DGA TTY EEN RA EA QR W AT AL TC LL RGV PL SG DQ EI TPE LL PR KPR LLIL VN PF GGR GLA WQR C MD HVV PMI SEA GLSF NL IQ TER QN HAR EL VQ GLSL SE WEG IV TVSG DG LLY EVL NG LLDR PD WED AV RM PIG VL PCG SGN ALAG AV NH HGG FEQ VV GVD LLL NC SLLL CR GG SH PL DLL SV TLA SGSR CF SFL SVA WG FL SDV DI H SER FR ALG SA RF TLGA VL GLA SLH TY RG RL SYL PA TT EP AL PI PG HSL PR AK SEL VLA PAPA PAA TH SPL HR SV SDL PLPL PQ P ALV SPG SP EPL PDL SLN GG GP EL TG DW GGAG DA PLSP DP LL PSS PN AL KTA QLSP IA EG PP EM PA SSG FLPP TH SA PEA ST WG PV DH LL PPLG SPL PQD WV TI EG EF VL MLG IL P SHL CA DL MAA PH AR FD DG VV HL CW VR SGI SR AALL RI LLA M EHG NH F SLG CP HLG Y AAA RA FRL EPL T PRG LLTV DG ELV EYG PI QA QV HP GL AT LLTG PA GQ KP QA"
"Q8K0D0","MKK FKR RL SLTL RG SQ TID ESL SELA EQM TI EE SSSK DN EP IV KNG R PP TSH SVH SFL H QY TG SF KK PPL RR PH SVI GG SLG SF MA MPR NG SRL D IVH ENL KMG SDG ESD QASG TSS D EV QSP TGV CLR NR IH RRI SM EDL NK RL SLPA DIR IP DG YL EKL QI SSPP FD QPM SRR SR RA SL SEI G FG KM ET YI KL EKLG EG TYA TVY KGR SKL TE NLV AL KEI RL EH EE GA PC TA IR EV SLL KDL KH AN IV TL HD IV HTD KSL TL VF EYL DK DL KQ YM DD CG NIM SM HNV KL FL YQ ILR GLA YC HRR KVL HRDL KPQ NLL IN ERG EL KLAD F GLA RA KSV PT KT YSN EVV TL WYR PP DV LLG SS EY ST QID M WG VG CI FF EMA SGR PL FPG STV EDEL HLI FR LLG TPSQ ET W PGV SS ND EF KN YN FP KY KPQ PL IN HA PRL D SEG I ELI TK FL QY ESKK RV PA EEA MK HV YFR SLG PR IH AL PE SVSI FSL KEI QLQ KD PG FR NSS Y PE TG HG KN RR Q SML F"
"P35980","MGV DI RH N KDR KV RR KE PK SQ DI YLR LLV KL YR FLA RR TN ST FN QV VL KRL FM SR TNR PPL SL SRM IR KM KL PGR EN KT AV VVG TV TD DVR IL EV PKL KV CAL RV SS RAR SR ILKA GG KIL TFD QLAL ESP KG RG TV LLSG PR KGR EV YR HFG KA PG TP HSH TKP YVR SK GR KF ERA RG RRA SRG YKN"
"Q9CX30","M HA TGL AA PAG TP RL RK W PSK RRV PV SQPG MAD PH QFF DD TSS AP SRG YGG QP SPG GLG YPP SSSD AAFL AA PM SN MA MV YG SSL AAQG KEL VD KNI DR FI PV SKL KY YF AVD TV YV GK KLG LLV FP YLH QD WEV QY QQ DT PVA PR FDI NA PDL YI PA MA FI TY ILVA GL ALG TQ DR FSP DLL GL QA SS ALA WL TL EV VA ILL SL YLV TV NT DL TTI DL VA FLG YK YVG MI GG VLTG LL FG KIG YYL VLA WC CV SI FV FM IR TLRL KIL AQ AAA EGV PV RG AR NQL RM YL TM AVAA AQ PVL MY WL TF HL VR"
"O88574","MNG FTP EEM SR GGD AA AAV AAVV AAAA AAA SAG NG NAA GGGA EV PGAG AV SASG PPG AAG PGPG QLC CLR EDG ER CGR AAG NA SF SKR IQ KSI SQ KKV KI EL DK SAR HL YI CD YH KNL IQ SV RN RR KR KG SDDD GGD SP VQ DID TP EV DLY QLQV NTL RRY KR HF KL PT RP GL NKA QLV EI VG CH FK SI PV N EKD TL TC FIY SVR ND KN K SDL KA DSG VH"
"Q3U1Y4","MA EER PP RL VD YFV VA GLAG NGA PI PEE KWV PE PTG PLR PPR PA EPI TDV AV IAR ALG EE VP QG Y TC IQ TSA GG HPL EL SAG LLGG TQ PV IC Y RRG RD K PPLV ELG VLY EG KER P KLG FQ VLD TT PY SH SA NLA PPG PG HPR TYL MY RRAA EGA GLH ALG IT DL CL VL P SKG EG TP HTY CRL PR NL NPG M WG PAV YL CY KV GLA KA NTL VY EA ELL GR YP EE DN EA FPL PE SVPV FCL PMG A TI EC WPA QT KY PVPV FST FVL TG AA GD KV YGA ALQ FY EAF PRA RL SER QAR AL GLM SAV ER GR AL GGR AVR SR RA IA VLSR WPA FPA FRA FL TFL YR YSV SG PH RLPL EA HI SH FIH NV PF PSP QR PR ILV QM SP YD NLLL CQ PV SSPL PL SGA SFL Q LLQ NL GP ELA IT LLLA VL TEH K LLV H SLR PD LL TSV C EALV SM IF PL HW QC PYI PL CPL VL AD VLSA PV PF IVG IH SS YF DL HD PPA DVI CV DLD TN TL FQ KEE KK PL SAR TL PRR PY K LLLA TL TSL YQ QL DQ TY TG PEE EA SL EF LL TDY EAV CG RR TRL ER EV QGA FL RF MA CLL KG YR N FLR PL TQA PSEG SR DVD NL FYL QG FL KSR ER SSH KLY SQ LLH TQ MF SQ FI EEC SFG SAR HA AL EF FD SC VD KV HP EQEK PEPT PLV EL EEL SG SEL TV FI TPP EE PP VLEG SEST PQ YC YDG FP EL KA ELF ESP QEQ QG AL PVPG PSR SA PSS PA PRR TKQ EM KVA QR MA QK SATV PEL WAR C LLG HC YGL WFL CL PA YVR SV PSR VR ALH TA YH VLR EM ENR KV VL PD EVC YR VLM QLC SH YG QP VLSV RV ML EM RR AG IV PN TI TYG YY NKA VL ESK W PSG T PGG RLR WA KLR NV VLG AAQ FR QPL KD RR QQQQQQQQ QQQQ KQQ VA EQ QK SGSS QT EP YL ER PSP TR PL QR QTT W AGR SLR EP SS PMG RL VK SG SLG SA RG TQ PTV EAG VA H MI EALG VL E PRG SP VP WQ DGSL SDL SLTG EE MA PGG SP GGSG SAL SA QST EAL EGI SGRG SK TSG CQ EE VG TPR KGL GA RLQQ LL TP SR RA SA SRI PP PEL PSDL PPAA RR SP MD SLL WPR ER PG STA SE SSA SLG SE WDI SE SSL SSL SLRR SS ERL SDT PGA FQ PP SL EIL MSS CSL C HA CD SLV YD EE IM AG WA PDD SNL NTT CPF CA CH FV PLL SV QTL D SR PSA PSP KSSL AGA SGC KDA PA PGG PG PVL SD RR FCL ALD QP QLC NGH MG SASR RV EN GA WA YL SPL VL RK EL ESLV EN EG SE VLAL PEL PAA H PI IF WN LL WY FQ RLRL PSVL PGL VLA SC NG PP P SQL SQ GP SP WL TPD PASV HV HLL WD VL TPD PN SC PPL YVL W RVH SQI PQ RVV WPG PV P SCL SLA LL ESVL R HV GL NEV HK AVG LLL ETLG PPPT GL HL QRG I YR EIL FL TMA ALG KD HVD IVA FD KK YK SA FN KLA SS MG KEEL RQ RR AQ MPT PKA ID CR KC FGA PL EC"
"Q80XE1-1","MD EER ALY IVR AG EA GAI ER VL RD YSD KH RA TF KF ESA DED KR KKL CEG IF KVL VK EV PT TC QV SCL EVLR IL SRD KK ILV PV TT KEN M QI LL RLA KLH ESD DSL EKV SE FPV IV ESL KCL CN IV FN SQ MA QQL SLEL NL AA KL CN LLR KC KD RK FI NDI KC F DLR LLF VL SLL HT DIR SQL RY EL QGL PLL TQ IL ESA FSI KW TD EY ESA ID HNG PPL SPQ ETD CAI EAL KAL FNV TVD SW KVH KE SD SH QF RV MAA VLR HC LL IVG PT ED KT EEL HSN AV NLL SNV PV SCL D VL IC PL TH EE TA QEAA TLD EL PSD KT TEK DT AL KN ST MV YNG M NM EAI HV LL NF M EKR ID KG SS YR EGL TP VL SLL TEC SRA HR NI RK FL KD QVL PPLR DV TNR PEV G ST VR N KLV RL MT HV DL GV KQI AA EFL FVL CK ER VD SLL KY TG YG N AAG LLAA RG LLA GGRG DN WY SED ED TD TEE Y KNA KP NI NLI TG HL EE PM PN PID EM TEE Q KEY EAM KL VN MLD KLSR EELL KP MGL KP DG TI TPL EEAL SQY SVI EE TSS D TD"
"Q76LL6","MA TL AC RV QFL DD TD PF NST NF PE PSR PPL FT FR EDL ALGT QL AGV HR LLRA PH KL DD CTL QL SH NGA YL DLEA TLA EQ RD ELEG FQ DD TG RG KK NSI IL RT QL SVRV HA CI EKL YN SSGR DLRR AL FSL KQI FQ DD KDL VH EFV IA EGL TCL I KV GA EAD QN Y QN Y ILR ALG QI ML YV DGM NGV INH SET IQ WL YTL VG SK FRL VV KT AL K LLLV FV EY SE SN AP LL IQ AV SA VD TK RGV KP WSN IM EIL EE KDG VD TE LLV YA M TLV NK TLA GL PD QD TFY DV VD CL EEL GI AAV SQR HL NKK GT DL DLL EQ FNI YEV AL RH EDGD ETA EPP PSG HRD RRRA SM C SGG TVG EQ QGL D RRR SR RH SI QNI KSPL SA PTSP CSP SVPA FKP SQ VR DLC EKD EEEEEEEE QPI TE PN SEE ER ED DA QC QG KD SKA SSA SG QSS PG KD AA PE SS ALH TT SSPT SQ GR WL SAST AAR SPVL GG TSG PEA SR PAA R LL PPSP GLA TR PST AP KV SP TID KL PYV PH SP FHL FSY DF ED SPLL TKD KGG D SQ TEN RY SN FSS NSF QSS RP SPGP SGSP SYA SS FSS PQD TR SS PSG LL TSS FR QH QE SLAA ER ERR RQ ER EERL QRI EREE RN KF NR EYL D KR EEQR QA RG ER YK YL EQL AA ET QEK EPR SQ SV SRG RA DL SLDL SL PAA PA PPSP SSQ SP SAD SQ EAL PV PSS PPTL QC PQV SG KDH EP ELEA EAG QG AD EA SQ DIA SAH RGA ESQ EE PVL EL EPEE RA SL SEK ER QN EE VN ERD NC SA SSI SSSS STL EREE KED KL SED RA TGL WST SLQ DV GV NG Q CGD IL TSK RF MLD ML YA HNR KST EDEE KD DG EPG R SA QEV EAVA SLA TRI STL QA NSQ AP EE SI KRV DIG CL DN RG SV KA FA EK FN SG EVG RG AI SP DV ESQ D KV PD T PPA QL KT ESD YI WD QL MA NPR EL RI QD MD FT DLG EED DID VLDV DLG HR EAPG PPPPPP PT FLGL PPPPPP P LLD SV PPPP V PGN LLA SPV FN TPQ GLG W SQV PR GQ PA FT KKKK TI RLF WN EVR PF EW PSK NN RR CR EFL W SKL EPI KV DT SRL EHL F ESK SKEL SV TKK TAA DG KRQ EII VLD SKR SN AI NI GL TVL PPPR TI KIA ILN FD EY AL NK EGI EKIL TMI PT EEEK QKI QEA QLA NP EV PLG SA EQ FLL TL SSI SEL SA RL HL WA FKM DY ET TEK EVA EP LLDL KEG ID QL EN NK TL GF IL ST LLA IG NFL NG TNA KAF EL SYL EK VP EV KD TVH KQ SLL HHV C TM VV EN FPD SS DLY SEI GAI TR SA KVD FD QL QD NLC QM ERR CKA SWD HL KA IA KH EM KP VL KQR M SEFL KD CA ER II IL KIV HRR II NR FH SF LLF MG HPP YA IR EV NI NKF CR II SE FAL EYR TTR ER VLQQ KQ KRA NHR ER NKT RG KMI TD SG KF SGSS PAA PSQ PQ GL SYA ED AA EH EN MKA VL KT SS PAL EDA TP VL GVR TR SRA SRG STSS WT MG TEE SPSV TDD AAD EI MDR IV KSA TQV PSQ RVV PR ER KR SRA NR KSL RR TL K SGL TP EEAR ALGL VG T SEL QL"
