"UniProtID","tokens"
"Q8BG41","M ALQ DV C KW QT PD TPR PSI HL PQA GG WAV PRG CD PQ TFL QI HG P RLA HG TT TLA FR FR HG VI AA AD TR SS CG SY VA CPA SR KVI PV HQR LLG TT SG TSA D CA TW YR VLRR EL RLR ELR EG QL PSV AG TA KLL AA MM SC YR GL DL CV AT AL CG W DH SG PAL FYV YSD GT CL QG DI F SVG SGSP YA YG VLD RG YH YD MTI QEA YTL AR C AVA HA THR DA Y SGG SVDL F HVR ESG W EYV SR SD AC VL YR ELQ KAR SLEQ ELEA KA CG IY PE PA TP QG AR EC KEL FV EQ EEV TP ED CA II MKT ETM"
"Q9WTY1","MAL PP FFA QSR QG PPPP QPP PSA PFG CPP PPL PSP AF PPPL PQR PG PF PGA SA PFL Q PPL ALQ PRA PA EA SR GGGG GGA FF PVPP PPL PPPP PQ CR PF PG PD AV ER PRPP PPG PGPP W SPR WA EA PPPP D VLG DA ALQ RLR DR QWL EAV FG NP RR PG GL RT PR TPA GP SLG EV RA RLR SAL RL VR RLR SLG Q SLR EAEA DG AA WA SL HA QAA PL RA ELA ERL QPL RQ AA YVG EA RRRL ERV RR RV RVR ERAR DR RL SG RR GA QR TER EQ EI DR WRV KCV QEV EEKK RD EEL K AAA DG VLA EVR KK QSD TKR MVD ILR AL EKLR KLR KE AAAR KG VC PPA SAD ET FEH HLQ RLR KLI KKR SEL YEA EER ALRV ML EG EQEE ERRR ELEK KQR KEK EK LLL QKR EI ESKL FGD PD EF PL AH LL QP FR QY YL QA EH SL PAL IQ IR HD W DQ YL VP SD HP KG NSV PQG WVL PPL PSN DI WA TAI QLH"
"Q69ZX6","MA FTN Y SSL NRA QL TF EYL H TN ST TH EFL FG ALA EL VD NAR DA DA TRI DI YA ERR EDLR GG FML C FLD DG AG MD PSD AASV IQ FG KSA KR TPE ST QIG QYG NGL KSG SMR IG KD FIL FT KK ED TM TCL FLSR TF HEE EG ID EV IV PLPT W NAR TR EPI TD NV EK FAI ET EL VY KY SP FH TEE QVM NQ FM KI PG NSG TLV II FNL KL MD NG EP EL DII SN PKD IQ MA ET SPEG TK PERR SF RA YAA VLY ID PR MRI FI HG HKV QTK RL SC CL YK PR MY KY TSS RF KT RA EQ EV KKA EHV AR IA EE KAR EA ESK AR TL EV RM GG DL TRD SRV MLR QV QN TAI TLRR EA DV KK RI KD AK QRAL KE PK ELN FV FGV NI EHR DL DGM FIY NC SRL I KM YEK VG PQL EGG MA CGG VVG VV DV PYL VL EPT HN KQD FA DA KE YR HLL RA MG EHL AQ YW KD IA IA QRG II KF WD EFG YL SA NW NQ PPSS ELR FK RRRA MEI PT TI QC DL CL KWR TL PF QL SSV ET DY PD TWV CSM NPD PEQ DR CEA SEQ KQ KV PLG TLKK DP KT QEE KQ KQL TEK IR QQQ EKL EAL QKT TPI R SQA DL KKL PL EV TTR PI EE PV RR PQR PRSP PL PAV I KN AP SRPP SI QT PR PST QLR KT SV ISL PK PP TT AARG ET STSR LLQ PT EA PR KPA NPP IK TV PR PT PPV HT PPL SL IP SS K SLR EV PA Q KAI KT PVV KK PE PPV KQ SV AT SGR KR SLAV SD EEEA EEEA EKRR ER CK RG KL AV KEE KK EA NEL SD SAG ED HPA ELR KA QKD KGL HV EV RV NR EW YTG RV TAV EVG KN AVR WKV KFD YV PTD TT PR DR WV EKG SEDV RL MK PPSP EH QSP DT QQ EGG EE EEA MV AR QAV AL PE PST SD GL PI EPD TTA TSP SH ET ID LL VQ IL RN CL RY FLPP SF PI SKK EL SV MN SEEL I SF PL KE YF KQ YEV GLQ NL CH SY QSR AD SRA KA SEE SLRT SEK KLR ET EEKL QKL R TN IVA LLQ KV Q EDI DI NTD DEL DA YI EDL IT KGD"
"P47934","ML AF AAR TV VK PLG LL KP SSL MKV SG RF KAH QD AL PRL PV PPL QQ SL DY YL KAL QP IV SEE EWA H TK QL VD EFQ T SGG VG ERL QK GL ERR A KK MEN WL SE W WL KTA YL QFR Q PVV IY SS PGV IL P KQD FV DLQG QL RF AA KLI EG VL DF KSM ID N ETL PV EFL GG QPL CM NQ YY QIL SSC RV PG P KQD SV VN FL KSK R PP THI TV VH NY QFF EL DV YH SD GT PL TSD QI FV QL EKI WN SSL QSN KE PVG IL TSN HR NT WA KA YN NLI KD KV NR ESV NSI QK SI FTV CL DK QV PRV SD DV YR NHV AG QML H GGG SK FN SG NR W FD KTL QF IVA EDG SCG MV Y EH AAA EG PP IV AL VD HV MEY TKK PEL VR SP MV PL PM PK KL RF NI TP EI KN DI EKA KQ NL SIM IQ DL DIM ML TF HH FG KD FPK SEKL SP DA FI QV ALQL AY YRI YG QA CA TY ESA SLR MF HL GR TD TIR SA SID SLA FV KG MGD ST VP EQ QKV ELL RK AV QA HRA YTD RAI RG EA FDR HLL GLKL QAI EDLV SM PD IF MD TSY A IAM HF NL ST SQV PA KTD CV MF FG PV VP DG YG IC YN PM EAH IN FSV SA YN SCA ET N AAR MA HYL EKA LLD MR TLL QN H PRA KL"
"Q8C569","MA STG SQA SD KN KI FG FF NDG EPP TKK PR KLL PSL KTKK PR EL VLV IG TGI SAA VA PQV PAL KSW KGL I QA LLD AA ID FD LL EDEE SKK FQ KCL HED KNL V HV AH DL IQ KLSP RT SN VR ST FF KD CL YEV FD DL ESK MED SG KQ LLQ SVL HLM ENG ALVL TT NFD NLL ELY AAD QG KQL ESL DL TD EK KVL EW AQ EKR KL SVL HI HG VY TN PSG I VLH PAG Y QN VLR NT EV MR EI QKL YEN K SFL FLG CG WTV DD TT FQ ALFL EAV KH K SDL EH F MLV RRG DVD EF KKLR EN MLD KGI KVI SYG ND YA DL PE YF KRL TC EI ST RGR SAG MAR EG QLNG SSAA HG EI RG CST"
"Q62082-2","MG Q SSLD HGV QG PV AG TGD FG PL KEA TA TG FI SCA QA PRR AR KRV EG TASS NV FSM FD QSQ IQ EF KEA FTI MD QNR DG FID KEDL RD TFA AL GRI NV KN EEL EA MV KEA PG PI NF TV FL TM FG EKL KG SH CA EL FY ESSR PQ SRG PL WG QGR EWL A EAR TQ KRL YC TP SK CL TL KEK AL SRL TSL RK SL"
"Q9EPJ9","MA SPR TR KVL KEV RA QD EN NV CF ECG A FN PQ WV SV TYG I WI CL EC SGR HR GLGV HL SF VR SV TMD KW KDI EL EKM KA GG NA KFR EFL ET QDD Y EP SW SLQD KY SSR AAAL FRD KVA TLA EG KE WSL ESS PA QN WT PP QPK TL QF TA HRA SGQ PQ SAAA SGD KAF ED WL ND DLG SY QG AQ ENR YVG FG NTV PP QKR EDD FL NNA M SSL YSG WSS FT TGA SK FA SAA KEG A TK FG SQA SQ KA SELG HSL NEN VL KPA QEK VK EG RI FD DV SSGV SQLA SKV QG VG SKG WR DV TT FF SG KA EDSS DR PL EGH SY QN SS GD NSQ NSN ID QSF WET FG SA EPP KA KSP SSD SW TCA DA STG RR SSD SW DV WG SGSA SN NKN SN SDG W ESW EGA SGEG RA KA TKK AA PST AD EG WD NQ NW"
"P58196","M SGL VP TA PEQ PT EEM EN QI KSP TAV PDA PP DY NSH FA PG PAG PVA SPSA GL PMG YY IP QQ PG AI PL YH PT GG TH PI QY QPG KY PV TN QPA PI M WM AG PAPV PN CPP GL EYL A QLD NI H VLQ HV EPL ELM TR FET NNR YDI KN NI DQ MV YIV TED TD DF TR NA YR NLR PF VLRV TD CL GR EIM TM QR PFR CTC CC FC C PC AR QEL EV QC PPGV TIG FVA EH WNL CRA SYSI QN EK KE SM MRV RG PCA TYG CG SD SV FEI NSL DGV SN IG SI IR KW NG FL ST MV NA DH FEI RF PL AL DV KM KA MI FG SC FL ID FM YF ER PP PRR MSR"
"P84751","EV KLV ESGG GL VQ PGG SLSL SC AT SG FT FID YY M SW FR QPPG KAL EWL GL IR NKG NGY TM EY SASL KG RF TI SR DN SQ SIV YLH MN TL TA ED SA TYY CA RVD YG TN YD YWGQG TTL TV SSA KT TA PSV Y PLA PV CG DT TG SSV TLG CLV KG YF PE PVTL TW NSG SLSS GV HTF PA VLQ SDL YTL SSSV TV TSS TW PSQ SI TC NV AH PA SST KVD KKI E PRG PTI KP CPP C KC PA PN S"
"E9Q9R9","M EPQ RR ELL AQ CQQ SLA QA MT EVEA VLG LL EAAG AL SPG ERR QLD EEA GGA KA ELLL QLLL AK EQ DH FQ DL RA ALEK TQ PH LL PIL YL NG VVG PP QST EG AG STY SVL SI MP SD SESS SSL SS VG TTG KA PSP PPLL TEQ QA ND TV ENL SI QL RLM TR ER NEL RK RLA FA T HGA TFD KR PY HRL NPD Y ERL KI QCV RAM SDL Q SLQ NQ H TN ALKR CEE VA KET D FY HTL HSR LLSD QT QL KD DVD ML RR ENG KLRR ER NLL QQ SW ED MK RLR EED QK EIG DL RA QQQQ VL KH NG SS EIL NKL YD TA MD KL EVV KKD YD ALR KRY SEK VA M HN SDL SRL EQL G EE NQ RLQ KQ TE ML TQQ RD TAI QL QH QC ALSL RR FET IH HEL SKA TA QN KDL QW EM ELL Q SEL T ELR SK QV KTA KE SEK YK EE RD AVY SEY KL IM SER D QVI SEL DKL QT EV ELA ESKL K SST SEK KAA SEE M EALR QI KD TV TMD AG RA NK EV EIL R KQ C KAL CQ EL KE ALQ EA DVA KC RRD WA FQ ER DK IVA ERD SIR TL CD NL RRER DR AV SELA EALR SL DD TR KQ KN DV SREL KEL KEQ M EC QLEK EAR FR QL MA HSS HD SA ID TD SM EW ET EVV EF ERET EDI DL K ALG FD MA EG VN EP CF PGD CGI FV TKV D KG SIA DG RLRV ND W LLR IN DV DL IN KDKK QAI KALL NG EGA IN MVV RR RK SLGG KV VT PL HI NL SGQ KDSG ISL EN GV YAA AVV PGSP AA KEG SL AVG DR IV AI NGI ALD NK SLN EC ESLL R SC QD SLTL SLL KV FPQ SS SW SGQ NI F ENI KD SDR ML SC RA HG PEV QA HN KR NLL QH NN ST QT DI FY TD RL ED RK ELG H SGG SS SFL H KP FSG SS SPV SPQA CP ST SER SLN SFR SD TSA ERG YGL VD MR SQ RP LL SF ET EV GP CG AV EV PLD KI DP EG SN SG GT W PKA VLG STSG PEKL SVY KK PK QR KSI FD PN TF KR PQ TPP KI DY LLPG PGL TH SP QP SK RVG SL TPP KPP RR SD SI KFQ HRL ET SS ESEA TLVG SS PST SP PSA PP PSM DP SE PT HA SP PR KA RVR IA SS YH SEG DG DT SYL PA KK PCD EDL TSQ KVD ELG QK RRR PK SA PSF RP KI SP VVI PA QCL EE QE CV PA IG EL SPEG QE WSP Y SPG HA SR HG NP LL YP NR PSV G TV PR SM TPG T TVG SIL RN PIY TVR SHR VL PCG SPPV PRD AG SQ SLSP SV QH QG RL SLDL SH RA CSD Y SEM RA SQG SN SL PSSA RLG SS SNL QF KA ERI KI PL TPR YPR SV MG SD RG SLSH SE CST PPR SPL NID TL SSC SQPQ TTA STL PRI AV NP SS HG ERR KD RP FV EE PR HV KV QKG SEPL GI SIV SGEK GGV YV SKV TLG SI AH QA GL EYG DQ LL EF NGI NLR SA TEQ QA RLI IG QQ CD TI TIL AQ YN PH IH QL NSH SRSS SHL DP AA TP H STL QG SSAG TPE HP SV ID PLM EQD EG PGT PPA KQ SASS TR SV GD TT KK TPD PR IV FI KK SQL DL GV HL CGG NL HGV FVA EV EDD SPA KG PD GLV PG DL IL EYG SLD MR SR TV EDV YV EML KP KD SLRL KV QYR HEE FT RV KGL PGD SFY IR AL YD RLA EV EP EL SF KK DD IL YV DD TL PQG V FG SW MA W QLD EN AQ KI QRG QI PSK YV MD QEF SRRL SM SEV KD DN TA KTL SAAA RR SF FRR KH KH KR SG SK DG KDLL ALD TF SND SIPL FED SV SLA YQ RV QKV DC T SLR PV LLL GP LL DVV KE ML VN EAPG KF CR CPL EV MKA SQ QAI ER GV KD CL FV DY KRR SG HF DV T TVA SI KEI TEK NR HC LL DIA PH AI ERL HH MH IY P IVI FIR YK SA KH IK EQ RD PV YL RD KV TQR HSK EQ F ETA QKI DQ EY SR YF TGVV QGG ALSS IC TQ ILA MV SQ EQ SK VL WI PA CPP"
"E9Q816","MA LLLL GV WG ILL LLGL WG LLQG CTR SP SLA PR W PPG PRPL P FLG NL HLL GV TQQ DR AL MEL SER YG PM FTI HLG SQ KTV VL SGY EV VR EAL VG TGH ELA DR PPI PI FQ HI QR GG GI FF SSG AR WR AG RQ F TVR TL QSL GV QQ PSM VG KVL QEL A CL KG QLD SY GG QPL PLA LLG WA PC NI TF TLL FG QR FD Y QD PV FV SLL SL ID QV MV LLG SP GI QL FN TF PRL GA FL RL HR PVL SKI EE VR TIL RT LLET RR PPL PT GG PA Q SYV EALL QQ GQ ED DP EDM FG EA NVL AC TLD MV MAG TET TAA TL QW AV FL MV KH PHV QG RV QEEL DR VLG PG QL PQ PE HQR AL PY TSA VLH EV QRY IT LL PHV PR CT AA DI QL GG YLL PKG TPV IP LL TSV LLD KT QW ET PSQ FN PN HFL DA KGR FM K RGA FL PF SAG RRV CV GK SLAR TEL FLL FAG LLQR YR LLPP PGL SPA DL DLR PAPA FT MR PP AQ TL CVV PR S"
"Q6ZPR6","MD AA TPD CT SK CR SL KH ALD VLSV VT KG SE SQ IK SFL AR YC YN AA TV KDA FG RN AG HLA SS CG KKG VLD WLI EK GVD LLV KD KE SG WT AL HR SV FYG HID CV W SLL K HGV SL YM QD KE GL SPL DLL M KDR PT HVV FKD TD PT EV YT WGD NTN F TLG HG SQ NSK HH PE LLDL FSR SGV YV KQV VLC KF HSV FL SQ KG QV YT CG HGR GG RLG HGD EQ TCL VP RLV EGL SGH NC SQV AAA KD HTV VL TD DG CV YTF GL NM FH QLG II PPPA SC NV PR QI QA KYL KGR TI IGV AA GR FH TVL WTR EA VY TLGL NGG QLG HLL DP NG EK CV TT PR QV SAL HH KDI AV SLV AA SD GA TV CV TT RG DI YLL AD YQ CKK MA TK QL NL KK VLV SGG CM EY KVD PE HL TEN GG QKI CVL AM DG AG RV FC WR SI SSSL KQ CR WA YPR QV SI SDI AL NR N EIL FV TQ DG EG FKG KW FED KR KN SEK KAD IL PNL HH SS SDV SCV PD TN SVY ERI RL EKL PFA HR AV SVST DP SG CN FA ILQ SD PKT SLY EI PVV SSSS FF EE FG KLLR ETD EMD SFH DV TF QVG NR HF PAH KY IL AVR SD FFQ KL FL SDG SSL EL TDV YQ KD ED AAG CHL FVV EKV HP DL FEY LLQ FM YTD TC DLL THG FK PRM IV KRKA ED CEG SPD SHL HTV NC HV DD KQ KSA FEV YR SN QA HTL SER QK SK PK SS KKG KG VG DDD PVR ML Q SVA KK FGL SNL SSRL EGV RL EN EKI NV IA KK TG NKL KL SQ KK C SFL YDV TM KSV DG KE FSC H KC VL CA RL EY FH SML SR SWI EA SS CA AL EM PI QSE IL KV ILD YLY TD EA VVI KE SQ NVD FV C SVL VV AD QLL IT RL KEI CEV AL TE NLTL KN AA MLL EFA AL YN AG QL KL SCL QFI GL NM AALL EAR SLD VL SED VL KDL SI FYR KMI PAM ERR VI TP YQ DG PD ISS MQV EDG EV FF KEE IN M EPN Y SET MF KKA KT RA KK KPR KR SD SSGG YTL SDV IQ SP P SAG LL KSA KT NSV ESL PELL TSD SEG SY AG VA SPR DLQ SPD FT AG FH SD KV EG KA KP YV NGI PP PC TR EDV KP WEK SPTT KSA PQ FI PSN RV DT AASS SWL AG SC SPV SP PVV DLR TI MET EE NR QK YG AA PK SNL G KII SH GI KL SQ KQR KMI AL TT KEN NSG TN SM EA IL TA PSK SP KPA NA WA PLH SPL SR SF RD FLL EEKK PVPG YG SGD HV KK VC FKG TEN SPAL NV AR CST HG TPGL ESN HV SD FP LLD SP NP WQ SSSL AASP AVA PV TFA SIV EEER QQ EAAL IR SR EK PL ALI QV EE HAI QD LLV FY EA FG NP EE FV VV ER AP QG PL AV PM W NK HG C"
"Q8BGG0","M EFL ER T YLV ND QA TKM YA FPL DR ELR QK PV NKD QC PG DR PE HP EAGG IY HC HN SA KA TG NR SS KQA HA KW RLC AASA IC FI F MVA EVV GG HV AG SLA IL TD AA HLL I DL TSF LLSL FSL WL SSR PP SK RL TFG WY RA EIL GA LL SVL CI WVV TGV LL YL AC ER LLY PD YQ IQ AG IM ITV SGC AVAA NI VL TM IL HQR NFG Y NH KDV QA NA SVR AA FVH ALG DV FQ SI SVL I SAL II YF KPD YKI AD PV CT FI F SIL VLA ST VM IL KD FSI LLM EGV PK GL SY NSV KEI ILAV DG VI SV HSL HI WSL TV NQV ILSV HV AT AA SQD SQ SVR TG IA QAL SSF DL HSL TI QI ESAA D QD PSC LLC ED PQD"
"Q9QZM3","M DLR AGD SWG MLA CL CT VLW HL PAV PAL NR TGD PGPG PSI QKT YDL TR YL EH QLR SLAG TYL N YLG PP FN EPD FN PP RLGA ETL PRA TV NL EV WR SL ND RLRL TQ NY EAY SH LLC YLR GL NR QAA TA ELRR SLA H FC TSL QG LLG SI AGV MA TLG YPL PQ PLPG TE PA WA PGPA HSD FLQ KM DD FW LL KEL QT WL WR SA KD FN RLKK KM QPP AA SVTL HL EA HG F"
"Q5SVL6","MLA GL KV KK QEL AN SS DVTL PDR PLSP PL TAPP TM KSA EF F EML EKM QGI KLEE QR PG PQ KN KD DYI PY PSI D EVV EK GG PY PLI IL PQ FGG Y WI ED PEN VG TPT SLG SSV Y EEEE ED SLSP NT FG YKL EC RG EA RA YRR H FLG KD HL NFY CTG SSLG NL ILSI KC EEA EGM EYL RI ILR SKL KTV H ERI PLA GL SKL PSV PQ IA KA FC DD AV GL KF NP VL YP KA SQM IV SYD EH DV NN TF K FGV IY QKA RQ TL EEEL FG NN EE SP AF KEFL DLL GD TI TL QD FKG FRG GL DV THG Q TGV ESV YTT FR DR EI MF HV ST KL PF T DGD TQ QL QR KRH IG ND IVA II FQ EEN TP FV PD MIA SNFL HA Y IVV QA DN PG TET PSY KV SV TAR EDV PA FG PPL PSP PV FQ KGA EFR EF LL TKL TNA ENA CC KSD KFA KL EDR TR AA LLD NL HD ELH TH TQV MLG MG PEE D KF EN GG HGG FL ESF KRA I RVR SH SM ET MVG SQR KLH GG NL PG SL SGG IV HN SM EV TKT TF SPPV AAA TA KN QSR SP IK RR SGL FP RLH SG SEG QGD SR TR CD SASS TP KT PD GGH SSQ EI K SET SS NP SS PEI CPN KEK PFI KL K ENG RA NI SR SSSS TSS F SST AG EG EA MEE CD SGSS QP ST TSP FKQ EV FA Y SPSP SS ESP SLG AAAT PI IM SRSP TDA KSR N SPR SNL KFR FD KL SHA SS SAG H"
"Q925E7","M AGA GGGG CPA GG ND FQ W CF SQV KG AVD ED VA EA DII STV EF NY SGD LLA TG DK GG RVV IF QR EQ EN KG RAH SRG EY NV YST FQ SH EPE FD YL KSL EI EE KI N KIR WL PQQ NAA HF LLST ND KTI KLW KI SER DK RA EGY NL KD EDG RLRD PFR IT ALRV PIL KP MDL MV EA SP RRI FA NA HTY HIN SISV NSD HET YL SAD DL RI NL WHL EI TDR SF NIV DI KPA NM EEL TEV IT AA EF HPH QC NV FV YSS SKG TI RL CD MR SS ALC DR HA KF FEE PED PSSR SF F SEI ISS I SDV KF SH SGR YM M TRD YL SV KV WDL NM EGR PV ET HQV H EYL R SKL CSL YEN DC I FD KF EC CW NG SDSA IM TG SY NN FFR MF DR NT RR DVTL EA SR EN SK PRA SL KPR KV CT GG KR KKD EI SVD SLD FN KK ILH TA WH PM ESI I AVAA TN NL YI FQD KI N"
"Q8C2S5-4","MA PF PD EV DV FTA PH WR MK QL VG RY CD KLSK TN FSN NND FRA LLQ SL YA TF KE FKM H EQI EN EYI IG LL QQR SQ TI YNV HSD NKL SE ML SLF EK GL KNV KN EY EQL NYA KQL KERL EAF TRD FL PH MK EEEE V FQ PML MEY FTY EEL KDI KK KV IA QH CSQ KD TA ELLR GLSL WN QA EER QK VL KY SVD EK AD TEA EV SEH STG IT HL PPEV ML SI F SYL NPQ EL CR C SQV ST KW SQL AK TG SL WK HLY PVH WA RG DW YSG PA TEL D TE PD EEW VR NR KD ESR A FQ EWD EDA DID ESE SAEE SV AI SI AQ M EKR VL HGL IH NVL PYV GT SV KTL VL AY SSAV SS KMV RQ ILEL CP NL EHL DL TQ TDI SDSA FD SW SWL G C CQ SLR HL DL SGC EKI TD MAL EKI SR ALG VL TSH QSG FL KSA GK AAST PW TSK DI TM PST TQ YA CL HNL TD KG IG EE ID NEH SW TE PVSS ESL TSP YV WML DA EDLA DI EDAV EWR HR NV ESL CV M ETA SN FG CSS SG CY SKD IV GL RT SV CW QQH CA SPA FA Y CG HSF CC TGT ALR TM TTL PA TSA M CR KAL RT TLPR GK DL IY FG SEK SD QE TG RV LLFL SLSG CY QI TD H GLR ALTL GG GL PYL EHL NL SG CL TV TGA GLQ DLV SAC PSL ND EY FY Y CD NI NG PH AD TASG CQ NL QCG FRA CCR SG E"
"Q9EP53","MA QLA NIG ELL SML DSS TL GV RD DV TA IF KE SLN SER GP ML VN TL VD YYL ET NSQ PVL HIL TTL QEP HD KH LLD KI N EYV GK AA TRL SIL SLLG HVV RL QP SW KH KL SQ AP LL PSLL KCL KM DT DVV VL TTG VLVL IT ML PMI PQ SG KQH LLD FF DI FG RL SSW CL KK PG HV TEV YLV HL HA SVY AL FH RL YG MY PC NFV SFLR SHY SM K ENV ET FEE VV KP MM EHV R IH PEL V TGSK DH EL DP RR WK TL ETH DV VI ECA KI SLD PT EA SY EDG YSV SH QL SAC FP YR SA DV TT SP YVD TQ NSY GG STST PSS SSRL ML FSP PG QL PQ SLSS PST R LL PEPL QA SLW SP SAV CG MTT PP T SPG NV PADL SH PY SKA FG TTA GG KG TP SG TPA TSP PPA PP CPQ DD CV HG SAA QA SATA PR KEE RA DSS RP YL HR QSN DR GL ED PPG SKG SV TLR NL PD FLG DLA SEED SI EK DK EE AAI SKEL SEI TTA EAD PVV PR GG FD SP FYR DSL SG SQR KTH SAA SG TQG SSV NPE PLH SSL DK HG PD TP KQA FT PID PP SGSA DV SPAG DR DR QT SLET SIL TP SPC KI PPQ RGV SFG SG QLPP YD HL FEV AL PK TA CH FV SKK TEE LL KKV KG NP EED CV PST SPM EVLD RLI EQG AG AH SKEL SRL SL PSK SV DW TH FGG SP PSD ELR TL RD QLL LLH NQ LLY ER FKR QQ HAL RN RR LLR KV IR AAAL EE HN AAM KD QL KL QEK DI QM WKV SL QK EQ AR Y SQL QEQ RD TMV TQL HSQ IR QL QH DREE FY NQ SQEL QT KLED CR NM IA ELRV EL KKA NN KV CH TE LLL SQV SQ KL SN SESV QQ QM EFL NR QLL VLG EV NEL YL EQL QSK HPD TT KEV EM MK TA YR KEL EK NR SH LLQQ NQ RL DA SQ RR VLEL ESLL A KK DH LLL EQ KK YL ED VK SQA SG QLL AA ESR YEA QR KI TR VLEL EIL DL YG RLEK DG RLR KL EED RA EAA EAA EE RLD CC SDG CTD SLVG HN EEA SGH NG ET RT SRPG GT RA SCGG RV TGG SSSS SSEL ST PEK PP SQ RF SSR WEP ALG EP SSSI PT TVG SL PSS K SFLG M KAR EL FR NK SE SQ CD ED SV TM SSSSL SETL KT ELG KDSG TEN KT SLSL DA PH PSS PN SD NVG QL HI MD YN ETH PEH S"
"Q07968","MM TLR HL PFI LLL IL SGEL YA EE KQ CD FP TV EN GR IA Q YY YTF KSF YF PM SV DK KL SF FCL AG YA TE SG KQ EEQ IR CTA EG WSP NPR CY KK CL KP DLR NG YV SN DK VLY KLQ ERM SYG C SSG YKT TGG KD EEVV HCL SAG WSS QP SC RK EQ ET CL AP EL EHG NY ST TQR TF KV KD IV AY TC TAG YY TT TG KQ TG EA EC QA NG WSL TPQ CN KL MC SSL RLI ENG Y FH PV KQ TY EEG DV VQ FF CH ENY YL SG SDL IQ C YN FG WY PESP IC EG RR NR C PPPP V PL NSK IQ PH ST TYR HG ERV HI EC ELN FVI QG SEE LLC EN GK W TE PP KCI EE KEK VA CEQ PP SV ENG VA HPH SEI YY SGD KV TYR C GGG YSL RG SSTI TC N RGR WTL PP ECV ENI EN CK PP PD IA NG VVV DG LLA SY TTG SSV EYR CN EY YLL KG SET SR CEQ GA WSS PPV CL EP CTI DV DH M NR NNI QL KW KY EG KIL HG DL ID FV CK QG YNL SP SIPL SEI SA QC NRG DV RY PM CIR KE SKG M CA SPPV IR NGD IV SS AAR TY ENG SSV EYR CFD NH FL QG SQ NVY CV DGV WTT PP SCL EP CTL SFV EMD KN YL QL KW NFD NR PL IL HG EYI EF MC KR DA YI SET SI AG SVL RV QCD RG RL KY PKC TPR DR RLSF QEAL RT RR QM EKR"
"Q6PDM1-4","MT MR SAV FK AAAA PAGG NP EQ RL DY ER AAAL GG PED ESG AA EA HFL PR HR KL KE PG PPLA SSQ GG SPSP SPAG C GGG KG RG LLL PAG AAPG QQ EE SW GG SVPL PC PPPA TKQ AGI GG EPV AAG AG CSP RP KY QA VL PI QTG SI VV AAA KE PT PW AG DK GGAA PPAA TA SD PAG PPPL PLPG PPPL AP TA TAG TL AA SEG R WK SI RK SPL GG GGG SGA SSQ AA CL KQI LLL QL DLI EQ QQ QQL QA KEK EI EEL K SER DT LL ARI ERM ERR M QLV KR DN EKER HK LLQG Y EP EER EEA EL SEK IKL ER QP ELC ET SQAL PSK PF SC GR SG KG HKR KT PFG NT ER KT PV KKL A PE F SKV KT KT PKH SP IK EE PCG SI SE TVC KR ELR SQ ET PEK PR SSVD TPP RLST PQ KG PST H PKEK AF SS EM EDL PYL ST TEM YL CR W HQ PP PSPL PLR ESS PKK EE TVA SKA"
"Q8C437-4","M QA EW EE MA RR N WI SEN QEA QN QV TVSA SEK G YY FH TEN PF KD WPG AF EEGL KRL KEG DL PV TIL FM EAA IL QD PG DA EA WQ FLG IT QA EN EN EQ AA IV ALQR CL ELQ PN NL KAL MAL AV SY TN TSH QQ DA C EAL KN WI KQ NP KY K YLV KN KKG SPGL TRR MSK SP VD SSVL EG VK EL YL EAA HQ NG DM ID PDL QT GLG VLF HL SG EF N RAI DA FNA ALTV RP ED YSL WN RLGA TLA NG DR SEE AV EAY TR AL EI QPG FIR SRY NL GI SCI NL GA YR EAV SNFL TAL SLQR KSR NQQ QV PH PAI SG NI WA AL RI ALSL MD QP EL FQ AA NLG DL DV LLRA FNL DP"
"Q9ESM3","M PSR I PLPA FC CF LL PWA FT SF HK AL GN PA PH PG PH YLL PP IH EV IH SR RGA TATL PC VL GT SP PSY KVR W SKV EPG ELR ETL ILI TN GLH ARD YG LLGG RA SL RRG HRL DA SL II KNV RL ED EGR YR C ELI NGI ED ESV ALTL RL EG VV FPY QP SRGR YQ FN YF EA KRA C EEQ DGRL AT YG QLY QA W TEGL DW CN AG WLL EG SVR YP VLTA RA PC GG HGR PG IR SYG PR DR SR DRY DA FC FT SAL AG QV FFV PG RL TL SEA HAA CRR RG AVVA KVG HL YAA WKF SGL DQ CD GG WLA DG SV RF PI TT PRPR CG GL PD PG VR SF GF PR P QQA SYG TY C YA EK"
"Q9WU62","MG TTA PG PI CLL DL CD QK LLD FV CNV DN KD FM WL KEI EEEA ERM FIR EF SN EP EL MP KT PSQ KN RRKK RRV SNI QD EN RD PV RK RLSR RK SRSS QVG TR HLR SK PV TIV EE NG FP VL QR IT RA TAA AAAAAAAA SVA SA SSSS TAG SP TVL TKK AVV EI ST SE RLSA ELQL TKL KG SLPP SPV SQG TLT SEE EL TP KK SEAG KLD SVTV NSL KA TPQ SP KN RG VG EGR SV SKL KIA RA SW GL QD SPG STD SP WQ ER VLSP ILL NN IL PT TA K SPLG NIR SV RR SLI SQD SQV PLA SK YNL VA KQ ENG SRR SSRR IA KK AG KE PEA SAR II CH SYL ERLL NV EV PQ NV GL EQ EPV EVA EP EEA EEEQ EV SK NSG CP SK PR SA TKI AI ST PT SK PAA AG QTT TVEE QEA ELD QT DG HR EPP QSV RR KR SY KQA I SE PD EEQL ED EEL QPC QN KT PSP PC PA NKV VR PL RT FLH TV QKN QML MTP TLA SR SSV MK SFI KR NT PL RV DP KC SFV EKER QRL ESL RR KEEA EQRR RQ KV EE DK RRRL EEV KLKR EERL RK VL QAR ERV EQ MK EEKK KQI EQ KFA QID EK TEK AK EE RLA EKA KK KA TA KKM EEV EA RR KQ EE EAR RLR WL QQ EEEE RRH QE ML QR KKEE EQ ERR KAA EAR RLA EQR EQ ERRR EQ ERR EQ ERR EQ ERR EQER KEQ ERR EQ EQ ERL RA KR EM QER EKAL RLQ KERL QK ELEE KK RK EE QQ RLA EQQL QEE QA KK AK EV AAAR KVL NM TV DV QSP VC TSY QM TP QG PK SI PKI SV DD YG MDL N SDD ST DD ESH PR KPI P SWA KG TQL SQA IV HQ YY HPP NIL EL FG SIL PLDL ED IF KKR KTR YH KR TSS AV WN SPPL KA TMV PSS GD"
"Q7TSY6-5","MY IK MA TLA NG QAD NA SLST N GLG SSPG SAG H MN GL SH SPG NP STI PM KDH DAI KL FIG QI PR NLD EK DL KPL FEE FG KI YEL TVL KD RF TG MH KG CA FL TY CER ESAL KA Q SAL HEQ KTL PGM NR PI QV K PAD SESR GGSS CL RQ PP SHR KL FVG ML NK QQ SED DVR RL FEA FG NI EE CT IL RG PDG N SKG CA FV KY SS HA EA QAA IN AL HG SQ TM PGA SSSL VV K FAD TD KER TM RRM QQ MAG QMG M FN PMA IP FGA YGA YA QAL MQQ QA AL MA SV AQ GG YL NPM AA FAA AQ MQQ MA AL NM NGL AAA PM TPT SGG ST PPG I TA PAV PSI PSP IGV NG FT GLPP QA NG QP AA EAV FA NG IH PY PA QSP TAA DPL QQ AY AGV QQY AG PA YP AA YG QI SQ AF PQPP PM IP QQ QR EG PEG CN LL IY HL PQ EFG DA ELM QM FL PFG NV ISS KV FVD RA TN QSK CFG FV SF DN PA SAQ TAI QA MNG FQ IG MK RL KV QL KR P KDA NR PY"
"Q8R2Q4","M FT KWR IF AV NH QR TF SV HL NT MC YC KI KA NL KRL KT QLPL TR NY SSA PGI AG SD VK SLH SV IN PP VA KIR NI GI MA HID AGKT TT TER IL YY SGY TR SLG DVD DGD TV TD FMA QER ER GI TI Q SAAV TL DW KG YRV NL ID TPG HV DF TL EVER CLR VL DG AVAV FDA SAGV EA QTL TV WR QAD KH KI PR IC FL NKM DK TGA SF NY AV ESI R EKL KA KPL IL QL PIG EAR TF QG VV DVV NK EKLL WN SN SD DG KD FER MPL SEA SDR ELL KET I EA RN SLI EQ VA DL DD EFA DL VLG EF SEN F DLV PA EKL QAA VH RV TL AQ AA VP VL CG SAL KN KGV QP LLD AV TT YL PSP EER EDR FL QW YEG DLC ALA FK VL HD KQ RG PLV FLR IY SGTL TP QL AVH NI NR NC TER MSR LLL PFA DQ HV EI PSL TAG NI ALTV GL KQ TA TG DT IV SS KSS AL AAA RR AG RG ER EHG KKR EA E SLLL AGV EV PEPV FF CTI EPP SVA KQ PDL DH AL ERL QR ED PSL KV KLD PD SG QT VL CG MG EL HI EI IH DRI KR EY GL ET YLG PL QVA YR ET IL NSV RA TD TL DR VL GD KR HLV SA EL EVR PAEE PC AVA KI EY AD CVG ED LLQA SR EAI ESA VH SA CL QG PLLG SP VQ DV AM TL HSL M IH PG TST TMV TA CI SR CM QK ALKK AD KQ VL EPL MSL EVTV SR EYL SP VLA DL AQ RRG NI QEI QTR QD NRV VLG FV PLA EI MG YST VLR TL TSG SA TF ALEL STY QA MSP QD QSA LLN QR SGL AH VL"
"Q8CGQ8-2","M ALR GL IR Q SKV RRRR EML PQQ VG FV CA VLAL VC CA SGL FG SLG HK TASA GK HV LL DT WR NR KL MA PI NG T PLA KN CTD PA IH EF PT DL FSN KER QHG AV LLH ILG AL YM FY ALA IV CDD FFV PSL EK IC EKL HL SEDV AGA TF M AAG SS TPEL FA SV IGV FI THG DVG VG T IVG SAV FN IL CI IG VC GL FAG QVV RL TW WAV CRD SV YY TL SVI VL IA FI YD EE IV WW EGL VLI IL YV FY IL IM KY NM KM QTF FTT KQ K SIA NG NPV SN ELED VK EK PP YG KT PVV MVD EIL SSSP PKF TF PEA GLR IM I TN KFG PR T RLR MA SR II IN ER QRL IN SA NG VN SKPL QNG RH ENM ENG NV PV EN PED PQQ GQ EQ QPP PQ PPPP EPE SV ETV FL SP FSM PEA KGD KA KWV FT WPL IF LL CV TI PN CSK PR WEK FF MV TFI TATL WI AVF SYL MV WLV TI IGY TLG IP DVI MG IT FL AA GT SV PD CMA SL IV AR QGL GD MAV SN TIG SNV FD ILV GLG IP WGL QT MV IN YG STV KI NSR GL VY SVV LLLG SVAL TV"
"Q8BWQ4","MSK RRKL PA RQ PA CL ET F SPD VLN DV SEL FA KSF SY RK PL DN EW QL PAPT ESF SCG HL EF RA LLDL KN SLN EV KN LLSD KKL D EW HR HTA FTN KAG KII SHV KK AV NA EL CT QA W CK FQ EIL CSF PLI PQ EA FQ SGRL NSL HL CEA PGA FIA SL NH YL KSH RF PC EW SW VA NSL NPY HEA ND NLR MI TDD RL MA NTL HC WY FG PD NTG DI MTL KYL TGL QD FL SGM SPI HLV TA DG SF DC QG NPG EQ EALV SSL HY CEA VT ALI TL GD GG SF VL KM FTL FEH CSV NL MY LL NC SFD QV HV FK PA TSK AG N SEV YVV CL RY KGR EAV QP LL SRM VLN FG TEM TR KAL FPH HVI PK SFL ER HEE CC TF FHR YQL ETI SEN I RLF E SMG TG EQ ERL NNL RD CAV QY FM QKF QL KPL SR NH WLV KK SN IG CSM NTK WFG QR NKY FKT YN ER KM M ETL SW KD KVA KGY FN SWA EE HTV YH PG QN SLL EG TA SSL EY QSW QVL EG KKL PKV KC SP FC DG EIL KTL N EAI EK SLG EAL SV DA KV SS KQQ YR CC PV F SEE SVL SELL RL TK CL PD EQ GA EP SG PV KC LLVG SPAV CDL QM PAPL EI QLV ESV EL TA FSC SLL H DGD PA YQ HL FL DC LLH SLR RLH RG DV MVL PIL SC FTR FMA GL TF VL HG CFR FI TF SC PT SL EPL R TC AV LLC IG YQ NL PD AV FQ FLQ NV HD LLSK LL HP SA PR QIL QFL PM EALL QG T LLD FL WDL NAA IA KR HL HL II QG ERD QA IG SLEL"
"O55102","ML SRLL KEH QA KQ NER KEL QEK RRR EAI AAAT CL TEAL VD HL NVG VA QA Y MN QR KL DH EV KTL QV QAA QFA KQ TG QW IG MV EN FNQ AL KEI G DV EN WAR SI ELD MR TI AT AL EYV YKG QLQ SA P S"
"Q8R007","MPL SLGA EM WG PEA WLR LL FLA SF TG QY SAG EL ET SD VV TVVL GQ DA KL PC FY RGD PD EQ VG QVA WA RVD PN EG IR ELA LLH SK YGL HV NPA YED RV EQ PPPP RD PL DG SVLL RN AV QAD EG EY EC RV STF PAG SF QA RM RLR VLV PPL PSL NPG PPL EE GQ GL TL AA SC TA EG SPAP SV TW DT EV KG TQ SSR SF TH PR SAA VT SE FHL VP SR SM NG QPL TC VV SH PG LLQD RRI TH TL QVA FLA EA SVR GL ED QNL WQV GR EGA TL KCL SEG QPP PKY N WT RL DG PL PSG V RV KGD TL GF PPL TT EH SGV YV CHV SN ELSS RD SQV TV EVL DP ED PG KQV DLV SA SVI IV GVI AALL FC LLVV VV VLM SR YH RR KA QQM TQ KY EEEL TL TR EN SIR RLH SH HSD PR SQ PEE SVGL RA EG HPD SLKD NSS CSV M SEE PEG R SY STL TTV R EI ET QT ELL SPG SG RT EE DDD QD EG IK QAM NH FV Q ENG TL RA KP TG NG IYI NG RG HLV"
